2222,"2840008295","00028400082952","Funyuns Onion Flavored Rings 6 OZ BAG","6.50OZ FUNYUNS REGULAR","","","FLNA","Funyuns","FLNA","Corporate",True,True
2223,"2840024018","00028400240185","Funyuns Onion Flv Rings (6 Oz)","Funyuns Onion Flavored Rings Snacks 6 Ounces Bag","","","FLNA","Funyuns","FLNA","Corporate",True,True
2221,"2840005880","00028400058803","Funyuns Onion Rings 12Ct (9 Oz)","Funyuns Onion Flavored Rings Snack (0.75 Oz - 12) 9 Ounces 12 Pack Bag","","","FLNA","Funyuns","FLNA","Corporate",True,True
2224,"2840023431","00028400234313","Funyuns Onion Flavored Rings Chile Limon 6 Oz Bag","Funyuns Chili Limon Flavored Onion Rings 6 Ounce Bag","","","FLNA","Funyuns","FLNA","Corporate",True,True
2262,"5200013152","00052000131529","Gatorade G Series 02 Perform G2 Tropical Blend Thirst Quencher Low Cal 32 OZ BTL","Gatorade G2 Tropical Blend Thirst Quencher 32 Fluid Ounce Plastic Bottle","","","Beverages","Gatorade","Gatorade","Corporate",True,True
2260,"5200032256","00052000322569","Gator G2 Pomegrant","Gatorade G2 Perform Low Calorie Blueberry-Pomegranate Thirst Quencher 32 Fluid Ounce Bottle","","","Beverages","Gatorade","Gatorade","Corporate",True,True
2261,"5200013151","00052000131512","Gatorade G Series 02 Perform G2 Raspberry Melon Thirst Quencher Low Cal 32 OZ BTL","GATORADE G2 RASPBERRY MELON   32Z","","","Beverages","Gatorade","Gatorade","Corporate",True,True
2263,"5200010240","00052000102406","Gatorade Tropical Cooler (32 Fo)","Gatorade Thirst Quencher Tropical Cooler 32 Fluid Ounce Plastic Bottle","","","Beverages","Gatorade","Gatorade","Corporate",True,True
2264,"5200032434","00052000324341","Gatorade G Series 02 Perform Original Rain Strawberry Kiwi Thirst Quencher 32 OZ BTL","Gatorade Frost Rain Strawberry Kiwi Thirst Quencher 32 Fluid Ounce Plastic Bottle","","","Beverages","Gatorade","Gatorade","Corporate",True,True
2267,"5200032555","00052000325553","Gatorade Cool Blue (32 Fo)","Gatorade Thirst Quencher Cool Blue 32 Fluid Ounce Bottle ","","","Beverages","Gatorade","Gatorade","Corporate",True,True
2265,"5200013285","00052000132854","Gatorade Citrus Coolr 8Pk (8/20 Fo)","Gatorade Thirst Quencher Citrus Cooler (8 - 20 Fl Oz) 160 Fluid Ounce 8 Pack Plastic Bottles","","","Beverages","Gatorade","Gatorade","Corporate",True,True
2266,"5200020844","00052000208443","Gatorade Cool Blue 8Pk (8/20 Fo)","Gatorade Thirst Quencher Cool Blue Raspberry (8 - 20 Fluid Ounce) 160 Fluid Ounce 8 Pack Plastic Bottle","","","Beverages","Gatorade","Gatorade","Corporate",True,True
2268,"5200010412","00052000104127","Gatorade Blue Cherry 8Pk (8/20 Fo Cr)","Gatorade Thirst Quencher Fierce Blue Cherry (8 - 20 Fl Oz) 160 Fluid Ounce 8 Pack Plastic Bottles","","","Beverages","Gatorade","Gatorade","Corporate",True,True
2269,"5200020811","00052000208115","Gator Fierce Punc 8Pk","Gatorade Fierce Fruit Punch+Berry Thirst Quencher (8-20 Fluid Ounce) 160 Fluid Ounce Plastic Bottles","","","Beverages","Gatorade","Gatorade","Corporate",True,True
2270,"5200020842","00052000208429","Gatorade G Series Fierce Grape Thirst Quencher - 8 Pk 20 Oz Btl","Gatorade Fierce Grape Thirst Quencher (8 - 20 Fluid Ounce) 160 Fluid Ounce 8 Pack Plastic Bottles","","","Beverages","Gatorade","Gatorade","Corporate",True,True
1305,"0","0","Coke Diet - 6 pk 12 OZ CAN","QKRQUAKES  CHEDDAR   3.3Z","","","FLNA","Grandmas","FLNA","Corporate",False,False
2271,"5200032673","00052000326734","Gatorade Frce Grape (32 Fo)","Gatorade Fierce Grape Thirst Quencher 32 Fluid Ounce Plastic Bottle","","","Beverages","Gatorade","Gatorade","Corporate",True,True
2272,"5200010310","00052000103106","Gator Glacr Chry 6Pk","Gatorade Thirst Quencher Frost Glacier Cherry (6 - 12 Fl Oz) 72 Fluid Ounce 6 Pack Plastic Bottles","","","Beverages","Gatorade","Gatorade","Corporate",True,True
2273,"5200010245","00052000102451","Gatorade Glcr Cherry 8Pk (8/20 Fo)","Gatorade Frost Glacier Cherry Thirst Quencher (8-20 Fluid Ounce) 160 Fluid Ounces 8 Pack Plastic Bottles","","","Beverages","Gatorade","Gatorade","Corporate",True,True
2274,"5200033652","00052000336528","Gatorade G Series Frost Glacier Freeze Instant Powder Mix 18.4 Oz Can","Gatorade Instant Powder Mix Frost Glacier Freeze 18.3 OZ","","","Beverages","Gatorade","Gatorade","Corporate",True,True
2276,"5200033582","00052000335828","GATORADE FROST FREEZE","Gatorade Frost Glacier Freeze Thirst Quencher 64 Fluid Ounce Plastic Bottle","","","Beverages","Gatorade","Gatorade","Corporate",True,True
2277,"5200020808","00052000208085","Gatorade Glcr Freeze 8Pk (8/20 Fo)","Gatorade Frost Glacier Freeze Thirst Quencher  (8-20 Fluid Ounce) 160 Fluid Ounce 8 Pack Plastic Bottles","","","Beverages","Gatorade","Gatorade","Corporate",True,True
2275,"5200032016","00052000320169","Gatorade Glacier Freeze (32 Fo)","Gatorade Frost Crisp & Cool Glacier Freeze Thirst Quencher 32 Fluid Ounce Plastic Bottle","","","Beverages","Gatorade","Gatorade","Corporate",True,True
2278,"5200032212","00052000322125","Gatorade G Series Frost Orange Strawberry Thirst Quencher 32 Oz Btl","Gatorade Frost Orange Strawberry Thirst Quencher 32 Fluid Ounce Plastic Bottle","","","Beverages","Gatorade","Gatorade","Corporate",True,True
2280,"5200032012","00052000320121","Gatorade Frst Rptde Rsh (32 Fo)","Gatorade Frost Riptide Rush Thirst Quencher 32 Fluid Ounce Plastic Bottle","","","Beverages","Gatorade","Gatorade","Corporate",True,True
2282,"5200012936","00052000129366","Gator All Star Frt 6P","Gatorade Thirst Quencher Fruit Punch (6 - 12 Fluid Ounce) 72 Fluid Ounce 6 Pack Plastic Bottles","","","Beverages","Gatorade","Gatorade","Corporate",True,True
2284,"5200033875","00052000338751","Gatorade Fruit Punch (32 Fo)","Gatorade Thirst Quencher Fruit Punch 32 Fluid Ounce Plastic Bottle","","","Beverages","Gatorade","Gatorade","Corporate",True,True
2285,"5200033830","00052000338300","Gatorade Fruit Punch (64 Fo)","Gatorade Thirst Quencher Fruit Punch 64 Fluid Ounce Plastic Bottle","","","Beverages","Gatorade","Gatorade","Corporate",True,True
1331,"4141939866","","Combos Snacks Pretzel Pizzeria 15 OZ BAG","","","","Beverages","Izze","NEB","Corporate",False,False
2289,"5200012934","00052000129342","Gator All Star Ll 6P","Gatorade Thirst Quencher Lemon-Lime (6 - 12 Fl Oz) 72 Fluid Ounce 6 Pack Plastic Bottles","","","Beverages","Gatorade","Gatorade","Corporate",True,True
2281,"5200032213","00052000322132","Gator Frost Trop Mngo","Gatorade Frost Tropical Mango Thirst Quencher 32 Fluid Ounce Bottle ","","","Beverages","Gatorade","Gatorade","Corporate",True,True
2283,"5200020806","00052000208061","Gatorade Fruit Punch 8Pk (8/20 Fo)","Gatorade Fruit Punch Thirst Quencher (8 - 20 Fluid Ounce) 160 Fluid Ounce 8 Pack Plastic Bottles","","","Beverages","Gatorade","Gatorade","Corporate",True,True
2287,"5200012174","00052000121742","Gator All Str Pnch 6P","Gatorade Thirst Quencher Ice Punch (6 - 12 Fl Oz) 72 Fluid Ounce 6 Pack Plastic Bottles","","","Beverages","Gatorade","Gatorade","Corporate",True,True
1332,"4141978047","","Combos Snacks Pretzel Pizzeria 15 OZ BAG","","","","Beverages","Izze","NEB","Corporate",False,False
2294,"5200032180","00052000321807","Gatorade Perform Lemonade (32 Fo)","Gatorade Thirst Quencher Lemonade 32 Fluid Ounce Plastic Bottle","","","Beverages","Gatorade","Gatorade","Corporate",True,True
2296,"5200020807","00052000208078","Gatorade Orange 8Pk (8/20 Fo)","Gatorade Thirst Quencher Orange (8 - 20 Fluid Ounce) 160 Fluid Ounce 8 Pack Plastic Bottles","","","Beverages","Gatorade","Gatorade","Corporate",True,True
2297,"5200003940","0005200003940","Gatorade G Series Orange Thirst Quencher 32 OZ BTL","GA LQ CRE 32OZ 12CS ORANGE","","","Beverages","Gatorade","Gatorade","Corporate",True,True
2299,"5200033831","00052000338317","Gatorade Orange (64 Fo)","Gatorade Orange Thirst Quencher 64 Fluid Ounce Plastic Bottle","","","Beverages","Gatorade","Gatorade","Corporate",True,True
2279,"5200020809","00052000208092","Gatorade G Series Frost Riptide Rush Thirst Quencher - 8 Pk 20 Oz Btl","Gatorade Frost Riptide Rush Thirst Quencher (8 - 20 Fluid Ounce) 160 Fluid Ounce 8 Pack Plastic Bottle","","","Beverages","Gatorade","Gatorade","Corporate",True,True
2291,"5200033776","00052000337761","Gator 1 Gal Lemlime","Gatorade Thirst Quencher Lemon Lime 128 Fluid Ounce Plastic Bottle","","","Beverages","Gatorade","Gatorade","Corporate",True,True
2300,"5200012125","00052000121254","Gator All Star Bry 6P","Gatorade Thirst Quencher Berry (6 - 12 Fl Oz) 72 Fluid Ounce 6 Pack Plastic Bottles","","","Beverages","Gatorade","Gatorade","Corporate",True,True
2290,"5200020805","00052000208054","Gatorade Lemon Lime 8Pk (8/20 Fo)","Gatorade Lemon Lime Thirst Quencher (8-20 Fluid Ounce) 160 Fluid Ounce 8 Pack Plastic Bottles","","","Beverages","Gatorade","Gatorade","Corporate",True,True
2292,"5200033877","00052000338775","Gatorade Lemon Lime (32 Fo)","Gatorade Lemon-Lime Thirst Quencher 32 Fluid Ounce Bottle ","","","Beverages","Gatorade","Gatorade","Corporate",True,True
2293,"5200033832","00052000338324","Gatorade Lemon Lime (64 Fo)","Gatorade Lemon Lime 64 Fluid Ounce Plastic Bottle","","","Beverages","Gatorade","Gatorade","Corporate",True,True
2301,"5200004003","00052000040036","GATORADE BERRY PRIME","Gatorade Prime Sports Fuel Drink Berry 4 Fluid Ounce Plastic Bag","","","Beverages","Gatorade","Gatorade","Corporate",True,True
2302,"5200013448","00052000134483","Gatorade Prm Blue Chws (1 Oz)","Gatorade Prime Energy Chews Cool Blue 1 Ounce Sleeve","","","Beverages","Gatorade","Gatorade","Corporate",True,True
2305,"5200004004","00052000040043","GATORADE FRUIT PUNCH PRIME","Gatorade Prime Sports Fuel Drink Fruit Punch 4 Fluid Ounce Plastic Bag","","","Beverages","Gatorade","Gatorade","Corporate",True,True
2311,"5200020162","00052000201628","Gatorade G Series Variety (Punch/Lemon-Lime/Orange) Thirst Quencher 12 Pk 20 Oz Btl","Gatorade Thirst Quencher Variety Pack (12 - 20 Fluid Ounce) 240 Fluid Ounce 12 Pack Plastic Bottles","","","Beverages","Gatorade","Gatorade","Corporate",True,True
2312,"5200012324","00052000123241","Gatorade Variety 18Pk (18/12 Fo)","Gatorade  Thirst Quencher Variety Pack (18 - 12 Fl Oz) 216 Fluid Ounce 18 Pack Plastic Bottles","","","Beverages","Gatorade","Gatorade","Corporate",True,True
2286,"5200012107","00052000121070","Gatorade G Series Grape Thirst Quencher - 6 pk 12 OZ BTL","Gatorade Thirst Quencher Fierce Grape (6 - 12 Fl Oz) 72 Fluid Ounce 6 Pack Plastic Bottles","","","Beverages","Gatorade","Gatorade","Corporate",True,True
2288,"5200003962","00052000039627","GATORADE LEMON LIME PWDR 18.4 OZ","Gatorade Instant Powder Mix Lemon Lime 18.30Z","","","Beverages","Gatorade","Gatorade","Corporate",True,True
2298,"5200033876","00052000338768","Gatorade Orange (32 Fo)","Gatorade Thirst Quencher Orange 32 Fluid Ounce Bottle","","","Beverages","Gatorade","Gatorade","Corporate",True,True
2303,"5200013446","00052000134469","Gatorade Prm Fr Pnch Chws (1 Oz)","Gatorade Prime Energy Chews Fruit Punch 1 Ounce Sleeve","","","Beverages","Gatorade","Gatorade","Corporate",True,True
2304,"5200013447","00052000134476","Gatorade G Series Prime Energy Chews Orange - 6 ct 1 OZ PKG","Gatorade Prime Energy Chews Orange 1 Ounce Sleeve","","","Beverages","Gatorade","Gatorade","Corporate",True,True
2309,"5200013456","00052000134568","Gator  Strwwtr 8Pk","Gatorade Thirst Quencher Strawberry Watermelon 20 Fluid Ounce 8 Pack Plastic Bottles ","","","Beverages","Gatorade","Gatorade","Corporate",True,True
2315,"5200020870","00052000208702","Gatorade G2 Frt Punch 8Pk (8/20 Fo)","Gatorade Thirst Quencher Low Calorie Fruit Punch (8 - 20 Fluid Ounce) 160 Fluid Ounce 8 Pack Plastic Bottle","","","Beverages","Gatorade","Gatorade","Corporate",True,True
2295,"5200012935","00052000129359","Gator All Star Org 6P","Gatorade Thirst Quencher Orange (6 - 12 Fluid Ounce) 72 Fluid Ounce 6 Pack Plastic Bottles","","","Beverages","Gatorade","Gatorade","Corporate",True,True
2314,"5200020972","00052000209723","Gatorade G2 Series Blueberry Pomegranate Thirst Quencher Low Calorie 8 pk 20 OZ BTL","Gatorade G2 Low Calorie Blueberry Pomegranate  (8 - 16 Fluid Ounce) 128 Fluid Ounce 8 Pack Plastic Bottle","","","Beverages","Gatorade","Gatorade","Corporate",True,True
2316,"5200032198","00052000321982","Gatorade G2 Fruit Punch (32 Fo)","Gatorade G2 Low Calories Fruit Punch Thirst Quencher 32 Fluid Ounce Bottle. ","","","Beverages","Gatorade","Gatorade","Corporate",True,True
2319,"5200020021","00052000200218","Gatorade G2 Glcr Frz 8Pk (8/20 Fo)","Gatorade Thirst Quencher Low Calorie Glacier Freeze (8 - 20 Fl Oz) 160 Fluid Ounce 8 Pack Plastic Bottles","","","Beverages","Gatorade","Gatorade","Corporate",True,True
2322,"5200020871","00052000208719","Gatorade G2 Grape 8Pk (8/20 Fo)","Gatorade G2 Low Calorie Grape Thirst Quencher (8 - 20 Fluid Ounce) 160 Fluid Ounce 8 Pack Plastic Bottles","","","Beverages","Gatorade","Gatorade","Corporate",True,True
2306,"5200032431","00052000324310","Gatorade Frst Rain Berry (32 Fo)","Gatorade Frost Rain Berry Thirst Quencher 32 Fluid Ounce Plastic Bottle","","","Beverages","Gatorade","Gatorade","Corporate",True,True
2307,"5200050111","00052000501117","Gatorade G Series Recover Mixed Berry Protein Recovery Beverage 16.9 OZ BTL","Gatorade Mixed Berry Protein Recovery Beverage 16.9 Fluid Ounce Plastic Bottle","","","Beverages","Gatorade","Gatorade","Corporate",True,True
2308,"5200010425","00052000104257","Gatorade G Series Strawberry Lemonade Thirst Quencher - 8 Pk 20 Oz Btl","Gatorade Thirst Quencher Strawberry Lemonade (8 - 20 Fl Oz) 160 Fluid Ounce 8 Pack Plastic Bottles","","","Beverages","Gatorade","Gatorade","Corporate",True,True
2310,"5200013331","00052000133318","Gatorade G Series Variety (Cool Blue/Riptide/Glacier) Thirst Quencher 12Pk 20 Oz Btl","Gatorade Thirst Quencher Variety (12 - 20 Fluid Ounce) 240 Fluid Ounce 12 Pack Plastic Bottle","","","Beverages","Gatorade","Gatorade","Corporate",True,True
2313,"5200010239","00052000102390","Gatorade Glacier Cherry (32 Fo)","Gatorade Frost Glacier Cherry Thirst Quencher 32 Fluid Ounce Bottle.","","","Beverages","Gatorade","Gatorade","Corporate",True,True
2318,"5200012006","00052000120066","Gator G2 Glcr 6P","Gatorade G2 Thirst Quencher Low Calorie Glacier Freeze (6 - 12 Fl Oz) 72 Fluid Ounce 6 Pack Plastic Bottles","","","Beverages","Gatorade","Gatorade","Corporate",True,True
2321,"5200012161","00052000121612","Gatorade G2 Series Grape Thirst Quencher Low Calorie - 6 Pk 12 Oz Btl","Gatorade G2 Low Calorie Grape Thirst Quencher (6 - 12 Fl Oz) 72 Fluid Ounce 6 Pack Plastic Bottles","","","Beverages","Gatorade","Gatorade","Corporate",True,True
2327,"5200020407","00052000204070","Gatorade G2 Series Orange Thirst Quencher Low Calorie 20 OZ BTL","Gatorade G2 Orange Thirst Quencher  20 Fluid Ounce Plastic Bottle","","","Beverages","Gatorade","Gatorade","Corporate",True,True
2323,"5200032199","00052000321999","Gatorade G2 Grape (32 Fo)","Gatorade G2 Low Calorie Grape Thirst Quencher 32 Fluid Ounce Plastic Bottle","","","Beverages","Gatorade","Gatorade","Corporate",True,True
2325,"5200032251","00052000322514","Gatorade G2 Lemon Lime (32 Fo)","Gatorade G2 Low Calories Lemon-Lime Thirst Quencher 32 Fluid Ounce Plastic Bottle.","","","Beverages","Gatorade","Gatorade","Corporate",True,True
1352,"4171011351","0004171011351","CRUSH ORANGE 12PK 12/12 FO","12OZ CN CRSH ORG/GRP/STW 12/3FM OLD","","","Beverages","Crush","PBC","Allied",True,True
1353,"7800001305","0007800001305","CRUSH ORANGE 12PK 12/12 FO","CRSH ORNG 12OZCN12FM2X6(2)","","","Beverages","Crush","PBC","Allied",True,True
1354,"7800001309","0007800001309","CRUSH ORANGE 24PK 24/12 FO","12OZ CN CRSH ORG 24/1CB CLB","","","Beverages","Crush","PBC","Allied",True,True
1357,"7800001336","0007800001336","CRUSH ORANGE 2 LT","CRSH ORNG 2LTRPLSNGL (8)","","","Beverages","Crush","PBC","Allied",True,True
1358,"7800001328","0007800001328","CRUSH ORANGE 20 FO","CRSH ORNG 20OZPLSGL(24)","","","Beverages","Crush","PBC","Allied",True,True
2317,"5200064000","00052000640007","Gatorade G2 Series Fruit Punch Thirst Quencher Low Calorie 64 OZ BTL","GATORADE  FRUIT PUNCH   64Z/8","","","Beverages","Gatorade","Gatorade","Corporate",True,True
2320,"5200032015","00052000320152","Gatorade G2 Glcr Freeze (32 Fo)","Gatorade G2 Glacier Freeze Thirst Quencher 32 Fluid Ounce Plastic Bottle","","","Beverages","Gatorade","Gatorade","Corporate",True,True
2324,"5200020968","00052000209686","Gator G2 Lemlime 8Pk","Gatorade Thirst Quencher Low Calorie Lemon-Lime (8 - 20 Fl Oz) 160 Fluid Ounce 8 Pack Plastic Bottles","","","Beverages","Gatorade","Gatorade","Corporate",True,True
2326,"5200020872","00052000208726","Gatorade G2 Orange 8Pk (8/20 Fo)","Gatorade Thirst Quencher Low Calorie Orange (8 - 20 Fl Oz) 160 Fluid Ounce 8 Pack Plastic Bottles","","","Beverages","Gatorade","Gatorade","Corporate",True,True
1345,"3000002913","00030000029138","Cracker Jack Orig Pbo","Cracker Jack The Original Caramel Coated Popcorn & Peanuts 1oz 3PK Box","","","FLNA","Cracker Jack","FLNA","Corporate",True,True
1350,"7800001345","0007800001345","CRUSH GRAPE 12PK 12/12 FO","CRSH GRP 12OZCN12PK3X4(2)","","","Beverages","Crush","PBC","Allied",True,True
1362,"7800001389","0007800001389","CRUSH DIET ORANGE 12PK 12/12 FO","DTCRSHORN 12OZCN12FM2X6(2)","","","Beverages","Crush","PBC","Allied",True,True
1359,"4171019288","0004171019288","Crush Orange Soda Caffeine Free Diet 2 LTR BTL","2L PL DT CRSH ORG 1/8S DEP OLD","","","Beverages","Crush","PBC","Allied",True,True
2329,"5200013455","00052000134551","Gator 02 Rsplmn 8Pk","Gatorade G2 Raspberry Lemonade (8 - 20 Fluid Ounce) 160 Fluid Ounce 8 Pack Plastic Bottle","","","Beverages","Gatorade","Gatorade","Corporate",True,True
2328,"5200032217","00052000322170","Gator G2 Orange","Gatorade G2 Orange Thirst Quencher 32 Fluid Ounce Plastic Bottle","","","Beverages","Gatorade","Gatorade","Corporate",True,True
1355,"7800001325","0007800001325","CRUSH ORANGE 6PK 6/16.9 FO","CRSH ORNG 16.9OZPL6PK(4)","","","Beverages","Crush","PBC","Allied",True,True
1356,"4171011288","0004171011288","Crush Orange Soda Caffeine Free 2 LTR BTL","2L PL CRSH ORG FSV OLD","","","Beverages","Crush","PBC","Allied",True,True
1360,"7800001397","0007800001397","CRUSH DIET ORANGE 2 LT","DTCRSHORN 2LTRPLSNGL (8)","","","Beverages","Crush","PBC","Allied",True,True
1351,"7800001356","0007800001356","CRUSH GRAPE 2 LT","CRSH GRP 2LTRPLSNGL (8)","","","Beverages","Crush","PBC","Allied",True,True
2332,"5200010109","00052000101096","Gatorade Rcvr Choc Shake (11.16 Fo)","Gatorade Recover Chocolate Protein Shake 11.16Oz Plastic Bottle","","","Beverages","Gatorade","Gatorade","Corporate",True,True
2334,"5200010388","00052000103885","Gatorade G Series Peanut Butter Chocolate Recover Protein Shake 11.1 Oz Btl","Gatorade Recover Protein Shake Peanut Butter Chocolate 11.16 Fluid Ounce Plastic Bottle","","","Beverages","Gatorade","Gatorade","Corporate",True,True
2333,"5200010389","00052000103892","Gatorade Rcvr Cky Crm Shk (11.16 Fo)","Gatorade Recover Cookie Cream Protein Shake 11.16Oz Plastic Bottle","","","Beverages","Gatorade","Gatorade","Corporate",True,True
1361,"4171019350","0004171019350","Crush Orange Soda Diet Caffeine Free - 12 pk 12 OZ CAN","Crush Orange Soda Diet Caffeine Free - 12 pk 12 OZ CAN","","","Beverages","Crush","PBC","Allied",True,True
2330,"5200013329","00052000133295","Gatorade G2 Series Variety (Punch/Glacier/Grape) Thirst Quencher 12 pk 20 OZ BTL","Gatorade G2 Low Calorie Variety (12 - 20 Fluid Ounce) 240 Fluid Ounce 12 Pack Plastic Bottle","","","Beverages","Gatorade","Gatorade","Corporate",True,True
2331,"5200013124","00052000131246","Gatorade G2 Variety","Gatorade G2 Low Calorie FrtPnch/GlcrFrz/Grpe Variety Pack (18 - 12 Fl Oz) 216 Fluid Ounce 18 Pack Plastic Bottles","","","Beverages","Gatorade","Gatorade","Corporate",True,True
2336,"5200010406","00052000104066","Gatorade Blue Cherry (32 Fo)","Gatorade Fierce Blue Cherry Thirst Quencher 32 Fluid Ounce Bottle. ","","","Beverages","Gatorade","Gatorade","Corporate",True,True
2337,"5200010296","00052000102963","Gator Straw Lem Qt","Gatorade Strawberry Lemonade Thirst Quncher 32 Fluid Ounce Bottle. ","","","Beverages","Gatorade","Gatorade","Corporate",True,True
2335,"5200010110","00052000101102","Gatorade Rcvr Vnlla Shake (11.16 Fo)","Gatorade Recover Protein Shake Vanilla 11.16 Fluid Ounce Plastic Bottle","","","Beverages","Gatorade","Gatorade","Corporate",True,True
3657,"3800080661","","Kellogg's Special K Hot Cereal Multi-Grain Blend Cranberry Almond - 2 pk 3.7 OZ CUP","","","","Beverages","7 Up","PBC","Allied",False,False
3658,"3800094090","","Kellogg's Special K Hot Cereal Multi-Grain Blend Cranberry Almond - 2 pk 3.7 OZ CUP","","","","Beverages","7 Up","PBC","Allied",False,False
3659,"3800080681","","Kellogg's Special K Hot Cereal Multi-Grain Cinnamon Raisin Pecan - 2 pk 3.7 OZ CUP","","","","Beverages","7 Up","PBC","Allied",False,False
2455,"1600044307","0001600044307","General Mills Ocean Spray Fruit Flavored Snacks Assorted Fruit - 10 ct 8 OZ BOX","General Mills Ocean Spray Fruit Flavored Snacks Assorted Fruit - 10 ct 8 OZ BOX","","","Beverages","Ocean Spray","PBC","JV",False,True
3851,"2100003217","0002100003217","Kraft Macaroni & Cheese Dinner Veggie Pasta Original Flavor 5.5 OZ BOX","Kraft Macaroni & Cheese Dinner Veggie Pasta Original Flavor 5.5 OZ BOX","","","Quaker","Pasta Roni","Quaker","Corporate",False,False
2539,"68826704479","0068826704479","Giant Pasta Alphabets Enriched Macaroni 100% Durum Semolina 12 OZ BOX","Giant Pasta Alphabets Enriched Macaroni 100% Durum Semolina 12 OZ BOX","","","Quaker","Pasta Roni","Quaker","Corporate",False,False
2541,"68826707196","0068826707196","Giant Pasta Spaghetti 48 OZ BOX","Giant Pasta Spaghetti 48 OZ BOX","","","Quaker","Pasta Roni","Quaker","Corporate",False,False
2540,"68826704321","0068826704321","Giant Pasta Ribbons Wide Yolk-Free 12 OZ BAG","Giant Pasta Ribbons Wide Yolk-Free 12 OZ BAG","","","Quaker","Pasta Roni","Quaker","Corporate",False,False
2543,"68826727192","0068826727192","Giant Pasta Wagon Wheels 16 OZ BOX","Giant Pasta Wagon Wheels 16 OZ BOX","","","Quaker","Pasta Roni","Quaker","Corporate",False,False
