3419	3010053428	NULL	Keebler Right Bites 100 Cal Variety Packs (Fudge Shoppe/Cheez-It)-12 pk 8.8 OZ BOX	NULL	NULL	NULL	<UnAssigned>	<UnAssigned>	<UnAssigned>	<UnAssigned>	0	0	0030100534281	ALL KEEBLER PRODUCTS ASSORTED ASSORTED ASSORTED 1 CT 8.88 OZ 	COOKIES	COOKIES	PEPSICO REVIEWS CATEGORIES US	COOKIES	NULL	NULL	NULL	NULL	NULL	NULL	KELLOGG CO	Kellogg Company	KELLOGG CO	ALL KEEBLER PRODUCTS ASSORTED ASSORTED ASSORTED 1 CT 8.88 OZ 	Keebler Right Bites 100 Cal Variety Packs (Fudge Shoppe/Cheez-It)-12 pk 8.8 OZ BOX	Keebler Right Bites 100 Cal Variety Packs (Fudge Shoppe/Cheez-It)-12 pk 8.8 OZ BOX	0	0	1	Other	ALL KEEBLER PRODUCTS	KEEBLER	KELLOGG CO	0	ShiptShare	NULL	NULL	NULL	NULL	NULL	NULL	NULL	NULL	NULL	NULL	179472	N/A	1 CT	NULL	NULL	NULL	NULL	NULL	NULL	NULL	NULL	FirstIRIMtch	<UnAssigned>	NULL	NULL	2016-02-02 02:29:46.550	NULL	<UnAssigned>	<UnAssigned>	<UnAssigned>	0	-1	NULL	NULL	COOKIES	Extended Macrosnacks	TOTAL MACROSNACKS
33	2200011602	NULL	5 Sugar Free Gum An Electric Watermelon Prism Single Pack 15 CT PKG	NULL	NULL	NULL	<UnAssigned>	<UnAssigned>	<UnAssigned>	<UnAssigned>	0	0	0022000116021	WRIGLEYS 5 PRISM WATERMELON CHEWING GUM SUGAR FREE 15 CT 1.5 OZ 	PEPSICO REVIEWS CATEGORIES US	GUM	PEPSICO REVIEWS CATEGORIES US	GUM	NULL	NULL	NULL	NULL	NULL	NULL	MARS INC	Mars Incorporated	MARS INC	WRIGLEYS 5 PRISM WATERMELON CHEWING GUM SUGAR FREE 15 CT 1.5 OZ 	5 Sugar Free Gum An Electric Watermelon Prism Single Pack 15 CT PKG	5 Sugar Free Gum An Electric Watermelon Prism Single Pack 15 CT PKG	0	0	1	Other	WRIGLEYS 5 PRISM	WRIGLEYS	WILLIAM WRIGLEY JR. CO	0	ShiptShare	NULL	NULL	NULL	NULL	NULL	NULL	NULL	NULL	NULL	NULL	171713	N/A	15 CT	NULL	NULL	NULL	NULL	NULL	NULL	NULL	NULL	FirstIRIMtch	<UnAssigned>	NULL	NULL	2016-02-02 02:29:46.550	NULL	<UnAssigned>	<UnAssigned>	<UnAssigned>	0	-1	NULL	NULL	NON-PEP CATEGORIES	NON-PEP CATEGORIES	NON-PEP CATEGORIES
34	71941070002	NULL	5-Hr Enrgy Es Bry 2Pk	NULL	NULL	NULL	<UnAssigned>	<UnAssigned>	<UnAssigned>	<UnAssigned>	0	0	0719410700021	5 HOUR ENERGY EXTRA STRENGTH ENERGY SHOT BERRY 2 CT 3.86 OZ 	ENERGY DRINKS	ENERGY	ENERGY DRINKS CMBND	ENERGY	NULL	NULL	NULL	NULL	NULL	NULL	LIVING ESSENTIALS LLC	Innovation Ventures Llc	LIVING ESSENTIALS LLC	5 HOUR ENERGY EXTRA STRENGTH ENERGY SHOT BERRY 2 CT 3.86 OZ 	5-Hr Enrgy Es Bry 2Pk	5-Hr Enrgy Es Bry 2Pk	0	0	1	Other	5 HOUR ENERGY EXTRA STRENGTH	5 HOUR ENERGY	CHASER 5 HOUR ENERGY	0	PeapodShare	NULL	NULL	NULL	NULL	NULL	NULL	NULL	NULL	NULL	NULL	116156	N/A	2 CT	1.93	NULL	NULL	NULL	NULL	NULL	NULL	NULL	ElvnDgtIRIMtch	<UnAssigned>	NULL	NULL	2016-02-02 02:29:46.550	NULL	<UnAssigned>	<UnAssigned>	<UnAssigned>	0	-1	NULL	NULL	ENERGY	Beverages RTD	PAB LRB
2152	2840008404	00028400084048	Mnch Cheese Fix Snack Mix (8 Oz)	Munchies Cheese Fix Snack Mix 8 Ounce Plastic Bag	NULL	NULL	FLNA	Munchies	FLNA	Corporate	1	1	2840008404	MNCH CHEESE FIX SNACK MIX 8 OZ	SALTY SNACKS	SNACK MIX	SALTY SNACKS	SNACK MIX	NULL	NULL	Munchies	NULL	Mainstream	NULL	PEPSICO INC	Pepsico Inc	PEPSICO INC	MNCH CHEESE FIX SNACK MIX 8 OZ	Munchies Cheese Fix Snack Mix 8 Ounce Bag	Munchies Cheese Fix Snack Mix 8 Ounce Plastic Bag	0	0	1	Other	NULL	NULL	FRITO LAY	0	PeapodShare	1	0	508.5	3.78	704.34	NULL	NULL	NULL	NULL	17803	744278	NULL	NULL	NULL	0	0	SNACK MIXES W/O NUTS TAKE HOME BAG/CAN SNACKS	8 OZ	15240687	NULL	ROLD GOLD	FirstIRIMtch	Corporate	00028400084048	Munchies Cheese Fix Snack Mix 8 Ounce Bag	2016-02-02 02:29:46.550	NULL	FLNA	Portfolio Marketing	Munchies	0	85	XL	12	CRACKERS	Savory Snacks	TOTAL MACROSNACKS
1161	81829001385	NULL	Chob Grk 2 Ssnl A	NULL	NULL	NULL	<UnAssigned>	<UnAssigned>	<UnAssigned>	<UnAssigned>	0	0	0818290013851	CHOBANI LIMITED EDITION YOGURT RFG 1 CT 5.3 OZ 	PEPSICO REVIEWS CATEGORIES US	YOGURT	PEPSICO REVIEWS CATEGORIES US	YOGURT	NULL	NULL	NULL	NULL	NULL	NULL	CHOBANI INC	Chobani Inc	CHOBANI INC	CHOBANI LIMITED EDITION YOGURT RFG 1 CT 5.3 OZ 	Chob Grk 2 Ssnl A	Chob Grk 2 Ssnl A	0	0	1	Other	CHOBANI	CHOBANI	CHOBANI INC	0	PeapodShare	NULL	NULL	NULL	NULL	NULL	NULL	NULL	NULL	NULL	NULL	282878	N/A	1 CT	NULL	NULL	NULL	NULL	NULL	NULL	NULL	NULL	ElvnDgtIRIMtch	<UnAssigned>	NULL	NULL	2016-02-02 02:29:46.550	NULL	<UnAssigned>	<UnAssigned>	<UnAssigned>	0	-1	NULL	NULL	DAIRY	NON-PEP CATEGORIES	NON-PEP CATEGORIES
1162	89470001017	NULL	Chobani Greek Fruit on the Bottom Yogurt Apple Cinnamon 0% Non Fat Natural 5.3 OZ CUP	NULL	NULL	NULL	<UnAssigned>	<UnAssigned>	<UnAssigned>	<UnAssigned>	0	0	0894700010172	CHOBANI APPLE CINNAMON YOGURT RFG 1 CT 5.3 OZ 	PEPSICO REVIEWS CATEGORIES US	YOGURT	PEPSICO REVIEWS CATEGORIES US	YOGURT	NULL	NULL	NULL	NULL	NULL	NULL	CHOBANI INC	Chobani Inc	CHOBANI INC	CHOBANI APPLE CINNAMON YOGURT RFG 1 CT 5.3 OZ 	Chobani Greek Fruit on the Bottom Yogurt Apple Cinnamon 0% Non Fat Natural 5.3 OZ CUP	Chobani Greek Fruit on the Bottom Yogurt Apple Cinnamon 0% Non Fat Natural 5.3 OZ CUP	0	0	1	Other	CHOBANI	CHOBANI	CHOBANI INC	0	PeapodShare	NULL	NULL	NULL	NULL	NULL	NULL	NULL	NULL	NULL	NULL	294655	N/A	1 CT	NULL	NULL	NULL	NULL	NULL	NULL	NULL	NULL	ElvnDgtIRIMtch	<UnAssigned>	NULL	NULL	2016-02-02 02:29:46.550	NULL	<UnAssigned>	<UnAssigned>	<UnAssigned>	0	-1	NULL	NULL	DAIRY	NON-PEP CATEGORIES	NON-PEP CATEGORIES
1166	89470001016	NULL	Chob Grk 0 Blk Chrry	NULL	NULL	NULL	<UnAssigned>	<UnAssigned>	<UnAssigned>	<UnAssigned>	0	0	89470001016	CHBN BLACK CHRRY GRK YGRT 5.3 OZ	NON PEP CATEGORY	NON PEP CATEGORY	PEPSICO REVIEWS CATEGORIES US	YOGURT	NULL	NULL	NULL	NULL	NULL	NULL	CHOBANI INC	Chobani Inc	CHOBANI INC	CHBN BLACK CHRRY GRK YGRT 5.3 OZ	Chob Grk 0 Blk Chrry	Chob Grk 0 Blk Chrry	0	0	1	Other	NULL	NULL	AGRO-FARMA	0	PeapodShare	NULL	NULL	NULL	NULL	NULL	NULL	NULL	NULL	NULL	NULL	765649	NULL	NULL	NULL	NULL	NULL	NULL	NULL	NULL	NULL	NULL	FirstIRIMtch	<UnAssigned>	NULL	NULL	2016-02-02 02:29:46.550	NULL	<UnAssigned>	<UnAssigned>	<UnAssigned>	0	-1	NULL	NULL	NON PEP CATEGORY	NON PEP CATEGORY	NON PEP CATEGORY
1170	89470001005	NULL	Chob Grk 0 Blueberry	NULL	NULL	NULL	<UnAssigned>	<UnAssigned>	<UnAssigned>	<UnAssigned>	0	0	89470001005	CHBN BLUEBERRY GRK YOGURT 5.3 OZ	NON PEP CATEGORY	NON PEP CATEGORY	PEPSICO REVIEWS CATEGORIES US	YOGURT	NULL	NULL	NULL	NULL	NULL	NULL	CHOBANI INC	Chobani Inc	CHOBANI INC	CHBN BLUEBERRY GRK YOGURT 5.3 OZ	Chob Grk 0 Blueberry	Chob Grk 0 Blueberry	0	0	1	Other	NULL	NULL	AGRO-FARMA	0	PeapodShare	NULL	NULL	NULL	NULL	NULL	NULL	NULL	NULL	NULL	NULL	758408	NULL	NULL	NULL	NULL	NULL	NULL	NULL	NULL	NULL	NULL	FirstIRIMtch	<UnAssigned>	NULL	NULL	2016-02-02 02:29:46.550	NULL	<UnAssigned>	<UnAssigned>	<UnAssigned>	0	-1	NULL	NULL	NON PEP CATEGORY	NON PEP CATEGORY	NON PEP CATEGORY
1172	89470001011	NULL	Chob Grk 2 Passn Frt	NULL	NULL	NULL	<UnAssigned>	<UnAssigned>	<UnAssigned>	<UnAssigned>	0	0	89470001011	CHBN PASSION FRT GRK YGRT 5.3 OZ	NON PEP CATEGORY	NON PEP CATEGORY	PEPSICO REVIEWS CATEGORIES US	YOGURT	NULL	NULL	NULL	NULL	NULL	NULL	CHOBANI INC	Chobani Inc	CHOBANI INC	CHBN PASSION FRT GRK YGRT 5.3 OZ	Chob Grk 2 Passn Frt	Chob Grk 2 Passn Frt	0	0	1	Other	NULL	NULL	AGRO-FARMA	0	PeapodShare	NULL	NULL	NULL	NULL	NULL	NULL	NULL	NULL	NULL	NULL	757307	NULL	NULL	NULL	NULL	NULL	NULL	NULL	NULL	NULL	NULL	FirstIRIMtch	<UnAssigned>	NULL	NULL	2016-02-02 02:29:46.550	NULL	<UnAssigned>	<UnAssigned>	<UnAssigned>	0	-1	NULL	NULL	NON PEP CATEGORY	NON PEP CATEGORY	NON PEP CATEGORY
1173	81829001284	NULL	Chob Grk Peach 4Pk	NULL	NULL	NULL	<UnAssigned>	<UnAssigned>	<UnAssigned>	<UnAssigned>	0	0	81829001284	CHBN FOB PEACH GRK YOGURT 4/5.3 OZ	NON PEP CATEGORY	NON PEP CATEGORY	PEPSICO REVIEWS CATEGORIES US	YOGURT	NULL	NULL	NULL	NULL	NULL	NULL	CHOBANI INC	Chobani Inc	CHOBANI INC	CHBN FOB PEACH GRK YOGURT 4/5.3 OZ	Chob Grk Peach 4Pk	Chob Grk Peach 4Pk	0	0	1	Other	NULL	NULL	CHOBANI	0	PeapodShare	NULL	NULL	NULL	NULL	NULL	NULL	NULL	NULL	NULL	NULL	762692	NULL	NULL	NULL	NULL	NULL	NULL	NULL	NULL	NULL	NULL	FirstIRIMtch	<UnAssigned>	NULL	NULL	2016-02-02 02:29:46.550	NULL	<UnAssigned>	<UnAssigned>	<UnAssigned>	0	-1	NULL	NULL	NON PEP CATEGORY	NON PEP CATEGORY	NON PEP CATEGORY
35	71941070006	NULL	5-Hr Enrgy Xs Bry 6Pk	NULL	NULL	NULL	<UnAssigned>	<UnAssigned>	<UnAssigned>	<UnAssigned>	0	0	0719410700061	5 HOUR ENERGY EXTRA STRENGTH ENERGY SHOT BERRY 4 CALORIES 6 CT 11.58 OZ 	ENERGY DRINKS	ENERGY	ENERGY DRINKS CMBND	ENERGY	NULL	NULL	NULL	NULL	NULL	NULL	LIVING ESSENTIALS LLC	Innovation Ventures Llc	LIVING ESSENTIALS LLC	5 HOUR ENERGY EXTRA STRENGTH ENERGY SHOT BERRY 4 CALORIES 6 CT 11.58 OZ 	5-Hr Enrgy Xs Bry 6Pk	5-Hr Enrgy Xs Bry 6Pk	0	0	1	Other	5 HOUR ENERGY EXTRA STRENGTH	5 HOUR ENERGY	CHASER 5 HOUR ENERGY	0	PeapodShare	NULL	NULL	NULL	NULL	NULL	NULL	NULL	NULL	NULL	NULL	116158	N/A	6 CT	1.93	NULL	NULL	NULL	NULL	NULL	NULL	NULL	ElvnDgtIRIMtch	<UnAssigned>	NULL	NULL	2016-02-02 02:29:46.550	NULL	<UnAssigned>	<UnAssigned>	<UnAssigned>	0	-1	NULL	NULL	ENERGY	Beverages RTD	PAB LRB
2158	2840008391	00028400083911	Frito-Lay Variety Pack Classic Mix - 20 pk 20 OZ PKG	Frito Variety Pack Mix 20ct 22oz	NULL	NULL	FLNA	FL VP/MP	FLNA	Corporate	1	1	0028400083911	ALL FRITO LAY PRODUCTS ASTSS SALTED SNACKS ASSORTED BAG IN BAG 22 OZ - 0028400083911	SALTY SNACKS	VARIETY MULTIPACK	SALTY SNACKS	VARIETY MULTIPACK	NULL	NULL	Frito Lay	NULL	NULL	NULL	PEPSICO INC	Pepsico Inc	PEPSICO INC	ALL FRITO LAY PRODUCTS ASTSS SALTED SNACKS ASSORTED BAG IN BAG 22 OZ - 0028400083911	18.75OZ NUTS & SEEDS BAR-B-QUE	18.75OZ NUTS & SEEDS BAR-B-QUE	0	0	1	Other	NULL	NULL	FRITO LAY	0	PeapodSales	NULL	NULL	NULL	NULL	NULL	NULL	NULL	NULL	NULL	17795	25088	NULL	NULL	NULL	0	0	NULL	NULL	NULL	NULL	VARIETY PACK	FirstIRIMtch	Corporate	00028400040204	18.75OZ NUTS & SEEDS BAR-B-QUE	2016-02-02 02:29:46.550	NULL	FLNA	Portfolio Marketing	FL VP/MP	0	68	PARTY SIZE	6	SALTY SNACKS	Savory Snacks	TOTAL MACROSNACKS
2160	2840000289	00028400002899	Frito Lay Flavor Mix 20Ct (20 Oz)	Frito-Lay Flavor Mix Do Us A Flavor Variety Pack Chips (20-1 Ounce) 20 Ounce 20 Pack Plastic Bag	NULL	NULL	FLNA	FL VP/MP	FLNA	Corporate	1	1	2840000289	FRITO LAY FLAVOR MIX 18CT 18 OZ	SALTY SNACKS	VARIETY MULTIPACK	SALTY SNACKS	VARIETY MULTIPACK	NULL	NULL	Frito Lay	NULL	To Go	NULL	PEPSICO INC	Pepsico Inc	PEPSICO INC	FRITO LAY FLAVOR MIX 18CT 18 OZ	Frito-Lay Flavor Mix Variety Pack (20-1 OZ) 20 Ounce 20Pk Plastic Bag	Frito-Lay Flavor Mix Do Us A Flavor Variety Pack Chips (20-1 Ounce) 20 Ounce 20 Pack Plastic Bag	0	0	1	Multipack	NULL	NULL	FRITO LAY	0	PeapodShare	NULL	NULL	NULL	NULL	NULL	NULL	NULL	NULL	NULL	16924	743363	NULL	NULL	NULL	0	0	MULTI PACK SALTY BAGGED/CANISTER SNACKS	20 CT	19802768	NULL	VARIETY PACK	FirstIRIMtch	Corporate	00028400002899	Frito-Lay Flavor Mix Variety Pack (20-1 OZ) 20 Ounce 20Pk Plastic Bag	2016-02-02 02:29:46.550	NULL	FLNA	Portfolio Marketing	FL VP/MP	0	68	PARTY SIZE	6	SALTY SNACKS	Savory Snacks	TOTAL MACROSNACKS
2161	2840008392	00028400083928	Frito-Lay Variety Pack Flavor Mix - 20 pk 20 OZ PKG	22.00OZ VARIETY PACK REGULAR	NULL	NULL	FLNA	FL VP/MP	FLNA	Corporate	1	1	0028400083921	ALL FRITO LAY PRODUCTS ASTSS SALTED SNACKS ASSORTED INDIVID WRAP IN BAG 22 OZ - 0028400083921	SALTY SNACKS	VARIETY MULTIPACK	SALTY SNACKS	VARIETY MULTIPACK	NULL	NULL	Frito Lay	NULL	NULL	NULL	PEPSICO INC	Pepsico Inc	PEPSICO INC	ALL FRITO LAY PRODUCTS ASTSS SALTED SNACKS ASSORTED INDIVID WRAP IN BAG 22 OZ - 0028400083921	Chester's Flamin Hot Fries Corn & Potato Snacks 1.75 Ounce Bag	Chester's Flamin Hot Fries Corn & Potato Snacks 1.75 Ounce Plastic Bag	0	0	1	Other	NULL	NULL	FRITO LAY	0	ShiptShare	NULL	NULL	NULL	NULL	NULL	NULL	NULL	NULL	NULL	17796	25089	NULL	NULL	NULL	0	0	NULL	NULL	NULL	NULL	VARIETY PACK	FirstIRIMtch	Corporate	00028400043014	Chester's Flamin Hot Fries Corn & Potato Snacks 1.75 Ounce Bag	2016-02-02 02:29:46.550	NULL	FLNA	Portfolio Marketing	FL VP/MP	0	68	PARTY SIZE	6	SALTY SNACKS	Savory Snacks	TOTAL MACROSNACKS
2162	2840000308	00028400003087	Frito Lay Flavor Mix 32Ct (32 Oz)	FritoLay Variety Pack Flavor Mix (32 - 1 Ounce) 32 Ounce 32 Pack Bag in Box	NULL	NULL	FLNA	FL VP/MP	FLNA	Corporate	1	1	2840000308	FRITO LAY FLAVOR MIX 32CT 32 OZ	SALTY SNACKS	VARIETY MULTIPACK	SALTY SNACKS	VARIETY MULTIPACK	NULL	NULL	Frito Lay	NULL	SALTY SNACKS	NULL	PEPSICO INC	Pepsico Inc	PEPSICO INC	FRITO LAY FLAVOR MIX 32CT 32 OZ	FritoLay Variety Pack Flavor Mix (32 - 1 OZ) 32 Ounce 32 Pack Bag	FritoLay Variety Pack Flavor Mix (32 - 1 Ounce) 32 Ounce 32 Pack Bag in Box	0	0	1	VARIETY MULTIPACK	NULL	NULL	FRITO LAY	0	ShiptShare	NULL	NULL	NULL	NULL	NULL	NULL	NULL	NULL	NULL	16931	740766	NULL	NULL	NULL	0	0	MULTI PACK SALTY BAGGED/CANISTER SNACKS	32 CT	26807800	NULL	VARIETY PACK	FirstIRIMtch	Corporate	00028400003087	FritoLay Variety Pack Flavor Mix (32 - 1 OZ) 32 Ounce 32 Pack Bag	2016-02-02 02:29:46.550	NULL	FLNA	Portfolio Marketing	FL VP/MP	0	68	Snacks/Sundries	1	SALTY SNACKS	Savory Snacks	TOTAL MACROSNACKS
2167	2840000022	00028400000222	Fritos Mild Cheddar Dip (9 Oz)	Fritos Mild Cheddar Cheese Dip 9 Ounce Aluminum Canister	NULL	NULL	FLNA	Fritos	FLNA	Corporate	1	1	2840000022	FRITOS MILD CHEDDAR DIP 9 OZ	DIP/DIP MIXES - SS	SS DIPS	DIPS	SS DIPS	NULL	NULL	Dips	NULL	NULL	NULL	PEPSICO INC	Pepsico Inc	PEPSICO INC	FRITOS MILD CHEDDAR DIP 9 OZ	Fritos Mild Cheddar Cheese Dip 9 Ounce Canister	Fritos Mild Cheddar Cheese Dip 9 Ounce Aluminum Canister	0	0	1	Other	NULL	NULL	FRITO LAY	0	PeapodShare	0	0	151.31	2.08	1006.27	NULL	NULL	NULL	NULL	16882	737996	NULL	NULL	NULL	0	0	UA-SALTY BAGGED/CANISTER SNACKS	9 OZ	17177050	C010	Baked Bars	FirstIRIMtch	Corporate	00028400000222	Fritos Mild Cheddar Cheese Dip 9 Ounce Canister	2016-02-02 02:29:46.550	NULL	FLNA	Portfolio Marketing	Fritos	0	70	LCAN	24	DIPS	Savory Snacks	TOTAL MACROSNACKS
1174	89470001006	NULL	Chob Grk 0 Peach	NULL	NULL	NULL	<UnAssigned>	<UnAssigned>	<UnAssigned>	<UnAssigned>	0	0	89470001006	CHBN PEACH GREEK YOGURT 5.3 OZ	NON PEP CATEGORY	NON PEP CATEGORY	PEPSICO REVIEWS CATEGORIES US	YOGURT	NULL	NULL	NULL	NULL	NULL	NULL	CHOBANI INC	Chobani Inc	CHOBANI INC	CHBN PEACH GREEK YOGURT 5.3 OZ	Chob Grk 0 Peach	Chob Grk 0 Peach	0	0	1	Other	NULL	NULL	AGRO-FARMA	0	PeapodShare	NULL	NULL	NULL	NULL	NULL	NULL	NULL	NULL	NULL	NULL	758284	NULL	NULL	NULL	NULL	NULL	NULL	NULL	NULL	NULL	NULL	FirstIRIMtch	<UnAssigned>	NULL	NULL	2016-02-02 02:29:46.550	NULL	<UnAssigned>	<UnAssigned>	<UnAssigned>	0	-1	NULL	NULL	NON PEP CATEGORY	NON PEP CATEGORY	NON PEP CATEGORY
1175	81829001202	NULL	Chobani Greek Fruit on the Bottom Yogurt Pear 0% Non Fat Natural 5.3 OZ CUP	NULL	NULL	NULL	<UnAssigned>	<UnAssigned>	<UnAssigned>	<UnAssigned>	0	0	0818290012022	CHOBANI PEAR YOGURT RFG 1 CT 5.3 OZ 	PEPSICO REVIEWS CATEGORIES US	YOGURT	PEPSICO REVIEWS CATEGORIES US	YOGURT	NULL	NULL	NULL	NULL	NULL	NULL	CHOBANI INC	Chobani Inc	CHOBANI INC	CHOBANI PEAR YOGURT RFG 1 CT 5.3 OZ 	Chobani Greek Fruit on the Bottom Yogurt Pear 0% Non Fat Natural 5.3 OZ CUP	Chobani Greek Fruit on the Bottom Yogurt Pear 0% Non Fat Natural 5.3 OZ CUP	0	0	1	Other	CHOBANI	CHOBANI	CHOBANI INC	0	PeapodShare	NULL	NULL	NULL	NULL	NULL	NULL	NULL	NULL	NULL	NULL	282786	N/A	1 CT	NULL	NULL	NULL	NULL	NULL	NULL	NULL	NULL	ElvnDgtIRIMtch	<UnAssigned>	NULL	NULL	2016-02-02 02:29:46.550	NULL	<UnAssigned>	<UnAssigned>	<UnAssigned>	0	-1	NULL	NULL	DAIRY	NON-PEP CATEGORIES	NON-PEP CATEGORIES
2164	2840005804	00028400058049	Frito-Lay Variety Pack Flavor Mix - 50 pk 50 OZ PKG	Frito Lay Flavor Mix (50-1 Oz) 50 Ounce 50 Plastic Bags	NULL	NULL	FLNA	FL VP/MP	FLNA	Corporate	1	1	2840005804	FRITO LAY FLAVOR MIX 50CT 50 OZ	SALTY SNACKS	VARIETY MULTIPACK	SALTY SNACKS	VARIETY MULTIPACK	NULL	NULL	Frito Lay	NULL	NULL	NULL	PEPSICO INC	Pepsico Inc	PEPSICO INC	FRITO LAY FLAVOR MIX 50CT 50 OZ	Frito Lay Flavor Mix (50-1 Oz) 50 Ounce 50Pk Bags	Frito Lay Flavor Mix (50-1 Oz) 50 Ounce 50 Plastic Bags	0	0	1	Other	NULL	NULL	FRITO LAY	0	PeapodShare	NULL	NULL	NULL	NULL	NULL	NULL	NULL	NULL	NULL	17557	738504	NULL	NULL	NULL	0	0	MULTI PACK SALTY BAGGED/CANISTER SNACKS	50 CT	146712056	NULL	VARIETY PACK	FirstIRIMtch	Corporate	00028400058049	Frito Lay Flavor Mix (50-1 Oz) 50 Ounce 50Pk Bags	2016-02-02 02:29:46.550	NULL	FLNA	Portfolio Marketing	FL VP/MP	0	68	CLUB VP (47PK)	3	SALTY SNACKS	Savory Snacks	TOTAL MACROSNACKS
2165	2840000303	00028400003032	Frito Lay Classic Mx 32Ct (32 Oz)	Frito Lays Variety Pack Classic Mix (32 -1 Oz) 32 Ounce 32 Pack Bag in Box	NULL	NULL	FLNA	FL VP/MP	FLNA	Corporate	1	1	2840000303	FRITO LAY CLASSIC MX 32CT 32 OZ	SALTY SNACKS	VARIETY MULTIPACK	SALTY SNACKS	VARIETY MULTIPACK	NULL	NULL	Frito Lay	NULL	NULL	NULL	PEPSICO INC	Pepsico Inc	PEPSICO INC	FRITO LAY CLASSIC MX 32CT 32 OZ	Frito Lays Variety Pack Classic Mix (32 -1 Oz) 32 Ounce 32 Pack Bag in Box	Frito Lays Variety Pack Classic Mix (32 -1 Oz) 32 Ounce 32 Pack Bag in Box	0	0	1	Other	NULL	NULL	FRITO LAY	0	ShiptShare	NULL	NULL	NULL	NULL	NULL	NULL	NULL	NULL	NULL	16930	743621	NULL	NULL	NULL	0	0	MULTI PACK SALTY BAGGED/CANISTER SNACKS	32 CT	40147232	NULL	VARIETY PACK	FirstIRIMtch	Corporate	00028400003032	Frito Lays Variety Pack Classic Mix (32 -1 Oz) 32 Ounce 32 Pack Bag in Box	2016-02-02 02:29:46.550	NULL	FLNA	Portfolio Marketing	FL VP/MP	0	68	Snacks/Sundries	1	SALTY SNACKS	Savory Snacks	TOTAL MACROSNACKS
2168	2840003925	00028400039253	Fritos Corn Chips Barbecue 9.75 OZ BAG	10.50OZ FRITOS BAR-B-QUE	NULL	NULL	FLNA	Fritos	FLNA	Corporate	1	1	0028400039251	FRITOS CORN CHIP BARBECUE BAG 10.5 OZ - 0028400039251	SALTY SNACKS	CORN CHIPS	SALTY SNACKS	CORN CHIPS	NULL	NULL	Fritos	NULL	NULL	NULL	PEPSICO INC	Pepsico Inc	PEPSICO INC	FRITOS CORN CHIP BARBECUE BAG 10.5 OZ - 0028400039251	10.50OZ FRITOS CHILI CHEESE	10.50OZ FRITOS CHILI CHEESE	0	0	1	Other	NULL	NULL	FRITO LAY	0	PeapodSales	1	1	544.36	5.08	687.08	NULL	NULL	NULL	NULL	17328	23994	NULL	NULL	NULL	0	0	NULL	NULL	NULL	NULL	FRITOS	FirstIRIMtch	Corporate	00028400039239	10.50OZ FRITOS CHILI CHEESE	2016-02-02 02:29:46.550	NULL	FLNA	Portfolio Marketing	Fritos	0	70	XL	12	SALTY SNACKS	Savory Snacks	TOTAL MACROSNACKS
2171	2840003923	00028400039239	Fritos Corn Chips Chili Cheese 9.25 OZ BAG	10.50OZ FRITOS CHILI CHEESE	NULL	NULL	FLNA	Fritos	FLNA	Corporate	1	1	0028400039231	FRITOS CORN CHIP CHILI CHEESE ZERO GRAMS TRANS FAT BAG 10.5 OZ - 0028400039231	SALTY SNACKS	CORN CHIPS	SALTY SNACKS	CORN CHIPS	NULL	NULL	Fritos	NULL	NULL	NULL	PEPSICO INC	Pepsico Inc	PEPSICO INC	FRITOS CORN CHIP CHILI CHEESE ZERO GRAMS TRANS FAT BAG 10.5 OZ - 0028400039231	10.50OZ FRITOS CHILI CHEESE	10.50OZ FRITOS CHILI CHEESE	0	0	1	Other	NULL	NULL	FRITO LAY	0	ShiptShare	1	0	564.374	4.81	955.132	NULL	NULL	NULL	NULL	17326	23992	NULL	NULL	NULL	0	0	NULL	NULL	NULL	NULL	FRITOS	FirstIRIMtch	Corporate	00028400039239	10.50OZ FRITOS CHILI CHEESE	2016-02-02 02:29:46.550	NULL	FLNA	Portfolio Marketing	Fritos	0	70	XL	12	SALTY SNACKS	Savory Snacks	TOTAL MACROSNACKS
2149	2840002926	00028400029261	Mnch Pbtr Chs Snd Crk 8Ct (11.36 Oz)	Munchies Peanut Butter Sandwich Crackers (8 - 1.42 Ounce) 11.36 Ounce Plastic Bag	NULL	NULL	FLNA	Munchies	FLNA	Corporate	1	1	2840002926	MNCH PBTR CHS SND CRK 8CT 11.36 OZ	CRACKERS	CRACKERS (EX MATZOH)	PEPSICO REVIEWS CATEGORIES US	CRACKERS (EX MATZOH)	NULL	NULL	Frito Lay	NULL	To Go	NULL	PEPSICO INC	Pepsico Inc	PEPSICO INC	MNCH PBTR CHS SND CRK 8CT 11.36 OZ	Munchies Peanut Butter Sandwich Crackers (8 - 1.42 Oz) 11.36 Ounce Bag	Munchies Peanut Butter Sandwich Crackers (8 - 1.42 Ounce) 11.36 Ounce Plastic Bag	0	0	1	Crackers	NULL	NULL	FRITO LAY	0	PeapodShare	0	0	505	7.3	774.1	NULL	NULL	NULL	NULL	17205	738384	NULL	NULL	NULL	0	0	AWAY FROM HOME FC CRACKER	8-1.42	38452158	NULL	MUNCHIES	FirstIRIMtch	Corporate	00028400029261	Munchies Peanut Butter Sandwich Crackers (8 - 1.42 Oz) 11.36 Ounce Bag	2016-02-02 02:29:46.550	NULL	FLNA	Portfolio Marketing	Munchies	0	85	SML	1	CRACKERS	Savory Snacks	TOTAL MACROSNACKS
3405	7349012813	NULL	Kdem Kosher Wht Grape	NULL	NULL	NULL	<UnAssigned>	<UnAssigned>	<UnAssigned>	<UnAssigned>	0	0	0073490128131	KEDEM WHITE GRAPE JUICE 1 CT 22 OZ 	BOTTLED JUICES - SS	SHELF STABLE J&D	TOTAL JUICE & DRINKS	SHELF STABLE J&D	NULL	NULL	NULL	NULL	NULL	NULL	KEDEM FOOD PRODUCTS	KAYCO USA	KEDEM FOOD PRODUCTS	KEDEM WHITE GRAPE JUICE 1 CT 22 OZ 	Kdem Kosher Wht Grape	Kdem Kosher Wht Grape	0	0	1	Other	KEDEM	KEDEM	KEDEM FOOD PRODUCTS	0	Shoprite	NULL	NULL	NULL	NULL	NULL	NULL	NULL	NULL	NULL	NULL	78916	N/A	1 CT	22.0	NULL	NULL	NULL	NULL	NULL	NULL	NULL	FirstIRIMtch	<UnAssigned>	NULL	NULL	2016-02-02 02:29:46.550	NULL	<UnAssigned>	<UnAssigned>	<UnAssigned>	0	-1	NULL	NULL	TOTAL JUICE & DRINKS	Beverages RTD	PAB LRB
3414	3010059111	NULL	Keebler Filled Pretzel Bites Peanut Butter & Fudge - 5 pk 6 OZ BOX	NULL	NULL	NULL	<UnAssigned>	<UnAssigned>	<UnAssigned>	<UnAssigned>	0	0	0030100591111	KEEBLER PRETZEL PENUT BTTR FDG PRTZL POUCH IN BOX 6 OZ 	OTHER SNACKS	PRETZELS	SALTY SNACKS	PRETZELS	NULL	NULL	NULL	NULL	NULL	NULL	KELLOGG CO	Kellogg Company	KELLOGG CO	KEEBLER PRETZEL PENUT BTTR FDG PRTZL POUCH IN BOX 6 OZ 	Keebler Filled Pretzel Bites Peanut Butter & Fudge - 5 pk 6 OZ BOX	Keebler Filled Pretzel Bites Peanut Butter & Fudge - 5 pk 6 OZ BOX	0	0	1	Other	KEEBLER	KEEBLER	KELLOGG CO	0	ShiptShare	NULL	NULL	NULL	NULL	NULL	NULL	NULL	NULL	NULL	NULL	28799	MP-STRAIGHT PACK	5 CT	1.2	NULL	NULL	NULL	NULL	NULL	NULL	NULL	FirstIRIMtch	<UnAssigned>	NULL	NULL	2016-02-02 02:29:46.550	NULL	<UnAssigned>	<UnAssigned>	<UnAssigned>	0	-1	NULL	NULL	SALTY SNACKS	Savory Snacks	TOTAL MACROSNACKS
2151	2840002927	00028400029278	Mnch Pbtr Tst Snd Crk 8Ct (11.36 Oz)	Munchies Peanut Butter Sandwich Crackers (8-1.42 Ounce Packs) 11.36 Ounces Bag	NULL	NULL	FLNA	Munchies	FLNA	Corporate	1	1	2840002927	MNCH PBTR TST SND CRK 8CT 11.36 OZ	CRACKERS	CRACKERS (EX MATZOH)	PEPSICO REVIEWS CATEGORIES US	CRACKERS (EX MATZOH)	NULL	NULL	Frito Lay	NULL	To Go	NULL	PEPSICO INC	Pepsico Inc	PEPSICO INC	MNCH PBTR TST SND CRK 8CT 11.36 OZ	Munchies Peanut Butter Sandwich Crackers (8-1.42 Ounce Packs) 11.36 Ounces Bag	Munchies Peanut Butter Sandwich Crackers (8-1.42 Ounce Packs) 11.36 Ounces Bag	0	0	1	Crackers	NULL	NULL	FRITO LAY	0	PeapodShare	0	1	511.4	7.48	656.55	NULL	NULL	NULL	NULL	17206	738263	NULL	NULL	NULL	0	0	AWAY FROM HOME FC CRACKER	8-1.42	21289060	NULL	MUNCHIES	FirstIRIMtch	Corporate	00028400029278	Munchies Peanut Butter Sandwich Crackers (8-1.42 Ounce Packs) 11.36 Ounces Bag	2016-02-02 02:29:46.550	NULL	FLNA	Portfolio Marketing	Munchies	0	85	SML	1	CRACKERS	Savory Snacks	TOTAL MACROSNACKS
32	2200011604	NULL	5 Sugar Free Gum An Electric Watermelon Prism - 3 pk 45 CT PKG	NULL	NULL	NULL	<UnAssigned>	<UnAssigned>	<UnAssigned>	<UnAssigned>	0	0	0022000116041	WRIGLEYS 5 PRISM WATERMELON CHEWING GUM SUGAR FREE 45 CT 4.28 OZ 	PEPSICO REVIEWS CATEGORIES US	GUM	PEPSICO REVIEWS CATEGORIES US	GUM	NULL	NULL	NULL	NULL	NULL	NULL	MARS INC	NULL	MARS INC	WRIGLEYS 5 PRISM WATERMELON CHEWING GUM SUGAR FREE 45 CT 4.28 OZ 	5 Sugar Free Gum An Electric Watermelon Prism - 3 pk 45 CT PKG	5 Sugar Free Gum An Electric Watermelon Prism - 3 pk 45 CT PKG	0	0	1	Other	WRIGLEYS 5 PRISM	WRIGLEYS	WILLIAM WRIGLEY JR. CO	0	ShiptShare	NULL	NULL	NULL	NULL	NULL	NULL	NULL	NULL	NULL	NULL	171715	N/A	45 CT	NULL	NULL	NULL	NULL	NULL	NULL	NULL	NULL	FirstIRIMtch	<UnAssigned>	NULL	NULL	2016-02-02 02:29:46.550	NULL	<UnAssigned>	<UnAssigned>	<UnAssigned>	0	-1	NULL	NULL	NON-PEP CATEGORIES	NON-PEP CATEGORIES	NON-PEP CATEGORIES
2155	2840000227	00028400002271	Frito-Lay Munchos Potato Crisps 4.5 OZ BAG	4.75OZ MUNCHOS REGULAR	NULL	NULL	FLNA	Munchos	FLNA	Corporate	1	1	0028400002271	MUNCHOS POTATO CRISP REGULAR BAG 4.75 OZ - 0028400002271	SALTY SNACKS	POTATO CHIPS	SALTY SNACKS	POTATO CHIPS	NULL	NULL	Munchos	NULL	NULL	NULL	PEPSICO INC	Pepsico Inc	PEPSICO INC	MUNCHOS POTATO CRISP REGULAR BAG 4.75 OZ - 0028400002271	Ruffles Party Size Cheddar & Sour Cream 13 Ounce Bag 	Ruffles Party Size Cheddar & Sour Cream 13 Ounce Bag 	0	0	1	Other	NULL	NULL	FRITO LAY	0	ShiptShare	1	0	518.55	5.12	795.01	NULL	NULL	NULL	NULL	16907	22856	NULL	NULL	NULL	0	0	NULL	NULL	19766110	NULL	MUNCHOS	FirstIRIMtch	Corporate	00028400002264	Ruffles Party Size Cheddar & Sour Cream 13 Ounce Bag 	2016-02-02 02:29:46.550	NULL	FLNA	Portfolio Marketing	Munchos	0	86	2VALUE LINE	12	SALTY SNACKS	Savory Snacks	TOTAL MACROSNACKS
2156	2840019079	00028400190794	Munchos Potato Crisps (4.5 Oz)	Munchos Potato Crisps 4.5 Ounce Plastic Bag	NULL	NULL	FLNA	Munchos	FLNA	Corporate	1	1	2840019079	MUNCHOS POTATO CRISPS 4.25 OZ	SALTY SNACKS	POTATO CHIPS	SALTY SNACKS	POTATO CHIPS	NULL	NULL	Munchos	NULL	NULL	NULL	PEPSICO INC	Pepsico Inc	PEPSICO INC	MUNCHOS POTATO CRISPS 4.25 OZ	Munchos Potato Crisps 4.5 Ounce Bag	Munchos Potato Crisps 4.5 Ounce Plastic Bag	0	0	1	Other	NULL	NULL	FRITO LAY	0	PeapodShare	1	0	518.55	5.12	795.01	NULL	NULL	NULL	NULL	18127	741312	NULL	NULL	NULL	0	0	POTATO CHIPS TAKE HOME BAG/CANISTER SNACK	4.5 OZ	26832102	NULL	MUNCHOS	FirstIRIMtch	Corporate	00028400190794	Munchos Potato Crisps 4.5 Ounce Bag	2016-02-02 02:29:46.550	NULL	FLNA	Portfolio Marketing	Munchos	0	86	2VALUE LINE	12	SALTY SNACKS	Savory Snacks	TOTAL MACROSNACKS
1158	81829001277	NULL	Chob Grk Ccnut Bl 4Pk	NULL	NULL	NULL	<UnAssigned>	<UnAssigned>	<UnAssigned>	<UnAssigned>	0	0	81829001277	CHBN 2% CCNT BLND GRK YGT 4/5.3 OZ	NON PEP CATEGORY	NON PEP CATEGORY	PEPSICO REVIEWS CATEGORIES US	YOGURT	NULL	NULL	NULL	NULL	NULL	NULL	CHOBANI INC	Chobani Inc	CHOBANI INC	CHBN 2% CCNT BLND GRK YGT 4/5.3 OZ	Chob Grk Ccnut Bl 4Pk	Chob Grk Ccnut Bl 4Pk	0	0	1	Other	NULL	NULL	CHOBANI	0	PeapodShare	NULL	NULL	NULL	NULL	NULL	NULL	NULL	NULL	NULL	NULL	754785	NULL	NULL	NULL	NULL	NULL	NULL	NULL	NULL	NULL	NULL	FirstIRIMtch	<UnAssigned>	NULL	NULL	2016-02-02 02:29:46.550	NULL	<UnAssigned>	<UnAssigned>	<UnAssigned>	0	-1	NULL	NULL	NON PEP CATEGORY	NON PEP CATEGORY	NON PEP CATEGORY
1167	81829001259	NULL	Chob Grk 0 Blackbry	NULL	NULL	NULL	<UnAssigned>	<UnAssigned>	<UnAssigned>	<UnAssigned>	0	0	81829001259	CHBN BLACKBERRY GRK YOGRT 5.3 OZ	NON PEP CATEGORY	NON PEP CATEGORY	PEPSICO REVIEWS CATEGORIES US	YOGURT	NULL	NULL	NULL	NULL	NULL	NULL	CHOBANI INC	Chobani Inc	CHOBANI INC	CHBN BLACKBERRY GRK YOGRT 5.3 OZ	Chob Grk 0 Blackbry	Chob Grk 0 Blackbry	0	0	1	Other	NULL	NULL	CHOBANI	0	PeapodShare	NULL	NULL	NULL	NULL	NULL	NULL	NULL	NULL	NULL	NULL	754926	NULL	NULL	NULL	NULL	NULL	NULL	NULL	NULL	NULL	NULL	FirstIRIMtch	<UnAssigned>	NULL	NULL	2016-02-02 02:29:46.550	NULL	<UnAssigned>	<UnAssigned>	<UnAssigned>	0	-1	NULL	NULL	NON PEP CATEGORY	NON PEP CATEGORY	NON PEP CATEGORY
