1200	81829001315	NULL	Chob Smp100 Peach	NULL	NULL	NULL	<UnAssigned>	<UnAssigned>	<UnAssigned>	<UnAssigned>	0	0	0818290013151	CHOBANI SIMPLY 100 PEACH YOGURT RFG 1 CT 5.3 OZ 	PEPSICO REVIEWS CATEGORIES US	YOGURT	PEPSICO REVIEWS CATEGORIES US	YOGURT	NULL	NULL	NULL	NULL	NULL	NULL	CHOBANI INC	Chobani Inc	CHOBANI INC	CHOBANI SIMPLY 100 PEACH YOGURT RFG 1 CT 5.3 OZ 	Chob Smp100 Peach	Chob Smp100 Peach	0	0	1	Other	CHOBANI SIMPLY 100	CHOBANI	CHOBANI INC	0	PeapodShare	NULL	NULL	NULL	NULL	NULL	NULL	NULL	NULL	NULL	NULL	282848	N/A	1 CT	NULL	NULL	NULL	NULL	NULL	NULL	NULL	NULL	ElvnDgtIRIMtch	<UnAssigned>	NULL	NULL	2016-02-02 02:29:46.550	NULL	<UnAssigned>	<UnAssigned>	<UnAssigned>	0	-1	NULL	NULL	DAIRY	NON-PEP CATEGORIES	NON-PEP CATEGORIES
1201	81829001333	NULL	Chob Smp100 Pineapple	NULL	NULL	NULL	<UnAssigned>	<UnAssigned>	<UnAssigned>	<UnAssigned>	0	0	0818290013331	CHOBANI SIMPLY 100 PINEAPPLE YOGURT RFG 1 CT 5.3 OZ 	PEPSICO REVIEWS CATEGORIES US	YOGURT	PEPSICO REVIEWS CATEGORIES US	YOGURT	NULL	NULL	NULL	NULL	NULL	NULL	CHOBANI INC	Chobani Inc	CHOBANI INC	CHOBANI SIMPLY 100 PINEAPPLE YOGURT RFG 1 CT 5.3 OZ 	Chob Smp100 Pineapple	Chob Smp100 Pineapple	0	0	1	Other	CHOBANI SIMPLY 100	CHOBANI	CHOBANI INC	0	PeapodShare	NULL	NULL	NULL	NULL	NULL	NULL	NULL	NULL	NULL	NULL	282852	N/A	1 CT	NULL	NULL	NULL	NULL	NULL	NULL	NULL	NULL	ElvnDgtIRIMtch	<UnAssigned>	NULL	NULL	2016-02-02 02:29:46.550	NULL	<UnAssigned>	<UnAssigned>	<UnAssigned>	0	-1	NULL	NULL	DAIRY	NON-PEP CATEGORIES	NON-PEP CATEGORIES
1215	1820799002	0001820799002	Cicero Beverage Co. Chicago Style Sour Cherry Soda 12 OZ BTL	Cicero Beverage Co. Chicago Style Sour Cherry Soda 12 OZ BTL	NULL	NULL	Beverages	SoBe	PBC	Corporate	0	0	0018207990021	CICERO BEVERAGE CO SODA SOUR CHERRY GLASS BOTTLE 1 CT 12 OZ 	CARBONATED BEVERAGES	CARBONATED SOFT DRINKS	CARBONATED SOFT DRINKS	CARBONATED SOFT DRINKS	NULL	NULL	SoBe	NULL	NULL	NULL	CBC SALES INC	NULL	CBC SALES INC	CICERO BEVERAGE CO SODA SOUR CHERRY GLASS BOTTLE 1 CT 12 OZ 	Cicero Beverage Co. Chicago Style Sour Cherry Soda 12 OZ BTL	Cicero Beverage Co. Chicago Style Sour Cherry Soda 12 OZ BTL	0	0	1	Other	CICERO BEVERAGE CO	CICERO BEVERAGE CO	CBC SALES INC	0	ShiptShare	NULL	NULL	NULL	NULL	NULL	NULL	NULL	NULL	NULL	16760	14371	N/A	1 CT	12.0	1	0	NULL	NULL	NULL	NULL	TOSTITOS	FirstIRIMtch	Corporate	NULL	NULL	2016-02-02 02:29:46.550	NULL	<UnAssigned>	<UnAssigned>	<UnAssigned>	0	52	NULL	NULL	CARBONATED SOFT DRINKS	Beverages RTD	PAB LRB
1220	7582281003	NULL	Classique Fare Belgian Waffle Mix 16 OZ BOX	NULL	NULL	NULL	<UnAssigned>	<UnAssigned>	<UnAssigned>	<UnAssigned>	0	0	0075822810031	CLASSIQUE FARE BELGIAN WAFFLE MIX CARDBOARD BOX SHELF STABLE 16 OZ 	PANCAKE MIXES	PANCAKE MIXES	PEPSICO REVIEWS CATEGORIES US	PANCAKE MIXES	NULL	NULL	NULL	NULL	NULL	NULL	REIMANN FOOD CLASSICS INC	NULL	REIMANN FOOD CLASSICS INC	CLASSIQUE FARE BELGIAN WAFFLE MIX CARDBOARD BOX SHELF STABLE 16 OZ 	Classique Fare Belgian Waffle Mix 16 OZ BOX	Classique Fare Belgian Waffle Mix 16 OZ BOX	0	0	1	Other	CLASSIQUE FARE	CLASSIQUE FARE	REIMANN FOOD CLASSICS INC	0	ShiptShare	NULL	NULL	NULL	NULL	NULL	NULL	NULL	NULL	NULL	NULL	233705	N/A	1 CT	NULL	NULL	NULL	NULL	NULL	NULL	NULL	NULL	FirstIRIMtch	<UnAssigned>	NULL	NULL	2016-02-02 02:29:46.550	NULL	<UnAssigned>	<UnAssigned>	<UnAssigned>	0	-1	NULL	NULL	PANCAKE MIXES	Quaker Core	QUAKER FOODS
1203	81829001316	NULL	Chob Smp100 Vanilla	NULL	NULL	NULL	<UnAssigned>	<UnAssigned>	<UnAssigned>	<UnAssigned>	0	0	0818290013161	CHOBANI SIMPLY 100 VANILLA YOGURT RFG 1 CT 5.3 OZ 	PEPSICO REVIEWS CATEGORIES US	YOGURT	PEPSICO REVIEWS CATEGORIES US	YOGURT	NULL	NULL	NULL	NULL	NULL	NULL	CHOBANI INC	Chobani Inc	CHOBANI INC	CHOBANI SIMPLY 100 VANILLA YOGURT RFG 1 CT 5.3 OZ 	Chob Smp100 Vanilla	Chob Smp100 Vanilla	0	0	1	Other	CHOBANI SIMPLY 100	CHOBANI	CHOBANI INC	0	PeapodShare	NULL	NULL	NULL	NULL	NULL	NULL	NULL	NULL	NULL	NULL	282849	N/A	1 CT	NULL	NULL	NULL	NULL	NULL	NULL	NULL	NULL	ElvnDgtIRIMtch	<UnAssigned>	NULL	NULL	2016-02-02 02:29:46.550	NULL	<UnAssigned>	<UnAssigned>	<UnAssigned>	0	-1	NULL	NULL	DAIRY	NON-PEP CATEGORIES	NON-PEP CATEGORIES
1208	71627002004	NULL	Chocolove Almond Toffee Dark Chocolate Covered 55% Cocoa 3 OZ BOX	NULL	NULL	NULL	<UnAssigned>	<UnAssigned>	<UnAssigned>	<UnAssigned>	0	0	0716270020041	CHOCOLOVE DARK CHCLT ALMND TFF BOX 1 CT 3 OZ 	CHOCOLATE CANDY	TOTAL CHOCOLATE CANDY	PEPSICO REVIEWS CATEGORIES US	TOTAL CHOCOLATE CANDY	NULL	NULL	NULL	NULL	NULL	NULL	CREATIVE NATURAL PRODUCTS INC	NULL	CREATIVE NATURAL PRODUCTS INC	CHOCOLOVE DARK CHCLT ALMND TFF BOX 1 CT 3 OZ 	Chocolove Almond Toffee Dark Chocolate Covered 55% Cocoa 3 OZ BOX	Chocolove Almond Toffee Dark Chocolate Covered 55% Cocoa 3 OZ BOX	0	0	1	Other	CHOCOLOVE	CHOCOLOVE	CREATIVE NATURAL PRODUCTS INC	0	PeapodShare	NULL	NULL	NULL	NULL	NULL	NULL	NULL	NULL	NULL	NULL	264487	N/A	1 CT	NULL	NULL	NULL	NULL	NULL	NULL	NULL	NULL	ElvnDgtIRIMtch	<UnAssigned>	NULL	NULL	2016-02-02 02:29:46.550	NULL	<UnAssigned>	<UnAssigned>	<UnAssigned>	0	-1	NULL	NULL	EXT: NON-PEP CATEGORIES	Extended Macrosnacks	TOTAL MACROSNACKS
1209	71627002002	NULL	Chocolove Almonds Honey Roasted Milk Chocolate Covered 33% Cocoa 3 OZ BOX	NULL	NULL	NULL	<UnAssigned>	<UnAssigned>	<UnAssigned>	<UnAssigned>	0	0	0716270020021	CHOCOLOVE MLK CHCL HNY RST ALM PAPER & FOIL WRAPPED 1 CT 3 OZ 	CHOCOLATE CANDY	TOTAL CHOCOLATE CANDY	PEPSICO REVIEWS CATEGORIES US	TOTAL CHOCOLATE CANDY	NULL	NULL	NULL	NULL	NULL	NULL	CREATIVE NATURAL PRODUCTS INC	NULL	CREATIVE NATURAL PRODUCTS INC	CHOCOLOVE MLK CHCL HNY RST ALM PAPER & FOIL WRAPPED 1 CT 3 OZ 	Chocolove Almonds Honey Roasted Milk Chocolate Covered 33% Cocoa 3 OZ BOX	Chocolove Almonds Honey Roasted Milk Chocolate Covered 33% Cocoa 3 OZ BOX	0	0	1	Other	CHOCOLOVE	CHOCOLOVE	CREATIVE NATURAL PRODUCTS INC	0	PeapodShare	NULL	NULL	NULL	NULL	NULL	NULL	NULL	NULL	NULL	NULL	264485	N/A	1 CT	NULL	NULL	NULL	NULL	NULL	NULL	NULL	NULL	ElvnDgtIRIMtch	<UnAssigned>	NULL	NULL	2016-02-02 02:29:46.550	NULL	<UnAssigned>	<UnAssigned>	<UnAssigned>	0	-1	NULL	NULL	EXT: NON-PEP CATEGORIES	Extended Macrosnacks	TOTAL MACROSNACKS
1213	1820799005	0001820799005	Cicero Beverage Co. Chicago Style Cream Soda 12 OZ BTL	Cicero Beverage Co. Chicago Style Cream Soda 12 OZ BTL	NULL	NULL	Beverages	SoBe	PBC	Corporate	0	0	0049000068641	FANTA SODA ORANGE CAN 1 CT 10.5 OZ 	CARBONATED BEVERAGES	CARBONATED SOFT DRINKS	CARBONATED SOFT DRINKS	CARBONATED SOFT DRINKS	NULL	NULL	SoBe	NULL	NULL	NULL	COCA COLA CO	NULL	COCA COLA CO	Cicero Beverage Co. Chicago Style Cream Soda 12 OZ BTL	Cicero Beverage Co. Chicago Style Cream Soda 12 OZ BTL	Cicero Beverage Co. Chicago Style Cream Soda 12 OZ BTL	1	1	0	Other	FANTA	FANTA	COCA COLA	0	PeapodShare	NULL	NULL	NULL	NULL	NULL	NULL	NULL	NULL	NULL	16761	704447	N/A	1 CT	10.5	1	0	NULL	NULL	NULL	NULL	TOSTITOS	AdminMtch421	Corporate	NULL	NULL	2016-02-02 02:29:46.550	NULL	<UnAssigned>	<UnAssigned>	<UnAssigned>	0	52	NULL	NULL	CARBONATED SOFT DRINKS	Beverages RTD	PAB LRB
1214	1820799006	NULL	Cicero Beverage Co. Chicago Style Root Beer 12 OZ BTL	NULL	NULL	NULL	<UnAssigned>	<UnAssigned>	<UnAssigned>	<UnAssigned>	0	0	0018207990061	CICERO BEVERAGE CO SODA ROOT BEER GLASS BOTTLE 1 CT 12 OZ 	CARBONATED BEVERAGES	CARBONATED SOFT DRINKS	CARBONATED SOFT DRINKS	CARBONATED SOFT DRINKS	NULL	NULL	NULL	NULL	NULL	NULL	CBC SALES INC	NULL	CBC SALES INC	CICERO BEVERAGE CO SODA ROOT BEER GLASS BOTTLE 1 CT 12 OZ 	Cicero Beverage Co. Chicago Style Root Beer 12 OZ BTL	Cicero Beverage Co. Chicago Style Root Beer 12 OZ BTL	0	0	1	Other	CICERO BEVERAGE CO	CICERO BEVERAGE CO	CBC SALES INC	0	PeapodShare	NULL	NULL	NULL	NULL	NULL	NULL	NULL	NULL	NULL	NULL	14373	N/A	1 CT	12.0	NULL	NULL	NULL	NULL	NULL	NULL	NULL	FirstIRIMtch	<UnAssigned>	NULL	NULL	2016-02-02 02:29:46.550	NULL	<UnAssigned>	<UnAssigned>	<UnAssigned>	0	-1	NULL	NULL	CARBONATED SOFT DRINKS	Beverages RTD	PAB LRB
1218	86254300001	NULL	CJK Granola Original Vanilla Maple Cinnamon Paleo 5 OZ BAG	NULL	NULL	NULL	<UnAssigned>	<UnAssigned>	<UnAssigned>	<UnAssigned>	0	0	0078742181541	PRIVATE LABEL OAT RING HONEY NUT 1 CT 12.25 OZ 	RTE CEREAL	RTE CEREAL	RTE CEREAL	RTE CEREAL	NULL	NULL	NULL	NULL	NULL	NULL	PRIVATE LABEL	NULL	PRIVATE LABEL	CJK Granola Original Vanilla Maple Cinnamon Paleo 5 OZ BAG	CJK Granola Original Vanilla Maple Cinnamon Paleo 5 OZ BAG	CJK Granola Original Vanilla Maple Cinnamon Paleo 5 OZ BAG	1	1	0	Other	PRIVATE LABEL APPLE CINNAMON CHEERIOS	PRIVATE LABEL CHEERIOS (ALL)	PRIVATE LABEL	0	PeapodShare	NULL	NULL	NULL	NULL	NULL	NULL	NULL	NULL	NULL	NULL	704507	N/A	1 CT	12.25	NULL	NULL	NULL	NULL	NULL	NULL	NULL	AdminMtch421	<UnAssigned>	NULL	NULL	2016-02-02 02:29:46.550	NULL	<UnAssigned>	<UnAssigned>	<UnAssigned>	0	-1	NULL	NULL	RTE CEREAL	Quaker Core	QUAKER FOODS
3473	3800043426	NULL	Kellogg's FiberPlus Antioxidants Chewy Bars Dark Chocolate Almond - 5 ct 6.3 OZ BOX	NULL	NULL	NULL	<UnAssigned>	<UnAssigned>	<UnAssigned>	<UnAssigned>	0	0	0038000434261	KELLOGGS FIBER PLUS DARK CHOCOLATE DARK CHOC ALMOND CHEWY 5 CT 6.3 OZ 	SNACK BARS/GRANOLA BARS	SNACK BARS	WHOLESOME SNACKS EX LITE SNACKS	SNACK BARS	NULL	NULL	NULL	NULL	NULL	NULL	KELLOGG CO	Kellogg Company	KELLOGG CO	KELLOGGS FIBER PLUS DARK CHOCOLATE DARK CHOC ALMOND CHEWY 5 CT 6.3 OZ 	Kellogg's FiberPlus Antioxidants Chewy Bars Dark Chocolate Almond - 5 ct 6.3 OZ BOX	Kellogg's FiberPlus Antioxidants Chewy Bars Dark Chocolate Almond - 5 ct 6.3 OZ BOX	0	0	1	Other	KELLOGGS FIBER PLUS	KELLOGGS FIBER PLUS	KELLOGG CO	0	ShiptShare	NULL	NULL	NULL	NULL	NULL	NULL	NULL	NULL	NULL	NULL	35745	N/A	5 CT	1.26	NULL	NULL	NULL	NULL	NULL	NULL	NULL	FirstIRIMtch	<UnAssigned>	NULL	NULL	2016-02-02 02:29:46.550	NULL	<UnAssigned>	<UnAssigned>	<UnAssigned>	0	-1	NULL	NULL	SNACK BARS	Extended Macrosnacks	TOTAL MACROSNACKS
2208	1906300091	NULL	Fruit2O Mixed Berry Flavored Sparkling Water Beverage 17 OZ BTL	NULL	NULL	NULL	<UnAssigned>	<UnAssigned>	<UnAssigned>	<UnAssigned>	0	0	0019063000911	FRUIT2O MIXED BERRY SPARKLING PURIFD WTR PLASTIC BOTTLE 1 CT 17 OZ 	BOTTLED WATER	SPARKLING/SELTZER WATER	TOTAL WATER	SPARKLING/SELTZER WATER	NULL	NULL	NULL	NULL	NULL	NULL	BRYNWOOD PARTNERS	Jw Childs Associates	BEVERAGE HOLDINGS	FRUIT2O MIXED BERRY SPARKLING PURIFD WTR PLASTIC BOTTLE 1 CT 17 OZ 	Fruit2O Mixed Berry Flavored Sparkling Water Beverage 17 OZ BTL	Fruit2O Mixed Berry Flavored Sparkling Water Beverage 17 OZ BTL	0	0	1	Other	FRUIT2O	FRUIT2O	SUNNY DELIGHT BEVERAGES CO	0	ShiptShare	NULL	NULL	NULL	NULL	NULL	NULL	NULL	NULL	NULL	NULL	168411	N/A	1 CT	17.0	NULL	NULL	NULL	NULL	NULL	NULL	NULL	FirstIRIMtch	<UnAssigned>	NULL	NULL	2016-02-02 02:29:46.550	NULL	<UnAssigned>	<UnAssigned>	<UnAssigned>	0	-1	NULL	NULL	TOTAL WATER	Beverages RTD	PAB LRB
3477	3800039120	NULL	Kel Froot Loops	NULL	NULL	NULL	<UnAssigned>	<UnAssigned>	<UnAssigned>	<UnAssigned>	0	0	3800039120	KELL FROOT LOOPS 17 OZ	COLD CEREAL	RTE CEREAL	RTE CEREAL	RTE CEREAL	NULL	NULL	NULL	NULL	NULL	NULL	KELLOGG CO	KELLOGG COMPANY	KELLOGG CO	KELL FROOT LOOPS 17 OZ	Kel Froot Loops	Kel Froot Loops	0	0	1	Other	NULL	NULL	KELLOGG	0	PeapodShare	NULL	NULL	NULL	NULL	NULL	NULL	NULL	NULL	NULL	NULL	740735	NULL	NULL	NULL	NULL	NULL	NULL	NULL	NULL	NULL	NULL	FirstIRIMtch	<UnAssigned>	NULL	NULL	2016-02-02 02:29:46.550	NULL	<UnAssigned>	<UnAssigned>	<UnAssigned>	0	-1	NULL	NULL	RTE CEREAL	Quaker Core	QUAKER FOODS
3480	3800078174	NULL	Kellogg's Froot Loops Cereal Treasures 10.5 OZ BOX	NULL	NULL	NULL	<UnAssigned>	<UnAssigned>	<UnAssigned>	<UnAssigned>	0	0	0038000781741	KELLOGGS FROOT LOOPS TREASURES MULTI GRAIN ASSORTED FRUIT 1 CT 10.5 OZ 	COLD CEREAL	RTE CEREAL	RTE CEREAL	RTE CEREAL	NULL	NULL	NULL	NULL	NULL	NULL	KELLOGG CO	Kellogg Company	KELLOGG CO	KELLOGGS FROOT LOOPS TREASURES MULTI GRAIN ASSORTED FRUIT 1 CT 10.5 OZ 	Kellogg's Froot Loops Cereal Treasures 10.5 OZ BOX	Kellogg's Froot Loops Cereal Treasures 10.5 OZ BOX	0	0	1	Other	KELLOGGS FROOT LOOPS TREASURES	KELLOGGS FROOT LOOPS (ALL)	KELLOGG CO	0	PeapodShare	NULL	NULL	NULL	NULL	NULL	NULL	NULL	NULL	NULL	NULL	189581	N/A	1 CT	10.5	NULL	NULL	NULL	NULL	NULL	NULL	NULL	FirstIRIMtch	<UnAssigned>	NULL	NULL	2016-02-02 02:29:46.550	NULL	<UnAssigned>	<UnAssigned>	<UnAssigned>	0	-1	NULL	NULL	RTE CEREAL	Quaker Core	QUAKER FOODS
3483	3800031838	NULL	Kellogg's Frosted Flakes Cereal 15 OZ BOX	NULL	NULL	NULL	<UnAssigned>	<UnAssigned>	<UnAssigned>	<UnAssigned>	0	0	0038000318381	KELLOGGS FROSTED FLAKES CORN FLAKE REGULAR 1 CT 17 OZ 	COLD CEREAL	RTE CEREAL	RTE CEREAL	RTE CEREAL	NULL	NULL	NULL	NULL	NULL	NULL	KELLOGG CO	NULL	KELLOGG CO	KELLOGGS FROSTED FLAKES CORN FLAKE REGULAR 1 CT 17 OZ 	Kellogg's Frosted Flakes Cereal 15 OZ BOX	Kellogg's Frosted Flakes Cereal 15 OZ BOX	0	0	1	Other	KELLOGGS FROSTED FLAKES (BASE)	KELLOGGS FROSTED FLAKES (ALL)	KELLOGG CO	0	ShiptShare	NULL	NULL	NULL	NULL	NULL	NULL	NULL	NULL	NULL	NULL	35574	N/A	1 CT	17.0	NULL	NULL	NULL	NULL	NULL	NULL	NULL	FirstIRIMtch	<UnAssigned>	NULL	NULL	2016-02-02 02:29:46.550	NULL	<UnAssigned>	<UnAssigned>	<UnAssigned>	0	-1	FOO REG WRP 1/6	1	RTE CEREAL	Quaker Core	QUAKER FOODS
3484	3800059655	NULL	Kel Frosted Flakes	NULL	NULL	NULL	<UnAssigned>	<UnAssigned>	<UnAssigned>	<UnAssigned>	0	0	3800059655	KELL FROSTED FLAKES 15 OZ	COLD CEREAL	RTE CEREAL	RTE CEREAL	RTE CEREAL	NULL	NULL	NULL	NULL	NULL	NULL	KELLOGG CO	Kellogg Company	KELLOGG CO	KELL FROSTED FLAKES 15 OZ	Kel Frosted Flakes	Kel Frosted Flakes	0	0	1	Other	NULL	NULL	KELLOGG	0	PeapodShare	NULL	NULL	NULL	NULL	NULL	NULL	NULL	NULL	NULL	NULL	748183	NULL	NULL	NULL	NULL	NULL	NULL	NULL	NULL	NULL	NULL	FirstIRIMtch	<UnAssigned>	NULL	NULL	2016-02-02 02:29:46.550	NULL	<UnAssigned>	<UnAssigned>	<UnAssigned>	0	-1	NULL	NULL	RTE CEREAL	Quaker Core	QUAKER FOODS
3485	3800001527	NULL	Kellogg's Frosted Flakes Cereal 19 OZ BOX	NULL	NULL	NULL	<UnAssigned>	<UnAssigned>	<UnAssigned>	<UnAssigned>	0	0	0038000015271	KELLOGGS FROSTED FLAKES CORN FLAKE REGULAR VALUE NOT AVAILABLE 1 CT 25 OZ - 0038000015271	RTE CEREAL	RTE CEREAL	RTE CEREAL	RTE CEREAL	NULL	NULL	NULL	NULL	NULL	NULL	KELLOGG CO	NULL	KELLOGG CO	KELLOGGS FROSTED FLAKES CORN FLAKE REGULAR VALUE NOT AVAILABLE 1 CT 25 OZ - 0038000015271	Kellogg's Frosted Flakes Cereal 19 OZ BOX	Kellogg's Frosted Flakes Cereal 19 OZ BOX	0	0	1	Other	NULL	NULL	KELLOGG CO	0	PeapodShare	NULL	NULL	NULL	NULL	NULL	NULL	NULL	NULL	NULL	NULL	35111	NULL	NULL	NULL	NULL	NULL	NULL	NULL	NULL	NULL	NULL	FirstIRIMtch	<UnAssigned>	NULL	NULL	2016-02-02 02:29:46.550	NULL	<UnAssigned>	<UnAssigned>	<UnAssigned>	0	-1	NULL	NULL	RTE CEREAL	Quaker Core	QUAKER FOODS
1221	68826704779	NULL	Clear Splash Acai Blueberry Sparkling Water Beverage 1 LTR BTL	NULL	NULL	NULL	<UnAssigned>	<UnAssigned>	<UnAssigned>	<UnAssigned>	0	0	0688267047791	PRIVATE LABEL ACAI BLUEBERRY SPARKLING WATER PLASTIC BOTTLE 1 CT 33.8 OZ 	BOTTLED WATER	SPARKLING/SELTZER WATER	TOTAL WATER	SPARKLING/SELTZER WATER	NULL	NULL	NULL	NULL	NULL	NULL	PRIVATE LABEL	NULL	PRIVATE LABEL	PRIVATE LABEL ACAI BLUEBERRY SPARKLING WATER PLASTIC BOTTLE 1 CT 33.8 OZ 	Clear Splash Acai Blueberry Sparkling Water Beverage 1 LTR BTL	Clear Splash Acai Blueberry Sparkling Water Beverage 1 LTR BTL	0	0	1	Other	PRIVATE LABEL	PRIVATE LABEL	PRIVATE LABEL	0	PeapodShare	NULL	NULL	NULL	NULL	NULL	NULL	NULL	NULL	NULL	NULL	110964	N/A	1 CT	33.8	NULL	NULL	NULL	NULL	NULL	NULL	NULL	ElvnDgtIRIMtch	<UnAssigned>	NULL	NULL	2016-02-02 02:29:46.550	NULL	<UnAssigned>	<UnAssigned>	<UnAssigned>	0	-1	NULL	NULL	TOTAL WATER	Beverages RTD	PAB LRB
3459	3800000120	NULL	Kel Cornflakes	NULL	NULL	NULL	<UnAssigned>	<UnAssigned>	<UnAssigned>	<UnAssigned>	0	0	3800000120	KELL CORN FLAKES 18 OZ	COLD CEREAL	RTE CEREAL	RTE CEREAL	RTE CEREAL	NULL	NULL	NULL	NULL	NULL	NULL	KELLOGG CO	Kellogg Company	KELLOGG CO	KELL CORN FLAKES 18 OZ	Kel Cornflakes	Kel Cornflakes	0	0	1	Other	NULL	NULL	KELLOGG	0	PeapodShare	NULL	NULL	NULL	NULL	NULL	NULL	NULL	NULL	NULL	NULL	744838	NULL	NULL	NULL	NULL	NULL	NULL	NULL	NULL	NULL	NULL	FirstIRIMtch	<UnAssigned>	NULL	NULL	2016-02-02 02:29:46.550	NULL	<UnAssigned>	<UnAssigned>	<UnAssigned>	0	-1	NULL	NULL	RTE CEREAL	Quaker Core	QUAKER FOODS
3475	3800076546	NULL	Kel-Fp Protein Peanut	NULL	NULL	NULL	<UnAssigned>	<UnAssigned>	<UnAssigned>	<UnAssigned>	0	0	0038000765461	KELLOGGS FIBER PLUS COATED PEANUT CHEWY 5 CT 7 OZ 	SNACK BARS/GRANOLA BARS	SNACK BARS	WHOLESOME SNACKS EX LITE SNACKS	SNACK BARS	NULL	NULL	NULL	NULL	NULL	NULL	KELLOGG CO	Kellogg Company	KELLOGG CO	KELLOGGS FIBER PLUS COATED PEANUT CHEWY 5 CT 7 OZ 	Kel-Fp Protein Peanut	Kel-Fp Protein Peanut	0	0	1	Other	KELLOGGS FIBER PLUS PROTEIN	KELLOGGS FIBER PLUS	KELLOGG CO	0	ShiptShare	NULL	NULL	NULL	NULL	NULL	NULL	NULL	NULL	NULL	NULL	36295	N/A	5 CT	1.4	NULL	NULL	NULL	NULL	NULL	NULL	NULL	FirstIRIMtch	<UnAssigned>	NULL	NULL	2016-02-02 02:29:46.550	NULL	<UnAssigned>	<UnAssigned>	<UnAssigned>	0	-1	COO REG WRP 1/20	1	SNACK BARS	Extended Macrosnacks	TOTAL MACROSNACKS
2201	60543138202	NULL	Froose Fruit Flavored Gummy Snacks Assorted - 5 ct 4.5 OZ PKG	NULL	NULL	NULL	<UnAssigned>	<UnAssigned>	<UnAssigned>	<UnAssigned>	0	0	0605431382021	FROOSE PIECE ANIMAL ASSORTED FRUIT 4.5 OZ 5 CT 	WHOLESOME SNACKS EX LITE SNACKS	FRUIT SNACKS	WHOLESOME SNACKS EX LITE SNACKS	FRUIT SNACKS	NULL	NULL	NULL	NULL	NULL	NULL	FROOSE BRANDS	NULL	FROOSE BRANDS	FROOSE PIECE ANIMAL ASSORTED FRUIT 4.5 OZ 5 CT 	Froose Fruit Flavored Gummy Snacks Assorted - 5 ct 4.5 OZ PKG	Froose Fruit Flavored Gummy Snacks Assorted - 5 ct 4.5 OZ PKG	0	0	1	Other	FROOSE	FROOSE	FROOSE BRANDS	0	PeapodShare	NULL	NULL	NULL	NULL	NULL	NULL	NULL	NULL	NULL	NULL	103028	N/A	5 CT	0.9	NULL	NULL	NULL	NULL	NULL	NULL	NULL	ElvnDgtIRIMtch	<UnAssigned>	NULL	NULL	2016-02-02 02:29:46.550	NULL	<UnAssigned>	<UnAssigned>	<UnAssigned>	0	-1	NULL	NULL	EXT: NON-PEP CATEGORIES	Extended Macrosnacks	TOTAL MACROSNACKS
2205	1906300099	NULL	Fruit 2 O Lime Bluebr	NULL	NULL	NULL	<UnAssigned>	<UnAssigned>	<UnAssigned>	<UnAssigned>	0	0	0019063000991	FRUIT2O LIME TWISTS BLUEBERRY LIME SPARKLING WATER PLASTIC BOTTLE 1 CT 17 OZ 	BOTTLED WATER	SPARKLING/SELTZER WATER	TOTAL WATER	SPARKLING/SELTZER WATER	NULL	NULL	NULL	NULL	NULL	NULL	BRYNWOOD PARTNERS	Brynwood Partners L.P.	BEVERAGE HOLDINGS	FRUIT2O LIME TWISTS BLUEBERRY LIME SPARKLING WATER PLASTIC BOTTLE 1 CT 17 OZ 	Fruit 2 O Lime Bluebr	Fruit 2 O Lime Bluebr	0	0	1	Other	FRUIT2O LIME TWISTS	FRUIT2O	SUNNY DELIGHT BEVERAGES CO	0	ShiptShare	NULL	NULL	NULL	NULL	NULL	NULL	NULL	NULL	NULL	NULL	15204	N/A	1 CT	17.0	NULL	NULL	NULL	NULL	NULL	NULL	NULL	FirstIRIMtch	<UnAssigned>	NULL	NULL	2016-02-02 02:29:46.550	NULL	<UnAssigned>	<UnAssigned>	<UnAssigned>	0	-1	NULL	NULL	TOTAL WATER	Beverages RTD	PAB LRB
3478	3800039125	NULL	Kel Froot Loops	NULL	NULL	NULL	<UnAssigned>	<UnAssigned>	<UnAssigned>	<UnAssigned>	0	0	0038000391251	KELLOGGS FROOT LOOPS MULTI GRAIN RING FRUIT 1 CT 8.7 OZ 	COLD CEREAL	RTE CEREAL	RTE CEREAL	RTE CEREAL	NULL	NULL	NULL	NULL	NULL	NULL	KELLOGG CO	Kellogg Company	KELLOGG CO	KELLOGGS FROOT LOOPS MULTI GRAIN RING FRUIT 1 CT 8.7 OZ 	Kel Froot Loops	Kel Froot Loops	0	0	1	Other	KELLOGGS FROOT LOOPS (BASE)	KELLOGGS FROOT LOOPS (ALL)	KELLOGG CO	0	PeapodShare	NULL	NULL	NULL	NULL	NULL	NULL	NULL	NULL	NULL	NULL	35696	N/A	1 CT	8.7	NULL	NULL	NULL	NULL	NULL	NULL	NULL	FirstIRIMtch	<UnAssigned>	NULL	NULL	2016-02-02 02:29:46.550	NULL	<UnAssigned>	<UnAssigned>	<UnAssigned>	0	-1	NULL	NULL	RTE CEREAL	Quaker Core	QUAKER FOODS
3479	3800063530	NULL	Kellogg's Froot Loops Cereal Cup 1.5 OZ PKG	NULL	NULL	NULL	<UnAssigned>	<UnAssigned>	<UnAssigned>	<UnAssigned>	0	0	3800063530	KELL FROOT LOOPS CUP 1.5 OZ	COLD CEREAL	RTE CEREAL	RTE CEREAL	RTE CEREAL	NULL	NULL	NULL	NULL	NULL	NULL	KELLOGG CO	Kellogg Company	KELLOGG CO	KELL FROOT LOOPS CUP 1.5 OZ	Kellogg's Froot Loops Cereal Cup 1.5 OZ PKG	Kellogg's Froot Loops Cereal Cup 1.5 OZ PKG	0	0	1	Other	NULL	NULL	KELLOGG	0	PeapodShare	NULL	NULL	NULL	NULL	NULL	NULL	NULL	NULL	NULL	NULL	741367	NULL	NULL	NULL	NULL	NULL	NULL	NULL	NULL	NULL	NULL	FirstIRIMtch	<UnAssigned>	NULL	NULL	2016-02-02 02:29:46.550	NULL	<UnAssigned>	<UnAssigned>	<UnAssigned>	0	-1	NULL	NULL	RTE CEREAL	Quaker Core	QUAKER FOODS
144	8912512000	NULL	Ancient Harvest Quinoa Traditional 100% Whole Grain Organic 12 OZ BOX	NULL	NULL	NULL	<UnAssigned>	<UnAssigned>	<UnAssigned>	<UnAssigned>	0	0	8912512000	ANCT HRV TRADITNL QUINOA 14.4 OZ	DRY BEANS/VEGETABLES	ETHNIC SPECIALTIES	RICE-PASTA-ETHNIC SPECIALTIES	ETHNIC SPECIALTIES	NULL	NULL	NULL	NULL	NULL	NULL	QUINOA CORP	NULL	QUINOA CORP	ANCT HRV TRADITNL QUINOA 14.4 OZ	Ancient Harvest Quinoa Traditional 100% Whole Grain Organic 12 OZ BOX	Ancient Harvest Quinoa Traditional 100% Whole Grain Organic 12 OZ BOX	0	0	1	Other	NULL	NULL	QUINOA	0	PeapodShare	NULL	NULL	NULL	NULL	NULL	NULL	NULL	NULL	NULL	NULL	757737	NULL	NULL	NULL	NULL	NULL	NULL	NULL	NULL	NULL	NULL	FirstIRIMtch	<UnAssigned>	NULL	NULL	2016-02-02 02:29:46.550	NULL	<UnAssigned>	<UnAssigned>	<UnAssigned>	0	-1	NULL	NULL	RICE-PASTA-ETHNIC SPECIALTIES	Quaker Core	QUAKER FOODS
1204	81829001390	NULL	Chob Smp100 Keylime	NULL	NULL	NULL	<UnAssigned>	<UnAssigned>	<UnAssigned>	<UnAssigned>	0	0	0818290013901	CHOBANI SIMPLY 100 KEY LIME YOGURT RFG 1 CT 5.3 OZ 	PEPSICO REVIEWS CATEGORIES US	YOGURT	PEPSICO REVIEWS CATEGORIES US	YOGURT	NULL	NULL	NULL	NULL	NULL	NULL	CHOBANI INC	Chobani Inc	CHOBANI INC	CHOBANI SIMPLY 100 KEY LIME YOGURT RFG 1 CT 5.3 OZ 	Chob Smp100 Keylime	Chob Smp100 Keylime	0	0	1	Other	CHOBANI SIMPLY 100	CHOBANI	CHOBANI INC	0	PeapodShare	NULL	NULL	NULL	NULL	NULL	NULL	NULL	NULL	NULL	NULL	282881	N/A	1 CT	NULL	NULL	NULL	NULL	NULL	NULL	NULL	NULL	ElvnDgtIRIMtch	<UnAssigned>	NULL	NULL	2016-02-02 02:29:46.550	NULL	<UnAssigned>	<UnAssigned>	<UnAssigned>	0	-1	NULL	NULL	DAIRY	NON-PEP CATEGORIES	NON-PEP CATEGORIES
1205	81829001389	NULL	Chob Smp100 Pnpl Cnut	NULL	NULL	NULL	<UnAssigned>	<UnAssigned>	<UnAssigned>	<UnAssigned>	0	0	0818290013891	CHOBANI SIMPLY 100 PINEAPPLE COCONUT YOGURT RFG 1 CT 5.3 OZ 	PEPSICO REVIEWS CATEGORIES US	YOGURT	PEPSICO REVIEWS CATEGORIES US	YOGURT	NULL	NULL	NULL	NULL	NULL	NULL	CHOBANI INC	Chobani Inc	CHOBANI INC	CHOBANI SIMPLY 100 PINEAPPLE COCONUT YOGURT RFG 1 CT 5.3 OZ 	Chob Smp100 Pnpl Cnut	Chob Smp100 Pnpl Cnut	0	0	1	Other	CHOBANI SIMPLY 100	CHOBANI	CHOBANI INC	0	PeapodShare	NULL	NULL	NULL	NULL	NULL	NULL	NULL	NULL	NULL	NULL	282880	N/A	1 CT	NULL	NULL	NULL	NULL	NULL	NULL	NULL	NULL	ElvnDgtIRIMtch	<UnAssigned>	NULL	NULL	2016-02-02 02:29:46.550	NULL	<UnAssigned>	<UnAssigned>	<UnAssigned>	0	-1	NULL	NULL	DAIRY	NON-PEP CATEGORIES	NON-PEP CATEGORIES
3468	3800078615	NULL	Kellogg's Crunchy Nut Cereal Roasted Nut & Honey O's 9.8 OZ BOX	NULL	NULL	NULL	<UnAssigned>	<UnAssigned>	<UnAssigned>	<UnAssigned>	0	0	0038000786151	KELLOGGS CRUNCHY NUT CORN AND OAT RING HONEY NUT 1 CT 9.8 OZ 	COLD CEREAL	RTE CEREAL	RTE CEREAL	RTE CEREAL	NULL	NULL	NULL	NULL	NULL	NULL	KELLOGG CO	Kellogg Company	KELLOGG CO	KELLOGGS CRUNCHY NUT CORN AND OAT RING HONEY NUT 1 CT 9.8 OZ 	Kellogg's Crunchy Nut Cereal Roasted Nut & Honey O's 9.8 OZ BOX	Kellogg's Crunchy Nut Cereal Roasted Nut & Honey O's 9.8 OZ BOX	0	0	1	Other	KELLOGGS CRUNCHY NUT ROASTED	KELLOGGS CRUNCHY NUT	KELLOGG CO	0	ShiptShare	NULL	NULL	NULL	NULL	NULL	NULL	NULL	NULL	NULL	NULL	189589	N/A	1 CT	9.8	NULL	NULL	NULL	NULL	NULL	NULL	NULL	FirstIRIMtch	<UnAssigned>	NULL	NULL	2016-02-02 02:29:46.550	NULL	<UnAssigned>	<UnAssigned>	<UnAssigned>	0	-1	NULL	NULL	RTE CEREAL	Quaker Core	QUAKER FOODS
2198	60418318050	NULL	Frontera Tortilla Chips Lime + Sea Salt 100% Natural 10 OZ BAG	NULL	NULL	NULL	<UnAssigned>	<UnAssigned>	<UnAssigned>	<UnAssigned>	0	0	0604183180501	FRONTERA TORTILLA CHIP LIME WITH SEA SALT BAG 10 OZ 	SALTY SNACKS	TORTILLA CHIPS	SALTY SNACKS	TORTILLA CHIPS	NULL	NULL	NULL	NULL	NULL	NULL	CONAGRA BRANDS	NULL	FRONTERA FOODS INC	FRONTERA TORTILLA CHIP LIME WITH SEA SALT BAG 10 OZ 	Frontera Tortilla Chips Lime + Sea Salt 100% Natural 10 OZ BAG	Frontera Tortilla Chips Lime + Sea Salt 100% Natural 10 OZ BAG	0	0	1	Other	FRONTERA	FRONTERA	CONAGRA BRANDS	0	PeapodShare	NULL	NULL	NULL	NULL	NULL	NULL	NULL	NULL	NULL	NULL	102927	XX-LARGE	1 CT	10.0	NULL	NULL	NULL	NULL	NULL	NULL	NULL	ElvnDgtIRIMtch	<UnAssigned>	NULL	NULL	2016-02-02 02:29:46.550	NULL	<UnAssigned>	<UnAssigned>	<UnAssigned>	0	-1	NULL	NULL	SALTY SNACKS	Savory Snacks	TOTAL MACROSNACKS
2199	60418318010	NULL	Frontera Tortilla Chips Thick + Crunchy 100% Natural 12 OZ BAG	NULL	NULL	NULL	<UnAssigned>	<UnAssigned>	<UnAssigned>	<UnAssigned>	0	0	0604183180102	FRONTERA TORTILLA CHIP ORIGINAL BAG 12 OZ 	SALTY SNACKS	TORTILLA CHIPS	SALTY SNACKS	TORTILLA CHIPS	NULL	NULL	NULL	NULL	NULL	NULL	CONAGRA BRANDS	NULL	FRONTERA FOODS INC	FRONTERA TORTILLA CHIP ORIGINAL BAG 12 OZ 	Frontera Tortilla Chips Thick + Crunchy 100% Natural 12 OZ BAG	Frontera Tortilla Chips Thick + Crunchy 100% Natural 12 OZ BAG	0	0	1	Other	FRONTERA	FRONTERA	CONAGRA BRANDS	0	PeapodShare	NULL	NULL	NULL	NULL	NULL	NULL	NULL	NULL	NULL	NULL	102925	XX-LARGE	1 CT	12.0	NULL	NULL	NULL	NULL	NULL	NULL	NULL	ElvnDgtIRIMtch	<UnAssigned>	NULL	NULL	2016-02-02 02:29:46.550	NULL	<UnAssigned>	<UnAssigned>	<UnAssigned>	0	-1	NULL	NULL	SALTY SNACKS	Savory Snacks	TOTAL MACROSNACKS
2203	87277400304	NULL	FRS Healthy Energy Apricot Nectarine Drink 11.5 OZ CAN	NULL	NULL	NULL	<UnAssigned>	<UnAssigned>	<UnAssigned>	<UnAssigned>	0	0	0872774003041	FRS HEALTHY ENERGY ENERGY DRINK APRICOT NECTARINE REGULAR 1 CT 11.5 OZ 	ENERGY DRINKS	ENERGY	ENERGY DRINKS CMBND	ENERGY	NULL	NULL	NULL	NULL	NULL	NULL	THE FRS CO	NULL	THE FRS CO	FRS HEALTHY ENERGY ENERGY DRINK APRICOT NECTARINE REGULAR 1 CT 11.5 OZ 	FRS Healthy Energy Apricot Nectarine Drink 11.5 OZ CAN	FRS Healthy Energy Apricot Nectarine Drink 11.5 OZ CAN	0	0	1	Other	FRS HEALTHY ENERGY	FRS HEALTHY ENERGY	THE FRS CO	0	PeapodShare	NULL	NULL	NULL	NULL	NULL	NULL	NULL	NULL	NULL	NULL	141106	N/A	1 CT	11.5	NULL	NULL	NULL	NULL	NULL	NULL	NULL	ElvnDgtIRIMtch	<UnAssigned>	NULL	NULL	2016-02-02 02:29:46.550	NULL	<UnAssigned>	<UnAssigned>	<UnAssigned>	0	-1	Can 11.5oz 24L	24	ENERGY	Beverages RTD	PAB LRB
