ASINMasterId,ASIN,ASIN_Name,BU,SubBU,PepsiBrand,BrandSource
1,B0005YXZMQ,"Aunt Jemima Pancake Syrup Lite, 24 oz",Quaker,Quaker,Aunt Jemima,Corporate
2,B00061ES1K,"Starbucks Doubleshot Espresso and Cream, 6.5 oz",Beverages,PBC,Starbucks,JV
3,B00099E93Q,"Quaker Granola Oats, Honey, Almonds & Raisins, 100% Natural, 28 oz",Quaker,Quaker,Quaker,Corporate
4,B00099XLXU,"Quaker Oats Quick 1-Minute Oatmeal, Breakfast Cereal, 18oz Canister",Quaker,Quaker,IQO,Corporate
5,B00099XM0M,"Quaker Chewy Dipps Granola Bars, Chocolate Chip, 6 ct - 1.09 oz each",Quaker,Quaker,Chewy,Corporate
6,B000PL0YEG,"Pasta Roni Fettuccine Alfredo, 4.7 oz",Quaker,Quaker,Pasta Roni,Corporate
7,B000PL0YG4,"Pasta Roni Angel Hair Pasta with Herbs, 4.8 oz",Quaker,Quaker,Pasta Roni,Corporate
8,B000PL2VTW,"Rice A Roni, Herb & Butter Flavor, Rice Mix, 7.2 oz",Quaker,Quaker,Rice a Roni,Corporate
9,B000PL2VW4,"Pasta Roni, Parmesan Cheese Flavor, 5.1 Oz",Quaker,Quaker,Pasta Roni,Corporate
10,B000PL478A,"Rice A Roni Rice Pilaf, 7.2 oz",Quaker,Quaker,Rice a Roni,Corporate
11,B000PRMFL0,"Smartfood White Cheddar Popcorn, 5 oz",FLNA,FLNA,Smartfood,Corporate
12,B000PRODOM,"Cheetos, Flamin Hot Crunchy, 9.5 oz",FLNA,FLNA,Cheetos,Corporate
13,B000PUJ01K,"Pasta Roni Shells and White Cheddar, 6.2 oz",Quaker,Quaker,Pasta Roni,Corporate
14,B000PWIR7Q,"Quaker Popped Rice Crisp Snacks, Gluten Free, Cheddar Cheese, 6.06 Ounce Bag",Quaker,Quaker,POPPED,Corporate
15,B000PWK3KK,Quaker Quick Oats Large - 42 oz,Quaker,Quaker,SQO,Corporate
16,B000PWK3MI,"Quaker Life Original Cereal, 18oz",Quaker,Quaker,Life,Corporate
17,B000PWK3OQ,"Quaker Rice Cakes, Gluten Free White Cheddar, 5.50 oz",Quaker,Quaker,Large Rice Cakes,Corporate
18,B000PWNIE8,"Quaker Old Fashioned Oatmeal, Breakfast Cereal, 42 oz Canister",Quaker,Quaker,SQO,Corporate
19,B000PWNIJI,"Quaker Rice Cakes, Lightly Salted, 4.47 oz",Quaker,Quaker,Large Rice Cakes,Corporate
20,B000Q6RHU4,"Tropicana, Orange Juice, No Pulp, 118 oz",Beverages,Tropicana,Tropicana,Corporate
21,B000Q6T6IU,"Dole 100% Juice, Orange Strawberry Banana, 59 oz",Beverages,Tropicana,Dole,Corporate
22,B000Q6V1XI,"Tropicana, Orange Juice with Calcium + Vitamin D, No Pulp, 118 oz",Beverages,Tropicana,Tropicana Pure Premium,Corporate
23,B000Q6V1YC,"Dole, 100% Juice Pineapple Orange Banana, 59 oz",Beverages,Tropicana,Dole,Corporate
24,B000R2Z2Y0,"Gatorade Thirst Quencher, Orange, 8 ct, 20 oz",Beverages,Gatorade,Gatorade,Corporate
25,B000R2Z2YK,"Gatorade Rain Thirst Quencher, Berry, 32 oz",Beverages,Gatorade,Gatorade,Corporate
26,B000R2Z32G,"Gatorade Thirst Quencher, Fruit Punch, 32 oz",Beverages,Gatorade,Gatorade,Corporate
27,B000R2Z330,"Gatorade Thirst Quencher, Orange, 32 oz",Beverages,Gatorade,Gatorade,Corporate
28,B000R30LLI,"Gatorade Thirst Quencher, Fruit Punch, 128 oz",Beverages,Gatorade,Gatorade,Corporate
29,B000R30LNG,"Gatorade Thirst Quencher, Lemon Lime, 32 oz",Beverages,Gatorade,Gatorade,Corporate
30,B000R32OOU,"Gatorade Frost Thirst Quencher, Glacier Freeze, 32 oz",Beverages,Gatorade,Gatorade,Corporate
31,B000R32ORW,"Gatorade Thirst Quencher, Orange, 64 oz",Beverages,Gatorade,Gatorade,Corporate
32,B000R32OS6,"Gatorade Thirst, Quencher, Lemon-Lime, 64 oz",Beverages,Gatorade,Gatorade,Corporate
33,B000R36GS0,"Gatorade Thirst Quencher, Lemon Lime, 8 ct, 20 oz",Beverages,Gatorade,Gatorade,Corporate
34,B000R36GTE,"Gatorade Frost Thirst Quencher, Riptide Rush, 32 oz",Beverages,Gatorade,Gatorade,Corporate
35,B000R36GUS,"Gatorade Thirst Quencher, Cool Blue, 32 oz",Beverages,Gatorade,Gatorade,Corporate
36,B000R36GV2,"Gatorade Fierce Thirst Quencher, Grape, 32 oz",Beverages,Gatorade,Gatorade,Corporate
37,B000R36GW6,"Gatorade Thirst Quencher, Fruit Punch, 64 oz",Beverages,Gatorade,Gatorade,Corporate
38,B000R36GXA,"Propel Zero Nutrient Enhanced Water, Lemon, 6 pk, 16.9 oz",Beverages,Gatorade,Propel,Corporate
39,B000R4EMCG,"Dole, 100% Juice  Orange Peach Mango, 59 oz",Beverages,Tropicana,Dole,Corporate
40,B000R93LL4,Near East Original Couscous - 10 oz,Quaker,Quaker,Near East,Corporate
41,B000R93LM8,"Near East Couscous, Roasted Garlic & Olive Oil, 5.8 Oz",Quaker,Quaker,Near East,Corporate
42,B000R96EVS,"Near East Rice Pilaf, 6.09 Oz",Quaker,Quaker,Near East,Corporate
43,B000R9AK5O,"Pepsi Cola 12-Pack, 12 oz cans (Packaging May Vary)",Beverages,PBC,Pepsi,Corporate
44,B000R9AKYU,"Mountain Dew, 12-Pack, 12 oz Cans",Beverages,PBC,Mountain Dew,Corporate
45,B000R9AL08,"Mountain Dew Diet Soda, 12 Ounce (12 Cans)",Beverages,PBC,Diet Mountain Dew,Corporate
46,B000R9AL0I,"Pepsi Diet Caffeine Free Soda, 12 oz (12 Cans)",Beverages,PBC,Diet Pepsi,Corporate
47,B000R9AL1M,"Schweppes Club Soda, 6-Pack, 10 oz Bottles",Beverages,PBC,Schweppes,Allied
48,B000R9AL4E,"Pepsi Cola Soda, 2 Liter",Beverages,PBC,Pepsi,Corporate
49,B000R9AL4O,"Diet Pepsi, 2 Liter",Beverages,PBC,Diet Pepsi,Corporate
50,B000R9AL4Y,"Mountain Dew, 2 Liter",Beverages,PBC,Mountain Dew,Corporate
51,B000R9ALCG,"Starbucks Doubleshot, 4-Pack, 6.5 oz Cans",Beverages,PBC,Starbucks,JV
52,B000R9ALD0,"Starbucks Doubleshot, Light, 4-Pack, 6.5 oz Cans",Beverages,PBC,Starbucks,JV
53,B000R9ALDU,"Starbucks Frappuccino, Mocha, Coffee Drink (4 Count, 9.5 Fl Oz Each)",Beverages,PBC,Starbucks,JV
54,B000R9ALEY,"Starbucks Frappuccino Lite Mocha, 4 pk, 9.5 oz Bottles",Beverages,PBC,Starbucks,JV
55,B000R9ALP8,"SOBE Life Water Strawberry Kiwi, 20 oz pack of 12",Beverages,PBC,SoBe,Corporate
56,B000R9COPS,"Pepsi Diet Wild Cherry Soda, 12 Ounce (12 Cans)",Beverages,PBC,Diet Pepsi,Corporate
57,B000R9COQ2,"Schweppes Tonic Water, 6-Pack, 10 oz Bottles",Beverages,PBC,Schweppes,Allied
58,B000R9COQW,"Schweppes Ginger Ale, 6-Pack, 10 oz Bottles",Beverages,PBC,Schweppes,Allied
59,B000R9COWG,"Mug Rootbeer, 2 Liter",Beverages,PBC,Mug,Corporate
60,B000R9CPH0,"SOBE Life Water Pomegranate Cherry, 20 oz",Beverages,PBC,SoBe,Corporate
61,B000R9DW5Y,"IZZE Sparkling Juice, Blackberry, 12 oz Glass Bottles, 4 Count",Beverages,NEB,Izze,Corporate
62,B000R9DW6S,"IZZE Sparkling Juice, Blueberry, 12 oz Glass Bottles, 4 Count",Beverages,NEB,Izze,Corporate
63,B000R9EEH4,"Aquafina Water, 16.9 oz (Pack of 24)",Beverages,PBC,Aquafina,Corporate
64,B000R9EENS,"Lipton Diet Green Tea with Citrus, 12-Pack, 16.9 oz Bottles",Beverages,PBC,Diet Lipton,JV
65,B000R9EEOM,"Lipton Diet Tea with Lemon, 12-Pack, 16.9 oz Bottles",Beverages,PBC,Diet Lipton,JV
66,B000R9EESS,"SOBE Life Water Blackberry Grape, 20 oz",Beverages,PBC,SoBe,Corporate
67,B000R9F3QA,"IZZE Sparkling Juice, Clementine, 12 oz Glass Bottles, 4 Count",Beverages,NEB,Izze,Corporate
68,B000R9F3VA,"IZZE Sparkling Juice, Grapefruit, 12 oz Glass Bottles, 4 Count",Beverages,NEB,Izze,Corporate
69,B000R9GMPQ,"Diet Pepsi Cola, 12 ct, 12 oz Cans (Packaging May Vary)",Beverages,PBC,Diet Pepsi,Corporate
70,B000R9GMR4,"Mug Root Beer, 12-Pack, 12 oz Cans",Beverages,PBC,Mug,Corporate
71,B000R9GN50,"Starbucks Frappuccino Vanilla, 4 pk, 9.5 oz Bottles",Beverages,PBC,Starbucks,JV
72,B000R9GN5K,"Starbucks Frappuccino Coffee, 1 Pack of 4 , 9.5 oz Bottles",Beverages,PBC,Starbucks,JV
73,B000R9GND2,"SOBE Orange Carrot, 20 oz",Beverages,PBC,SoBe,Corporate
74,B000RLPJPI,"Cracker Jack Popcorn & Peanuts, Caramel Coated (3 Count, 1 Oz Each)",FLNA,FLNA,Cracker Jack,Corporate
75,B000RLR0PK,"Pasta Roni Chicken & Broccoli Flavor, 4.7 oz",Quaker,Quaker,Pasta Roni,Corporate
76,B000RLR0T6,"Rice A Roni Savory Whole Grain Blends, Roasted Garlic Italiano, 4 oz",Quaker,Quaker,Rice a Roni,Corporate
77,B000RLT46S,"Rice A Roni Chicken Flavor, 6.9 oz",Quaker,Quaker,Rice a Roni,Corporate
78,B000RO2EJ4,"Rice A Roni, Chicken, 6.9 Oz",Quaker,Quaker,Rice a Roni,Corporate
79,B000ROB9ZY,"Gatorade A.M.Thirst Quencher, Tropical-Mango, 32 oz",Beverages,Gatorade,Gatorade,Corporate
80,B000RPUCQK,"Quaker Oats Old Fashioned Oatmeal, 18 oz Canister",Quaker,Quaker,SQO,Corporate
81,B000RPUD9Q,"Quaker Chewy Granola Bar, Reduced Sugar, Chocolate Chip, 6.7 oz",Quaker,Quaker,Chewy,Corporate
82,B000RPUDX2,"Quaker Popped Rice Snacks, Apple Cinnamon, 3.52 Oz",Quaker,Quaker,POPPED,Corporate
83,B000RPW04W,"Quaker Chewy Granola Bars 90 Calories Low Fat Chocolate Chunk, 8 ct, .84 oz each",Quaker,Quaker,Chewy,Corporate
84,B000RPW05G,Quaker Chewy Variety Pack - 6.7 oz,Quaker,Quaker,Chewy,Corporate
85,B000RPYYW8,"Quaker, Low Fat Oatmeal Raisin Granola Bars, 8 ct, .84 oz each",Quaker,Quaker,Chewy,Corporate
86,B000RPYZ3G,"Quaker Chewy Granola Bars Dipps Peanut Butter, 6 ct, 1.05 oz each",Quaker,Quaker,Chewy,Corporate
87,B000RPYZ5E,"Quaker Popped Rice Snacks, Cheddar Cheese, 3.03 Oz",Quaker,Quaker,POPPED,Corporate
88,B000RYHGWO,"Gatorade Fierce Thirst Quencher Sports Drink Melon, 32 oz",Beverages,Gatorade,Gatorade,Corporate
89,B000SR5XZ2,"Near East Taboule, 5.25 oz",Quaker,Quaker,Near East,Corporate
90,B000SRI41M,"Near East Couscous, Parmesan, 5.9 Oz",Quaker,Quaker,Near East,Corporate
91,B000SRI42Q,"Near East Spanish Rice Pilaf, 6.75 Oz",Quaker,Quaker,Near East,Corporate
92,B000SRK7JY,Near East Herb Chicken Couscous - 5.7 oz,Quaker,Quaker,Near East,Corporate
93,B000SRK7KS,"Near East Long Grain and Wild Rice, 6 Oz",Quaker,Quaker,Near East,Corporate
94,B000SRK7P8,"Near East Couscous, Toasted Pine Nut, 5.6 Oz",Quaker,Quaker,Near East,Corporate
95,B000SRLNYM,"Near East Almond Pilaf, 6.6 oz",Quaker,Quaker,Near East,Corporate
96,B000SRLO1O,"Near East Meditteranean Curry Couscous, 5.7 oz",Quaker,Quaker,Near East,Corporate
97,B000ST14FI,"Quaker Natural Granola Cereal, 28 Oz",Quaker,Quaker,Quaker,Corporate
98,B000UENGWK,"Doritos Tortilla Chips, Cool Ranch, 11 oz",FLNA,FLNA,Doritos,Corporate
99,B000UENHBU,"Tostitos Salsa Con Queso - Medium, 15 Ounce",FLNA,FLNA,Dips,Corporate
100,B000UENHH4,"Tostitos Scoops! Tortilla Chips, 10 Ounce",FLNA,FLNA,Tostitos,Corporate
101,B000UEP4D4,"Fritos Corn Chips, Original, 10.25 oz",FLNA,FLNA,Fritos,Corporate
102,B000UEP4E8,"Lay's Potato Chips, Original, 10 oz",FLNA,FLNA,Lay's,Corporate
103,B000UEP4GQ,"Lay's Kettle Cooked Potato Chips, Original, 8.5 oz",FLNA,FLNA,Kettles,Corporate
104,B000UEP4NO,"Santitas Yellow Corn Tortilla Chips, 11 Ounce",FLNA,FLNA,Santitas,Corporate
105,B000UEP57O,"Lay's Oven Baked Original Potato Crisps, 6.25 Ounce",FLNA,FLNA,Baked,Corporate
106,B000UER7JI,"Lay's Potato Chips, Wavy Original, 10 oz",FLNA,FLNA,Lay's,Corporate
107,B000UER7MU,"Ruffles Original Potato Chips, 9 Ounce",FLNA,FLNA,Ruffles,Corporate
108,B000UER87O,"Cheetos Oven Baked Crunchy Cheese Flavored Snacks, 7.65 Ounce",FLNA,FLNA,Baked,Corporate
109,B000UESJ2W,"Lay's Potato Chips, BBQ, 9.5 oz",FLNA,FLNA,Lay's,Corporate
110,B000UESJ4U,"Lay's Potato Chips, Sour Cream & Onion, 9.5 oz",FLNA,FLNA,Lay's,Corporate
111,B000UESJ8Q,"Ruffles Cheddar & Sour Cream Flavored Potato Chips, 8.5 Ounce",FLNA,FLNA,Ruffles,Corporate
112,B000UESJKO,"Frito-Lay Chips and Snacks Flavor Mix Variety Pack, 20 Count",FLNA,FLNA,FL VP/MP,Corporate
113,B000UEUA4C,"Munchies Cheese Fix Flavored Snack Mix, 8 Ounce",FLNA,FLNA,Munchies,Corporate
114,B000UEUA5Q,"Rold Gold Pretzels, Thins, orginal 16 oz",FLNA,FLNA,Rold Gold,Corporate
115,B000UEUAD8,"Tostitos Chunky Salsa - Medium, 15.5 Ounce",FLNA,FLNA,Dips,Corporate
116,B000UEUAGU,"Frito-Lay Chips Classic mix Multipack, 20 Count",FLNA,FLNA,FL VP/MP,Corporate
117,B000UEUAO2,"Tostitos Oven Baked Scoops! Tortilla Chips, 6.25 Ounce",FLNA,FLNA,Baked,Corporate
118,B000UVUGW6,"IZZE Sparkling Juice, Pomegranate, 12 oz Glass Bottles, 4 Count",Beverages,NEB,Izze,Corporate
119,B000UW1OLM,"IZZE Sparkling Juice, Apple, 12 oz Glass Bottles, 4 Count",Beverages,NEB,Izze,Corporate
120,B000V9JKQK,Quaker Apple Cinnamon Rice Cake - Gluten Free - 6.52 oz,Quaker,Quaker,Large Rice Cakes,Corporate
121,B000V9JKVK,"Quaker Popped Rice Snacks, Caramel Corn, 3.52 oz",Quaker,Quaker,POPPED,Corporate
122,B000V9MZKI,Quaker Chocolate Rice Cake - 7.23 oz,Quaker,Quaker,Large Rice Cakes,Corporate
123,B000V9MZUI,Quaker Mini Rice Kettle Corn - 3.52 oz,Quaker,Quaker,POPPED,Corporate
124,B000V9N002,"Quaker Rice Cakes, Salt Free , 4.5 oz",Quaker,Quaker,Large Rice Cakes,Corporate
125,B000V9QKVS,"Quaker Buttered Popcorn Rice Cakes, 4.47 oz",Quaker,Quaker,Large Rice Cakes,Corporate
126,B000VA2VGA,"Aunt Jemima Pancake Syrup, 24 Fl Oz",Quaker,Quaker,Aunt Jemima,Corporate
127,B000VA5WPM,"Aunt Jemima Pancake Syrup, Butter Lite, 24 oz",Quaker,Quaker,Aunt Jemima,Corporate
128,B000VDRJYG,"Gatorade Lemon Lime 6 ct, 12 oz",Beverages,Gatorade,Gatorade,Corporate
129,B000VDT7TQ,"Gatorade Frost Glacier Freeze, 20 oz",Beverages,Gatorade,Gatorade,Corporate
130,B000VDV1JK,"Gatorade Thirst Quencher, Orange, 12 oz, 6 Bottles",Beverages,Gatorade,Gatorade,Corporate
131,B000VDX83W,"Gatorade Lemon Lime Powder, 18.4 oz",Beverages,Gatorade,Gatorade,Corporate
132,B000VDZ286,"Gatorade Wide Mouth Fierce Grape, 8 ct, 20 oz",Beverages,Gatorade,Gatorade,Corporate
133,B000VDZ3IU,"Gatorade Thirst Quencher, Fruit Punch, 12 oz, 6 Bottles",Beverages,Gatorade,Gatorade,Corporate
134,B000VDZ3Q2,"Gatorade Wide Mouth Cool Blue, 8 ct, 20 oz",Beverages,Gatorade,Gatorade,Corporate
135,B000VK2GII,"Stacy's Pita Chip, Simply Naked, 8 Oz",FLNA,FLNA,Stacy's,Corporate
136,B000VK7UD4,"Stacy's Pita Chip, Parmesean Garlic Herb, 8 Oz",FLNA,FLNA,Stacy's,Corporate
137,B000VKA28E,Near East Garlic & Herb Pilaf - 6.3 oz,Quaker,Quaker,Near East,Corporate
138,B000WCZLLE,"Near East Couscous, Wild Mushroom And Herb, 5.4 oz",Quaker,Quaker,Near East,Corporate
139,B000WCZLO6,Near East Chicken Flavored Rice Pilaf - 6.25 oz,Quaker,Quaker,Near East,Corporate
140,B000WCZLQY,Near East Whole Grains Brown Rice Pilaf - 6.25 oz,Quaker,Quaker,Near East,Corporate
141,B000WD3MTG,"Stacy's Pita Chip, Cinnamon Sugar, 8 Oz",FLNA,FLNA,Stacy's,Corporate
142,B000WD5SIO,Near East Wild Mushroom & Herb Pilaf - 6.3 oz,Quaker,Quaker,Near East,Corporate
143,B000WDP40Q,"Near East Lentil Pilaf, 6.75 oz",Quaker,Quaker,Near East,Corporate
144,B000WDP43S,"Near East Roasted Chicken And Garlic Pilaf, 6.3 oz",Quaker,Quaker,Near East,Corporate
145,B000WDP47O,"Near East Long Grain & Whole Grain Rice with Chicken, 6.3 oz",Quaker,Quaker,Near East,Corporate
146,B000WGBMO0,"Aunt Jemima Pancake Mix, 2 lb",Quaker,Quaker,Aunt Jemima,Corporate
147,B000WGE2QK,"Aunt Jemima Pancake Mix, Buttermilk Complete, 2 lb",Quaker,Quaker,Aunt Jemima,Corporate
148,B000WH2I56,"Rice A Roni Whole Grain Spanish Rice Mix, 4.6 oz",Quaker,Quaker,Rice a Roni,Corporate
149,B000WH4P1Q,"Rice A Roni Nature's Way Long Grain & Wild Rice, 4.2 oz",Quaker,Quaker,Rice a Roni,Corporate
150,B000WH8H92,"Quaker Breakfast Cookies Oatmeal Chocolate Chip, 6 ct, 10.1 oz",Quaker,Quaker,Breakfast Cookies,Corporate
151,B000WH9DD6,"Rice A Roni Beef, 6.8 oz",Quaker,Quaker,Rice a Roni,Corporate
152,B000WHAGH8,"Quaker Instant Oatmeal, Dinosaur Eggs,Brown Sugar 8 ct, 14.1 oz",Quaker,Quaker,IQO,Corporate
153,B000WHAHJ0,Quaker Chewy Peanut Butter Chocolate Chunk Bars - 0.84 oz - 8 ct,Quaker,Quaker,Chewy,Corporate
154,B000WHAI6W,"Quaker S'Mores Granola Bars, 8 ct, .84 oz each",Quaker,Quaker,Chewy,Corporate
155,B000WHAINA,"Quaker Weight Control Instant Oatmeal, Maple and Brown Sugar, 8 Count (Pack of 1)",Quaker,Quaker,IQO Premium,Corporate
156,B000WHC8LK,"Quaker Instant Oatmeal, Fruit & Cream Low Sugar Variety Pack, 10 ct, 1.23 oz",Quaker,Quaker,IQO,Corporate
157,B000WHC9Y6,Quaker Instant Grits - 12 Oz,Quaker,Quaker,Grits,Corporate
158,B000WHE7S2,Quaker Chocolate Chip Bars - 0.84 oz - 8 Count,Quaker,Quaker,Chewy,Corporate
159,B000WHZLMI,Quaker Grits Quick Tube - 24 oz,Quaker,Quaker,Grits,Corporate
160,B000WLW9RY,"Naked, Juice Green Machine, 15.2 oz",Beverages,NEB,Naked Juice,Corporate
161,B000WLW9S8,"Naked, All Natural Juice Smoothie, Mighty Mango, 15.2 oz",Beverages,NEB,Naked Juice,Corporate
162,B000WLXMF2,"Naked, Juice Blue Machine, 15.2 oz",Beverages,NEB,Naked Juice,Corporate
163,B000WLXMFC,"Naked, Juice Protein Zone, 15.2 oz",Beverages,NEB,Naked Juice,Corporate
164,B000WLZHNM,"Naked, Juice Strawberry Banana, 15.2 oz",Beverages,NEB,Naked Juice,Corporate
165,B000YAQRJY,"Tazo Tea, Giant Peach, 13.8 oz",Beverages,PBC,Tazo,JV
166,B000YD5PNU,"Stacy's Pita Chips, Multi-Grain, 8 Oz",FLNA,FLNA,Stacy's,Corporate
168,B0010BZG48,"Naked, Pomegranate Juice, Blueberry 15.2 oz",Beverages,NEB,Naked Juice,Corporate
169,B0010XTTLM,"Quaker Chewy, Reduced Sugar, Variety Pack, 6.7 oz",Quaker,Quaker,Chewy,Corporate
170,B0010XTTMQ,"Quaker Instant Oatmeal, Lower Sugar Variety 10 pkts , 11.5oz",Quaker,Quaker,IQO,Corporate
171,B0010XTTOO,"Quaker Oatmeal To Go, Apples & Cinnamon, 6 Bars, 2.1 Ounce",Quaker,Quaker,QSBB,Corporate
172,B00112FGLE,"Near East Garlic Herb Long Grain Rice, 5.9 oz",Quaker,Quaker,Near East,Corporate
173,B00112GT7E,"Near East Tomato And Lentil Couscous, 6.1 oz",Quaker,Quaker,Near East,Corporate
174,B00112H43M,"Near East Roasted Garlic Creative Grains, 5.1 oz",Quaker,Quaker,Near East,Corporate
175,B00113113K,"Near East Roasted Garlic Vermicelli Pasta, 7 oz",Quaker,Quaker,Near East,Corporate
176,B0011CW7SY,"Near East, Whole Grain Blends, Roasted Pecan & Garlic, 5.4 oz",Quaker,Quaker,Near East,Corporate
177,B0011CZNXU,"Near East, Tomato Basil Rice Pilaf, 5.5 oz",Quaker,Quaker,Near East,Corporate
178,B0012V2NUG,"Lipton Brisk, Lemon Iced Tea, 12 pk, 12 oz",Beverages,PBC,Brisk,JV
179,B0014CUCU6,"Quaker Oatmeal Squares, Brown Sugar, Breakfast Cereal, 14.5 oz Box",Quaker,Quaker,QK Oat Squares Cereal,Corporate
180,B0014CWB1E,"Quaker Instant Oatmeal Regular, 12 ct, 11.8 oz",Quaker,Quaker,IQO,Corporate
181,B0014CY9TQ,"Quaker Instant Oatmeal Apples & Cinnamon, 10 ct, 1.51 oz",Quaker,Quaker,IQO,Corporate
182,B0014D00EI,"Quaker Instant Oatmeal Maple Brown Sugar, Lower Sugar, 10 ct, 1.19 oz",Quaker,Quaker,IQO,Corporate
183,B0014D00Q6,"Quaker Instant Oatmeal  Flavor Variety Pack (Maple Brown sugar, Cinnamon & spice, Apples & Cinnamon), 10 ct, 1.42 oz",Quaker,Quaker,IQO,Corporate
184,B0014D0142,"Quaker Instant Oatmeal, Fruit and Cream Strawberry N Cream, 10 ct, 1.23 oz",Quaker,Quaker,IQO,Corporate
185,B0014D01C4,"Quaker Instant Oatmeal, Fruit and Cream Variety Pack, 10 ct, 1.23 oz",Quaker,Quaker,IQO,Corporate
186,B0014D1JWA,"Quaker Instant Oatmeal Maple Brown Sugar, 10 ct, 1.51 oz",Quaker,Quaker,IQO,Corporate
187,B0014D1KKQ,"Quaker Instant Oatmeal, Fruit and Cream Peaches N Cream, 10 ct, 1.23 oz",Quaker,Quaker,IQO,Corporate
188,B0014E1D34,"Life Cereal, Cinnamon, 18 Oz",Quaker,Quaker,Life,Corporate
189,B0014E1GQS,Rice a Roni Chicken & Garlic - 5.9 oz,Quaker,Quaker,Rice a Roni,Corporate
190,B0014E2S8I,"Rice A Roni Rice & Pasta With Tomato, Mild Green Chiles & Mexican-Style Seasonings, 6.4 oz",Quaker,Quaker,Rice a Roni,Corporate
191,B0014E4IWC,"Pasta Roni, Four Cheese Flavor Corkscrew Pasta, 6 oz",Quaker,Quaker,Pasta Roni,Corporate
192,B0014E4KA2,"Rice A Roni, Long Grain & Wild Rice Original, 4.3 Oz",Quaker,Quaker,Rice a Roni,Corporate
193,B0014E6MQM,"Propel Zero Nutrient Enhanced Water, Grape, 24 oz",Beverages,Gatorade,Propel,Corporate
194,B0014E8738,"Rice A Roni Spanish Rice, 6.8 oz",Quaker,Quaker,Rice a Roni,Corporate
195,B0015GMY98,"Doritos Nacho Cheese Flavored Tortilla Chips, 12 Singles",FLNA,FLNA,Doritos,Corporate
196,B0015GMYFC,"Doritos Tortilla Chips, Spicy Sweet Chili, 11 oz",FLNA,FLNA,Doritos,Corporate
197,B0015GQ12O,"Doritos Tortilla Chips, Party Size Nacho Cheese, 16 oz",FLNA,FLNA,Doritos,Corporate
198,B0015GQ1GA,"Fritos Hot Bean Dip , 9 Ounce",FLNA,FLNA,Dips,Corporate
199,B0015GQ2EQ,"Lay's Smooth Ranch Dip,15 Ounce",FLNA,FLNA,Dips,Corporate
200,B0015GQBHE,"Ruffles Original  Potato Chips, Party Size! (13.5 Ounce)",FLNA,FLNA,Ruffles,Corporate
201,B0015GQCH8,"Tostitos Scoops! Tortilla Chips, Party Size! (14.5 Ounce)",FLNA,FLNA,Tostitos,Corporate
202,B0015GRZZG,"Lay's Oven Baked Barbecue Flavored Potato Crisps, 6.25 Ounce",FLNA,FLNA,Baked,Corporate
203,B0015GS0AU,"Cheetos Crunchy Cheese Flavored Snacks, 12 Singles",FLNA,FLNA,Cheetos,Corporate
204,B0015GS10O,"Fritos JalapeÃ±o Cheddar Cheese Dip, 9 Ounce",FLNA,FLNA,Dips,Corporate
205,B0015GS1AY,"Lay's Potato Chips, Party Size Classic, 13.75 oz",FLNA,FLNA,Lay's,Corporate
206,B0015GS4BU,"Simply Tostitos Blue Corn Tortilla Chips, 9 oz",FLNA,FLNA,Simply,Corporate
207,B0015GSBMM,"Tostitos Chunky Salsa - Mild, 15.5 Ounce",FLNA,FLNA,Dips,Corporate
208,B0015GSBUY,"Tostitos Original Restaurant Style  Tortilla Chips, Party Size! (18 Ounce)",FLNA,FLNA,Tostitos,Corporate
209,B0015GTFVS,"Cheetos Cheese Snacks, Party Size Cheetos Crunchy, 18.5 oz",FLNA,FLNA,Cheetos,Corporate
210,B0015GTGOY,"Lay's Potato Chips, Cheddar & Sour Cream, 9.5 oz",FLNA,FLNA,Lay's,Corporate
211,B0015GTJCI,"Simply Cheetos Puffs White Cheddar Cheese Flavored Snacks, 8 Ounce",FLNA,FLNA,Simply,Corporate
212,B0015GTJEQ,"Simply Lay's Sea Salted Thick Cut Potato Chips, 8.5 Ounce",FLNA,FLNA,Simply,Corporate
213,B0015GTQJO,"Rold Gold Pretzels, Cheddar Tiny Twists, 10 oz",FLNA,FLNA,Rold Gold,Corporate
214,B0015GTQKI,"Rold Gold Pretzels, original Sticks 16oz",FLNA,FLNA,Rold Gold,Corporate
215,B0015GTQNA,"Ruffles Potato Chips, Smokehouse Style BBQ, 8.5 oz",FLNA,FLNA,Ruffles,Corporate
216,B0015GTRIE,"Tostitos Multigrain Tortilla Chips, 9 Ounce",FLNA,FLNA,Tostitos,Corporate
217,B0015GVJCG,"Fritos Original Bean Dip, 9 Ounce",FLNA,FLNA,Dips,Corporate
218,B0015GVJM6,"Fritos Corn Chips, Original, 14 oz",FLNA,FLNA,Fritos,Corporate
219,B0015GVJMQ,"Fritos Corn Chips, Party Size Scoops, 19 oz",FLNA,FLNA,Fritos,Corporate
220,B0015GVKF2,"Lay's French Onion Dip, 15 Ounce",FLNA,FLNA,Dips,Corporate
221,B0015GVKHA,"Lay's Kettle Cooked Potato Chips, Salt & Vinegar, 8.5 oz",FLNA,FLNA,Kettles,Corporate
222,B0015GVKKC,"Lay's Potato Chips, Salt and Vinegar, 9.5 oz",FLNA,FLNA,Lay's,Corporate
223,B0015GVNCM,"Nut Harvest Lightly Roasted Almonds, 6 oz",FLNA,FLNA,Nut Harvest,Corporate
224,B0015GVNP4,"Simply Ruffles Sea Salted Potato Chips, 8 Ounce",FLNA,FLNA,Simply,Corporate
225,B0015GVNUO,"Simply Tostitos Yellow Corn Tortilla Chips, 9 oz",FLNA,FLNA,Simply,Corporate
226,B0015GVUES,"Rold Gold Pretzels, Braided Honey Wheat, 10 oz",FLNA,FLNA,Rold Gold,Corporate
227,B0015GVUJ8,"Rold Gold Pretzels, Honey Mustard Tiny Twists, 10 oz",FLNA,FLNA,Rold Gold,Corporate
228,B0015GVUMU,"Ruffles Potato Chips, Reduced Fat, 8.5 oz",FLNA,FLNA,Ruffles,Corporate
229,B0015GVUVG,"Smartfood Popcorn, Party Size White Cheddar, 11.5 oz",FLNA,FLNA,Smartfood,Corporate
230,B00181DDIG,Pepsi One - 12 CT,Beverages,PBC,Pepsi,Corporate
231,B001A5RU0W,"Gatorade G2, Orange, 8 Pack, 20 oz each",Beverages,Gatorade,Gatorade,Corporate
232,B001A5V6U2,"Gatorade G2, Grape, 32 oz",Beverages,Gatorade,Gatorade,Corporate
233,B001A5V788,"Gatorade G2, Grape, 8 Pack, 20 oz each",Beverages,Gatorade,Gatorade,Corporate
234,B001A5V7GU,"Gatorade G2, Low Calorie Fruit Punch, 8 Pack, 20 oz",Beverages,Gatorade,Gatorade,Corporate
235,B001A5WU0C,"Gatorade G2, Fruit Punch, 32 oz",Beverages,Gatorade,Gatorade,Corporate
236,B001A5WU2A,"Gatorade G2, Orange, 32 oz",Beverages,Gatorade,Gatorade,Corporate
237,B001BLMKYQ,"Starbucks frappuccino mocha 9.5 fl oz, Pack of 12",Beverages,PBC,Starbucks,JV
238,B001E6P5SQ,"Diet Pepsi Caffeine Free, 2 Liter",Beverages,PBC,Diet Pepsi,Corporate
239,B001E6P612,"Pepsi, 6pk, 24oz Bottles",Beverages,PBC,Pepsi,Corporate
240,B001E6PC8O,"Pepsi Wild Cherry Cola, 12pk, 12 oz Cans (Packaging May Vary)",Beverages,PBC,Pepsi,Corporate
241,B001E6R4NA,"Wild Cherry Pepsi, 2 Liter",Beverages,PBC,Pepsi,Corporate
242,B001E6R5G6,"Diet Mountain Dew, 2 Liter",Beverages,PBC,Diet Mountain Dew,Corporate
243,B001E6R5R0,"Mountain Dew, 6pk, 24oz Bottles",Beverages,PBC,Mountain Dew,Corporate
244,B001E6R97Q,"Mountain Dew Code Red, 2 Liter",Beverages,PBC,Mountain Dew,Corporate
245,B001E6RAPC,"Lipton Brisk, Lemon Iced Tea, 2 Liter",Beverages,PBC,Brisk,JV
246,B001E6T4EC,"Diet Pepsi Wild Cherry, 2 Liter",Beverages,PBC,Diet Pepsi,Corporate
247,B001E6TBIQ,"Diet Mug Root Beer, 12 ct, 12 oz Cans",Beverages,PBC,Diet Mug,Corporate
248,B001E6USEW,"Pepsi Caffeine Free, 12pk, 12 oz Cans",Beverages,PBC,Diet Pepsi,Corporate
249,B001E6UTHS,"Diet Pepsi, 6 ct, 24oz Bottles",Beverages,PBC,Diet Pepsi,Corporate
250,B001E6UUKE,"Pepsi Zero Sugar Cola, 12 ct, 12 oz Cans (Packaging May Vary)",Beverages,PBC,Diet Pepsi,Corporate
251,B001E6UXWO,"Diet Sierra Mist Free, 2 Liter",Beverages,PBC,Diet Mist Twst,Corporate
252,B001E6UZL8,"Moutain Dew Code Red, 12pk, 12 oz Cans",Beverages,PBC,Mountain Dew,Corporate
253,B001E6V18O,"Diet Sierra Mist Free, 12 Ounce Cans (Pack of 12)",Beverages,PBC,Diet Mist Twst,Corporate
254,B001E70S5K,"Schweppes Ginger Ale, 2 Liter",Beverages,PBC,Schweppes,Allied
255,B001EJNE3Q,"Quaker Instant Oatmeal, Raisin, Dates & Walnuts, 10 ct, 1.3 oz",Quaker,Quaker,IQO,Corporate
256,B001TAI2XC,"Muscle Milk, Chocolate Protein Nutrition Shake, 14 oz",Beverages,PBC,Muscle Milk,Allied
257,B001TAI2YG,"Muscle Milk, Vanilla Cream Protein Nutrition Shake, 14 oz",Beverages,PBC,Muscle Milk,Allied
258,B001TAI2ZK,"Muscle Milk, Strawberry Cream Protein Nutrition Shake, 14 oz",Beverages,PBC,Muscle Milk,Allied
259,B001TAI30E,"Muscle Milk, Light Chocolate Protein Nutrition Shake, 14 oz",Beverages,PBC,Muscle Milk,Allied
260,B001TAI32M,"Sobe Life Water, Fiji Apple Pear Zero calorie, 20 oz",Beverages,PBC,SoBe,Corporate
261,B001TAI33G,"Sobe Life Water, Black and Blueberry Zero Calorie, 20 oz",Beverages,PBC,SoBe,Corporate
262,B001TAI34A,"Sobe Life Water,  Yumberry Pomegranate Zero Calorie, 20 oz",Beverages,PBC,SoBe,Corporate
263,B001V6FTGM,"FREE SAMPLE: O.N.E. Coconut Water, 16.9 oz",Beverages,PBC,ONE,Corporate
264,B001V8LLNA,"Lipton, Diet Iced Green Tea Citrus Jug, 1 Gallon",Beverages,PBC,Diet Lipton,JV
265,B001V8RRO2,"Lipton, Iced Tea with Lemon Jug, Gallon",Beverages,PBC,Lipton,JV
266,B0028AWUDA,"Pepsi Made With Real Sugar, 12 ct, 12 oz Cans",Beverages,PBC,Pepsi,Corporate
267,B002GPFKOS,"IZZE Sparkling Juice, Peach, 12 oz Glass Bottles, 4 Count",Beverages,NEB,Izze,Corporate
268,B002M057RW,"Lay's Kettle Cooked Potato Chips, Mesquite BBQ, 8.5 oz",FLNA,FLNA,Kettles,Corporate
269,B002RZ1SC0,"Cheetos Cheese Snacks, Crunchy Regular, 12.50oz.",FLNA,FLNA,Cheetos,Corporate
270,B002RZ1SH0,"Doritos Tortilla Chips, Salsa Verde, 11 oz",FLNA,FLNA,Doritos,Corporate
271,B002RZ1SIY,"Doritos, Spicy Nacho, 12 Oz",FLNA,FLNA,Doritos,Corporate
