ASINMasterId,ASIN,ASIN_Name,BU,SubBU,PepsiBrand,BrandSource
2160,B00N4LUOJ4,"Munchies Cheese Fix Flavored Snack Mix, 1.75 Ounce (Pack of 64)",FLNA,FLNA,Munchies,Corporate
2161,B00N4LURLE,"Fritos Dip, Mild Cheddar and Jalapeno, 216 Ounce (Pack of 12)",FLNA,FLNA,Fritos,Corporate
2162,B00N4LURPA,"Tostitos Dip and Salsa, Medium, 288 Ounce (Pack of 12)",FLNA,FLNA,Dips,Corporate
2163,B00N4LURQY,"Tostitos Dip and Chunky Salsa, Mild, 186 Ounce (Pack of 12)",FLNA,FLNA,Dips,Corporate
2164,B00N4LURSM,"Munchies Cracker Sandwiches, Peanut Butter On Cheese, 136.32 Ounce (Pack of 96)",FLNA,FLNA,Munchies,Corporate
2165,B00N4LURUU,"Tostitos Dip and Salsa, Mild, 288 Ounce (Pack of 12)",FLNA,FLNA,Dips,Corporate
2166,B00N4LUVWE,"Tostitos Dip, Salsa Con Queso, 180 Ounce (Pack of 12)",FLNA,FLNA,Dips,Corporate
2167,B00N4LUW5U,"Tostitos Dip and Chunky Salsa, Medium, 186 Ounce (Pack of 12)",FLNA,FLNA,Dips,Corporate
2168,B00N4LUZFW,"Baked Lay's Oven Potato Crisps, Original, 43.75 Ounce (Pack of 7)",FLNA,FLNA,Baked,Corporate
2169,B00N4LV2MW,"Baked Lay's Oven Potato Crisps, Barbecue, 43.75 Ounce (Pack of 7)",FLNA,FLNA,Baked,Corporate
2170,B00N4LV5ZG,"Rold Gold Pretzels, Classic Sticks, 112 Ounce (Pack of 7)",FLNA,FLNA,Rold Gold,Corporate
2171,B00N4LV67I,"Baked Lay's Oven Potato Crisps, Barbecue, 71.68 Ounce (Pack of 64)",FLNA,FLNA,Baked,Corporate
2172,B00N4LV696,"Chester's Puffcorn, Cheddar Cheese, 54 Ounce (Pack of 12)",FLNA,FLNA,Chesters,Corporate
2173,B00N4LV6AA,"Rold Gold Pretzel Thins, Parmesan and Garlic, 123.75 Ounce (Pack of 15)",FLNA,FLNA,Rold Gold,Corporate
2174,B00N4LV6KK,"Rold Gold Pretzel Thins, Regular, 123.75 Ounce (Pack of 15)",FLNA,FLNA,Rold Gold,Corporate
2175,B00N4LV8XA,"Rold Gold Pretzels, Thin Twists, 160 Ounce (Pack of 10)",FLNA,FLNA,Rold Gold,Corporate
2176,B00NCSMT9M,"Munchies Snack Mix, Jalapeno Cheddar, 3.25 Ounce (Pack of 28)",FLNA,FLNA,Munchies,Corporate
2177,B00NCSMTQ0,"Ruffles Potato Chips, Original, Party Size, 13.5 Ounce (Pack of 9)",FLNA,FLNA,Ruffles,Corporate
2178,B00NCSMTTM,"Doritos Dinamita, Chile Limon, 4 Ounce (Pack of 28)",FLNA,FLNA,Doritos,Corporate
2179,B00NCSN0E0,"Tostitos Artisan Tortilla Chips, Baked Three Cheese Queso, 6 Ounce (Pack of",FLNA,FLNA,Baked,Corporate
2180,B00NCSN0H2,"Fritos Corn Chips, Chili Cheese, 4.62 Ounce (Pack of 24)",FLNA,FLNA,Fritos,Corporate
2181,B00NCSN0JU,"Smartfood Delights Popcorn, White Cheddar, 6.5 Ounce (Pack of 6)",FLNA,FLNA,Smartfood,Corporate
2182,B00NCSN0VI,"Tostitos Artisan Tortilla Chips, Black Bean, 6 Ounce (Pack of 8)",FLNA,FLNA,Tostitos,Corporate
2183,B00NCSN3XI,"Twistos Baked Snacks, Asiago, 5.3 Ounce (Pack of 15)",FLNA,FLNA,Baked,Corporate
2184,B00NCSN400,"Lay's Potato Chips, Apple, 1.375 Ounce (Pack of 64)",FLNA,FLNA,Lay's,Corporate
2185,B00NCSN46Y,"Tostitos Artisan Tortilla Chips, Grilled Red Pepper and Tomato Salsa, 6 Ounce (Pack of 8)",FLNA,FLNA,Tostitos,Corporate
2186,B00NCSN48C,"Smartfood Delights Popcorn, Sea Salt, 5.5 Ounce (Pack of 8)",FLNA,FLNA,Smartfood,Corporate
2187,B00NCSN4DW,"Twistos Baked Snacks, Parmesan and Garlic, 5.3 Ounce (Pack of 15)",FLNA,FLNA,Baked,Corporate
2188,B00NCSN8OC,"Lay's Potato Chips, Thick Cut with Sea Salt, 8.5 Ounce (Pack of 6)",FLNA,FLNA,Lay's,Corporate
2189,B00NCSN8PG,"Twistos Baked Snacks, Bruschetta, 5.3 Ounce (Pack of 15)",FLNA,FLNA,Baked,Corporate
2190,B00NCSN93M,"Ruffles Deep Ridge, Thick Cut Barbecue, 7.5 Ounce (Pack of 12)",FLNA,FLNA,Ruffles,Corporate
2191,B00NCSN9DM,"Doritos Dinamita, Habanero, 4 Ounce (Pack of 28)",FLNA,FLNA,Doritos,Corporate
2192,B00NCSNCVG,"Tostitos Tortilla Chips, Blue Corn, 9 Ounce (Pack of 6)",FLNA,FLNA,Tostitos,Corporate
2193,B00NCSNCZC,"Munchies Snack Mix, Flamin Hot, 8 Ounce (Pack of 15)",FLNA,FLNA,Munchies,Corporate
2194,B00NCSNDAG,"Munchies Snack Mix, Flamin Hot, 3.25 Ounce (Pack of 28)",FLNA,FLNA,Munchies,Corporate
2195,B00NCSNDG0,"Munchies Snack Mix, Jalapeno Cheddar, 11.04 Ounce (Pack of 12)",FLNA,FLNA,Munchies,Corporate
2196,B00NCSNDGK,"Munchies Crackers, Jalapeno and Cheddar, 1.38 Ounce (Pack of 96)",FLNA,FLNA,Munchies,Corporate
2197,B00NCSNG5S,"Tostitos Dip, Queso Blanco, 15 Ounce (Pack of 12)",FLNA,FLNA,Dips,Corporate
2198,B00NCSNG8A,"Tostitos Dip, Chipotle Salsa, 15.5 Ounce (Pack of 12)",FLNA,FLNA,Dips,Corporate
2199,B00NCSNGJY,"Tostitos Dip, Toasted Garlic Salsa, 15.5 Ounce (Pack of 12)",FLNA,FLNA,Dips,Corporate
2200,B00NCSNGVW,"Lay's Dip, French Onion, 15 Ounce (Pack of 12)",FLNA,FLNA,Lay's,Corporate
2201,B00NCSNGX0,"Tostitos Dip, Salsa Con Queso, 23 Ounce (Pack of 12)",FLNA,FLNA,Dips,Corporate
2202,B00NCSNJVO,"Tostitos Dip, Creamy Spinach, 15 Ounce (Pack of 12)",FLNA,FLNA,Dips,Corporate
2203,B00NCSNK0E,"Tostitos Dip, Smooth Cheddar, 15 Ounce (Pack of 12)",FLNA,FLNA,Dips,Corporate
2204,B00NCSNK0Y,"Lay's Dip, Creamy Ranch, 15 Ounce (Pack of 12)",FLNA,FLNA,Lay's,Corporate
2205,B00NCSNK4A,"Ruffles Dip, Buffalo Ranch, 15 Ounce (Pack of 12)",FLNA,FLNA,Ruffles,Corporate
2206,B00NCSNK5O,"Tostitos Dip, Variety Pack, 45.5 Ounce",FLNA,FLNA,Dips,Corporate
2207,B00NCSNO9Q,"Baked Ruffles Oven Baked Ruffles Potato Crisps, Original, 6.25 Ounce (Pack of 8)",FLNA,FLNA,Baked,Corporate
2208,B00NCSNONM,"Matador Meats, Teriyaki, 3 Ounce (Pack of 12)",FLNA,FLNA,Matador,Corporate
2209,B00NCSNOZK,"Matador Meats, Original, 3 Ounce (Pack of 12)",FLNA,FLNA,Matador,Corporate
2210,B00NCSNTSC,"Baked Ruffles Oven Baked Ruffles Potato Crisps, Cheddar and Sour Cream, 6.25 Ounce (Pack of 8)",FLNA,FLNA,Baked,Corporate
2211,B00NCSNTVO,"Matador Meats, Original, 1 Ounce (Pack of 90)",FLNA,FLNA,Matador,Corporate
2212,B00NCSNUEK,"Matador Meats, Hot, 1 Ounce (Pack of 90)",FLNA,FLNA,Matador,Corporate
2213,B00NETE80W,"Ruffles Ridged Potato Chips, Cheddar and Sour Cream, 7.75 Ounce",FLNA,FLNA,Ruffles,Corporate
2214,B00NJWISPK,"Quaker Baked Protein Bars, Peanut Butter Chocolate, Breakfast Bars, 5 Bars Per Box (Pack of 8 Boxes) Net Wt 8.2 Oz",Quaker,Quaker,Baked Bars,Corporate
2215,B00NJWISZK,"Quaker Popped Rice Crisp Snacks, Tortilla Chips, Cheesy Nacho, 6.06oz Bag (Pack of 6 Bags)",Quaker,Quaker,POPPED,Corporate
2216,B00NJWIU3A,"Quaker Protein Baked Bars, Oatmeal Raisin, Breakfast Bars, 1.65oz - 5 count (Pack of 8 )",Quaker,Quaker,Breakfast Cookies,Corporate
2217,B00NJWIUNK,"Quaker Popped Tortilla Style Chips, Tangy Ranch, 6.06 Ounce (Pack of 6)",Quaker,Quaker,POPPED,Corporate
2218,B00NJWJ4Q2,"Quaker Popped Rice Crisp Snacks, Wild Blueberry, 7oz Bags (Pack of 6 Bags)",Quaker,Quaker,POPPED,Corporate
2219,B00NJWJ6H4,"Quaker Popped Rice Crisp Snacks, Blackberry Pomegranate, 7oz Bags (Pack of 6 Bags)",Quaker,Quaker,POPPED,Corporate
2220,B00O6KGPAO,"Fritos Original Corn Chips, 1 Ounce (Pack of 50)",FLNA,FLNA,Fritos,Corporate
2221,B00OC4YSNA,"Lay's Barbecue Flavored Potato Chips, 7.75 Ounce",FLNA,FLNA,Lay's,Corporate
2222,B00OCNNYQ8,"Near East Quinoa and Brown Rice Blend, Zesty Lemon, 5.22 oz per box, (Pack of 12 Boxes)",Quaker,Quaker,Near East,Corporate
2223,B00OCNO0NE,"Near East Quinoa and Brown Rice Blend, Mediterranean Medley (Pack of 12 Boxes)",Quaker,Quaker,Near East,Corporate
2224,B00OGOVC6M,"Ruffles Ridged Potato Chips, Sour Cream and Onion, 7.75 Ounce",FLNA,FLNA,Ruffles,Corporate
2225,B00OORNBUQ,"Cracker Jack Caramel Popcorn, Original, 4.25 Ounce (Pack of 24)",FLNA,FLNA,Cracker Jack,Corporate
2226,B00OOVPDWG,"Frito Lay Classic Variety Pack, 32 Ounce",FLNA,FLNA,FL VP/MP,Corporate
2227,B00OOVQ758,"Frito Lay Flavor Variety Pack, 32 Ounce",FLNA,FLNA,FL VP/MP,Corporate
2228,B00OOVTN6I,"Frito-lay Baked and Popped Variety Pack Chips, 37.25 Ounce",FLNA,FLNA,FL VP/MP,Corporate
2229,B00OOVTUBQ,"Frito-Lay Bold/Spicy Variety Pack, 50 Ounce",FLNA,FLNA,FL VP/MP,Corporate
2230,B00OOVUP56,"Frito-Lay Flamin Hot Variety Pack, 54 Ounce",FLNA,FLNA,FL VP/MP,Corporate
2231,B00OOWML0M,"Grandma's Frosted Lemon Pie, 10.8 Ounce",FLNA,FLNA,Grandmas,Corporate
2232,B00OOWMREC,"Grandma's Minis, Chocolate Cremes, 12.2 Ounce",FLNA,FLNA,Grandmas,Corporate
2233,B00OOWMX6O,"Ruffles Crispy Fries, Cheddar, 5 Ounce",FLNA,FLNA,Ruffles,Corporate
2234,B00OOWOOHU,"Sunchips Harvest Cheddar, 6 Ounce",FLNA,FLNA,Sunchips,Corporate
2235,B00OOWOSMG,"Grandma's Minis, Vanilla Cremes, 12.2 Ounce",FLNA,FLNA,Grandmas,Corporate
2236,B00OOWPB9A,"Grandma's Minis, Variety Pack, 12.2 Ounce",FLNA,FLNA,Grandmas,Corporate
2237,B00OOWPEKG,"Grandma's Minis, Chocolate Chip, 12.2 Ounce",FLNA,FLNA,Grandmas,Corporate
2238,B00OOWPIAW,"Cheetos, Crunchy, 6 Count",FLNA,FLNA,Cheetos,Corporate
2239,B00OOWPLUY,"Ruffles Crispy Fries, Original, 5 Ounce",FLNA,FLNA,Ruffles,Corporate
2240,B00OOWPP5U,"Sunchips Harvest Mini Bites, Four Cheese, Tomato and Herb Flavored Multigra",FLNA,FLNA,Sunchips,Corporate
2241,B00OOWPZX2,"Rold Gold Thins, Three Cheese, 5 Ounce",FLNA,FLNA,Rold Gold,Corporate
2242,B00OOWQ6TO,"Munchies Snack Crackers Cheddar Cheese, 12.2 Ounce",FLNA,FLNA,Munchies,Corporate
2243,B00OOWQA0E,"Doritos Mini, Nacho Cheese and Cool Ranch, 6.8 Ounce",FLNA,FLNA,Doritos,Corporate
2244,B00P25M2GI,"Quaker Popped Rice Crisp Snacks, Buttered Popcorn, 6.06oz Large Bag (Pack of 6 Bags)",Quaker,Quaker,POPPED,Corporate
2245,B00P25M326,"Quaker Instant Oatmeal Express Cups, 50% Less Sugar, Apple Walnut, Breakfast Cereal, Individual Cups (Pack of 12)",Quaker,Quaker,IQO,Corporate
2246,B00P25M32G,"Quaker Instant Oatmeal Express Cups 50% Less Sugar, Cinnamon Pecan, 1.41 Ounce (Pack of 12)",Quaker,Quaker,IQO,Corporate
2247,B00P25M3GC,"Quaker Steel Cut Quick 3-minute Oatmeal, Brown Sugar and Cinnamon, 13.5 Ounce (6 Pack)",Quaker,Quaker,SQO,Corporate
2248,B00P25M3MG,"Quaker Steel Cut Oats, Quick 3-minute Oatmeal, Cranberries and Blueberries, Breakfast Cereal, 8 Packets Per Box (Pack of 6 Boxes)",Quaker,Quaker,SQO,Corporate
2249,B00P25M858,"Quaker Instant Oatmeal, Select Starts, Protein, Cranberry Almond, Breakfast Cereal, 6 Packets Per Box (Pack of 6 Boxes)",Quaker,Quaker,IQO,Corporate
2250,B00P25M97K,"Cap'n Crunch Breakfast Cereal, 12 Individual Cups",Quaker,Quaker,Cap'N Crunch,Corporate
2251,B00P25M99I,"Quaker Select Starts Protein Instant Oatmeal, Banana Nut, Breakfast Cereal, 6 Packets Per Box (Pack of 6)",Quaker,Quaker,IQO Premium,Corporate
2252,B00P25M9FC,"Cap'n Crunch Crunch Berries Breakfast Cereal, 1.3 oz, 12 Individual Cups",Quaker,Quaker,Cap'N Crunch,Corporate
2253,B00P25MA1U,"Quaker Instant Grits, Butter Flavor, Breakfast Cereal (Pack of 12)",Quaker,Quaker,Grits,Corporate
2254,B00P25ME4S,"Life Original Multigrain Breakfast Cereal, 12 Individual Cups",Quaker,Quaker,Life,Corporate
2255,B00P25ME52,"Quaker Organic Instant Oatmeal, Select Starts Maple & Brown Sugar, 8 Packets Per Box (Pack of 12 Boxes)",Quaker,Quaker,IQO,Corporate
2256,B00P25ME6G,"Life Cinnamon Multigrain Breakfast Cereal 12 Individual Cups ,2.29oz",Quaker,Quaker,Life,Corporate
2257,B00P25MEFC,"Quaker Organic Instant Oatmeal, Select Starts, Original, 8 Packets Per Box (Pack of 12 Boxes)",Quaker,Quaker,IQO,Corporate
2258,B00PO9HQLI,"Lay's Do Us A Flavor Finalist Flavor 4, 8 Ounce",FLNA,FLNA,Lay's,Corporate
2259,B00PWNAADM,"Ocean Spray Pact Cranberry Extract Water, Mango Passionfruit, 16 oz",Beverages,PBC,Ocean Spray,JV
2260,B00R0OBO2W,"Baked Cheetos Oven Cheese Snacks, Flamin Hot, 0.875 Ounce (Pack of 104)",FLNA,FLNA,Baked,Corporate
2261,B00R0OC4VM,"Cheetos Crunchy Cheese Flavored Snacks, 1 Ounce (Pack of 104)",FLNA,FLNA,Cheetos,Corporate
2262,B00R0OC52A,"Doritos Nacho Cheese Flavored Tortilla Chips, 1 Ounce (Pack of 104)",FLNA,FLNA,Doritos,Corporate
2263,B00R0OC570,"Baked Cheetos Oven Cheese Snacks, Crunchy, 0.875 Ounce (Pack of 104)",FLNA,FLNA,Baked,Corporate
2264,B00R0OC7UU,"Lay's Sour Cream & Onion Flavored Potato Chips, 1 Ounce (Pack of 104)",FLNA,FLNA,Lay's,Corporate
2265,B00R0OC7VY,"Doritos Cool Ranch Flavored Tortilla Chips, 1.75 Ounce (Pack of 64)",FLNA,FLNA,Doritos,Corporate
2266,B00R0OCAK2,"Smartfood Sweet & Salty Kettle Corn Flavored Popcorn, 1.5 Ounce (Pack of 64)",FLNA,FLNA,Smartfood,Corporate
2267,B00R0OCAMU,"Smartfood White Cheddar Flavored Popcorn, 1 Ounce (Pack of 64)",FLNA,FLNA,Smartfood,Corporate
2268,B00R0OCCOG,"Rold Gold Pretzel Thins, Three Cheese, 1.75 Ounce (Pack of 64)",FLNA,FLNA,Rold Gold,Corporate
2269,B00R0OCCXM,"Smartfood Delight White Cheddar Flavored Popcorn, 0.5 Ounce (Pack of 72)",FLNA,FLNA,Smartfood,Corporate
2270,B00R0OCCZA,"Rold Gold Heartzels Heart Shaped Pretzels, 0.7 Ounce (Pack of 104)",FLNA,FLNA,Rold Gold,Corporate
2271,B00R0OCD8G,"Lay's Oven Baked Barbecue Flavord Potato Crisps, 0.875 Ounce (Pack of 60)",FLNA,FLNA,Baked,Corporate
2272,B00R0OCF7A,"SunChips French Onion Flavored Multigrain Snacks, 1 Ounce (Pack of 104)",FLNA,FLNA,Sunchips,Corporate
2273,B00R0OCF84,"Lay's Oven Baked Original Potato Crisps, 0.875 Ounce (Pack of 60)",FLNA,FLNA,Baked,Corporate
2274,B00R0OCHGE,"Grandma's Sandwich Cookies, Vanilla Creme Minis, 2.12 Ounce (Pack of 60)",FLNA,FLNA,Grandmas,Corporate
2275,B00R1J38T8,"Fritos Corn Chips, Scoops, 9.75 Ounce",FLNA,FLNA,Fritos,Corporate
2276,B00R1J3INE,"Fritos Corn Chips, Chili Cheese, 9.75 Ounce",FLNA,FLNA,Fritos,Corporate
2277,B00R1J3N84,"Frito-Lay Doritos & Cheetos Mix Orange Variety Pack, 20 Count",FLNA,FLNA,FL VP/MP,Corporate
2278,B00R54W0EI,"Starbucks Refreshers Beverage, Raspberry Pomegranate, 12 oz",Beverages,PBC,Starbucks,JV
2279,B00RFYGCPG,"Grandma's Minis, Variety Pack, 12.2 Ounce",FLNA,FLNA,Grandmas,Corporate
2280,B00RSQDYP2,"Grandma's, Frosted Lemon Pie, 10.8 Ounce",FLNA,FLNA,Grandmas,Corporate
2281,B00RWBXFT8,Limited Edition Super Bowl XLIX 16oz Plastic Tumbler (Orange),Beverages,PBC,Pepsi,Corporate
2282,B00RWBXN4A,Limited Edition Super Bowl XLIX 16oz Plastic Tumbler (Colors May Vary),Beverages,PBC,Pepsi,Corporate
2283,B00S0AOINM,"Quaker Chewy Quinoa Granola Bars, Yogurt Fruit and Nut, 6.1 ounce (Pack of",Quaker,Quaker,Chewy,Corporate
2284,B00S0AOKGC,"Quaker Chewy Quinoa Granola Bars, Chocolate Nut Medley, Snack Bars, 5 Bars",Quaker,Quaker,Chewy,Corporate
2285,B00S0AOKI0,"Quaker Real Medleys Granola, Dark Chocolate Cranberry Almond, 11oz Bags (Pack of 6 Bags)",Quaker,Quaker,Quaker Medleys,Corporate
2286,B00S0AOKIA,"Quaker Real Medleys Super Grains Oatmeal+, Maple Pecan Raisin, Instant Oatmeal+ Breakfast Cereal (12 Cups) (Packaging May Vary)",Quaker,Quaker,Quaker Medleys,Corporate
2287,B00S0AOKJO,"Quaker Real Medleys Super Grains Oatmeal+, Banana Walnut, Instant Oatmeal+ Breakfast Cereal (12 Cups) (Packaging May Vary)",Quaker,Quaker,Quaker Medleys,Corporate
2288,B00S0AOKOE,"Quaker Real Medleys Granola, Summer Berry,10 Ounce (Pack of 6)",Quaker,Quaker,Quaker Medleys,Corporate
2289,B00SGSF292,"Cap'n Crunch Breakfast Cereal, 20oz Box",Quaker,Quaker,Cap'N Crunch,Corporate
2290,B00SGSKNXM,"Cap'N Crunch, Peanut Butter, 12.5-Ounce",Quaker,Quaker,Cap'N Crunch,Corporate
2291,B00SIQ00QC,"Cap'n Crunch Crunch Berries Breakfast Cereal, 18.7oz Box",Quaker,Quaker,Cap'N Crunch,Corporate
2292,B00SIQ0AGM,"Cap'n Crunch Peanut Butter Crunch Breakfast Cereal, 17.1oz Box",Quaker,Quaker,Cap'N Crunch,Corporate
2293,B00T0BUAWI,"Gatorade Whey Protein Recover Bars, Chocolate Caramel, 2.8 ounce bars (12 Count)",Beverages,Gatorade,Gatorade,Corporate
2294,B00T0BUB4K,"Gatorade Whey Protein Recover Bars, Mint Chocolate Crunch, 2.8 ounce bars (12 Count)",Beverages,Gatorade,Gatorade,Corporate
2295,B00T0BUBGS,"Gatorade Whey Protein Recover Bars, Cookies & CrÃ¨me, 2.8 ounce bars (12 Count)",Beverages,Gatorade,Gatorade,Corporate
2296,B00T0BUBI6,"Gatorade Whey Protein Recover Bars, Chocolate Chip, 2.8 ounce bars (12 Count)",Beverages,Gatorade,Gatorade,Corporate
2297,B00T8AVXMC,"Lay's Wavy Potato Chips, Original, 42 Ounce (Pack of 4)",FLNA,FLNA,Lay's,Corporate
2298,B00T8AVXQ8,"Lay's Potato Chips, BBQ, 40 Ounce (Pack of 4)",FLNA,FLNA,Lay's,Corporate
2299,B00T8AVXRW,"Lay's Potato Chips, Classic, 42 Ounce (Pack of 4)",FLNA,FLNA,Lay's,Corporate
2300,B00T8AVXZ4,"Lay's Potato Chips, Sour Cream and Onion, 40 Ounce (Pack of 4)",FLNA,FLNA,Lay's,Corporate
2301,B00T8AW9Z2,"Doritos Flavored Tortilla Chips, Spicy Sweet Chili, 42 Ounce (Pack of 4)",FLNA,FLNA,Doritos,Corporate
2302,B00T8AWA7E,"Lay's Kettle Cooked Chips, Mesquite BBQ, 32 Ounce (Pack of 4)",FLNA,FLNA,Lay's Kettle Cooked,Corporate
2303,B00T8AWA9C,"Lay's Kettle Cooked Chips, Jalapeno, 32 Ounce (Pack of 4)",FLNA,FLNA,Lay's Kettle Cooked,Corporate
2304,B00T8AWAC4,"Ruffles Potato Chips, Sour Cream and Onion, 36 Ounce (Pack of 4)",FLNA,FLNA,Ruffles,Corporate
2305,B00T8AWAFG,"Ruffles Potato Chips, Original, 38 Ounce (Pack of 4)",FLNA,FLNA,Ruffles,Corporate
2306,B00T8AWAOM,"Lay's Kettle Cooked Chips, Sea Salt and Vinegar, 32 Ounce (Pack of 4)",FLNA,FLNA,Lay's Kettle Cooked,Corporate
2307,B00T8AWAOW,"Ruffles Potato Chips, Cheddar Sour Cream, 36 Ounce (Pack of 4)",FLNA,FLNA,Ruffles,Corporate
2308,B00T8AWIFS,"Doritos Flavored Tortilla Chips, Nacho Cheese, 42 Ounce (Pack of 4)",FLNA,FLNA,Doritos,Corporate
2309,B00T8EKVVC,"Lay's Kettle Cooked Chips, Sea Salt and Cracked Pepper, 32 Ounce (Pack of 4)",FLNA,FLNA,Lay's Kettle Cooked,Corporate
2310,B00T8EKW7A,"Lay's Kettle Cooked Chips, Original, 32 Ounce (Pack of 4)",FLNA,FLNA,Lay's Kettle Cooked,Corporate
2311,B00T8EKXRY,"Doritos Flavored Tortilla Chips, Cool Ranch, 42 Ounce (Pack of 4)",FLNA,FLNA,Doritos,Corporate
2312,B00T8ELCXI,"Doritos Flavored Tortilla Chips, Spicy Nacho, 42 Ounce (Pack of 4)",FLNA,FLNA,Doritos,Corporate
2313,B00TEBGTD8,"Tostitos Dip-Etizers Four Cheese Queso, 10 Ounce",FLNA,FLNA,Dips,Corporate
2314,B00TEBGV4A,"Tostitos Dip-Etizers Cheesy Spinach & Artichoke Dip, 10 Ounce",FLNA,FLNA,Dips,Corporate
2315,B00TFR9MT4,"Pepsi Wild Cherry Cans (12 Count, 12 Fl Oz Each)",Beverages,PBC,Pepsi,Corporate
2316,B00TFRA0KO,"Mountain Dew Throwback Cans (12 Count, 12 Fl Oz Each)",Beverages,PBC,Mountain Dew,Corporate
2317,B00TFRA7KC,"Brisk Raspberry Iced Tea Cans (12 Count, 12 Fl Oz Each)",Beverages,PBC,Brisk,JV
2318,B00TFRADPG,"Brisk Iced Tea and Lemonade Cans(12 Count, 12 Fl Oz Each)",Beverages,PBC,Brisk,JV
2319,B00TFRAHRK,"Brisk Iced Tea, Lemon Cans (12 Count, 12 Fl Oz Each)",Beverages,PBC,Brisk,JV
2320,B00TFRANO2,"Mountain Dew Voltage Cans (12-count, 12 oz each)",Beverages,PBC,Mountain Dew,Corporate
2321,B00TMB1ODK,"Lay's Potato Chips, Bacon Mac and Cheese, 7.75 Ounce",FLNA,FLNA,Lay's,Corporate
2322,B00TNJ6QMA,"Doritos Jacked 3D Tortilla Snacks, Jalapeno Pepper Jack, 11.5 Ounce",FLNA,FLNA,Doritos,Corporate
2323,B00TS9HMLO,"Lay's Potato Chips, Barbecue, Family Size,10 Ounce",FLNA,FLNA,Lay's,Corporate
2324,B00TS9HVJC,"Lay's Potato Chips, Classic,Family Size,10.5 Ounce",FLNA,FLNA,Lay's,Corporate
2325,B00TS9I0CO,"Lay's Potato Chips, Sour Cream and Onion,Family Size,10 Ounce",FLNA,FLNA,Lay's,Corporate
2326,B00TS9I52O,"Lay's Potato Chips, Wavy Original,Family Size,10.5 Ounce",FLNA,FLNA,Lay's,Corporate
2327,B00TS9J0VY,"Lay's Potato Chips, Party Size Classic, 15.75 Ounce",FLNA,FLNA,Lay's,Corporate
2328,B00TS9J50A,"Lay's Potato Chips, Party Size Wavy Original, 15.75 Ounce",FLNA,FLNA,Lay's,Corporate
2329,B00TS9J9ME,"Ruffles Potato Chips, Party Size Original, 14.5 Ounce",FLNA,FLNA,Ruffles,Corporate
2330,B00TS9JE3S,"Ruffles Potato Chips, Original,Family Size,9.5 Ounce",FLNA,FLNA,Ruffles,Corporate
2331,B00TS9KBAI,"Ruffles Potato Chips, Cheddar and Sour Cream,Family Size,9 Ounce",FLNA,FLNA,Ruffles,Corporate
2332,B00TS9KH7K,"Ruffles Potato Chips, Sour Cream and Onion Bag, 9 Ounce",FLNA,FLNA,Ruffles,Corporate
2333,B00TS9KMBG,"Lay's Kettle Cooked Sea Salt & Vinegar Flavored Potato Chips, 8 Ounce",FLNA,FLNA,Lay's Kettle Cooked,Corporate
2334,B00TS9KQM6,"Lay's Kettle Cooked Sea Salt & Cracked Pepper Flavored Potato Chips, 8 Ounce",FLNA,FLNA,Lay's Kettle Cooked,Corporate
2335,B00TS9KV1W,"Doritos Flavored Tortilla Chips, Party Size Nacho Cheese, 15.5 Ounce",FLNA,FLNA,Doritos,Corporate
2336,B00TS9KZH2,"Cheetos Crunchy  Cheese Flavored Snacks, Party Size! (17.5 Ounce)",FLNA,FLNA,Cheetos,Corporate
2337,B00TS9L3R8,"Fritos Scoops!  Corn Chips, Party Size! (18 Ounce)",FLNA,FLNA,Fritos,Corporate
2338,B00TS9L7BA,"Lay's Kettle Cooked Potato Chips, Original, 8 Ounce",FLNA,FLNA,Lay's Kettle Cooked,Corporate
2339,B00TS9LBP2,"Lay's Kettle Cooked Mesquite BBQ Flavored Potato Chips, 8 Ounce",FLNA,FLNA,Lay's Kettle Cooked,Corporate
2340,B00TS9LG0C,"Doritos Flavored Tortilla Chips, Cool Ranch, 10.5 Ounce",FLNA,FLNA,Doritos,Corporate
2341,B00TS9LKIA,"Doritos Flavored Tortilla Chips, Nacho Cheese, 10.5 Ounce",FLNA,FLNA,Doritos,Corporate
2342,B00TS9LOHM,"Doritos Flavored Tortilla Chips, Spicy Nacho, 10.5 Ounce",FLNA,FLNA,Doritos,Corporate
2343,B00TS9LSFA,"Doritos Flavored Tortilla Chips, Spicy Sweet Chili, 10.5 Ounce",FLNA,FLNA,Doritos,Corporate
2344,B00TS9M17E,"Lay's Potato Chips, Cheesy Garlic Bread, 7.75 Ounce",FLNA,FLNA,Lay's,Corporate
2345,B00TS9M53E,"Lay's Honey Barbecue Flavored Potato Chips, 7.75 Ounce",FLNA,FLNA,Lay's,Corporate
2346,B00TS9M9EY,"Lay's Wavy Potato Chips, Roasted Garlic and Sea Salt, 7.75 Ounce",FLNA,FLNA,Lay's,Corporate
2347,B00TS9MDL8,"Ruffles Potato Chips, Reduced Fat, 7.75 Ounce",FLNA,FLNA,Ruffles,Corporate
2348,B00TUYH4CO,"GAMESA Saladitas Cracker, 14.70 Ounce (Pack of 12)",Quaker,Quaker,Gamesa,Corporate
2349,B00TUYH4LU,"GAMESA Saladitas Cracker, 18.60 Ounce (Pack of 12)",Quaker,Quaker,Gamesa,Corporate
2350,B00TUYH6U4,"GAMESA Sabrosas Cracker, 12.60 Ounce (Pack of 12)",Quaker,Quaker,Gamesa,Corporate
2351,B00TUYH6XG,"GAMESA Emperador Limon/Lime Cookie, 12.50 Ounce (Pack of 12)",Quaker,Quaker,Gamesa,Corporate
2352,B00TUYH6ZY,"GAMESA Marias Biscuit, 19.70 Ounce (Pack of 12)",Quaker,Quaker,Gamesa,Corporate
2353,B00TUYH70S,"GAMESA Arcoiris Cookie, 15.50 Ounce (Pack of 12)",Quaker,Quaker,Gamesa,Corporate
2354,B00TUYH71C,"GAMESA Animalitos Cookie, 16.00 Ounce (Pack of 12)",Quaker,Quaker,Gamesa,Corporate
2355,B00TY82NPY,"GAMESA Barras De Coco Cookie, 14.30 Ounce (Pack of 12)",Quaker,Quaker,Gamesa,Corporate
2356,B00U0NJWGU,"Lay's Do Us A Flavor Finalist Flavors, 2.75 oz (Pack of 20)",FLNA,FLNA,Lay's,Corporate
2357,B00U15JF0K,"GAMESA Sugar Wafers, Strawberry, 6.70 Ounce (Pack of 12)",Quaker,Quaker,Gamesa,Corporate
2358,B00U2ZQHT6,"Tostitos Rolls XL Chips, 14 Ounce",FLNA,FLNA,Tostitos,Corporate
2359,B00U45Y9XA,"Gatorade Recover Protein Shake, Vanilla, 11.16 Ounce, 12 Count",Beverages,Gatorade,Gatorade,Corporate
2360,B00U5HDJOC,"Pepsi Made with Real Sugar, 7.5 Fl Oz Mini Cans, 24 Pack",Beverages,PBC,Pepsi,Corporate
2361,B00U5HDPO6,"Pepsi Made with Real Sugar, Wild Cherry, 7.5 Fl Oz Mini Cans, 24 Pack",Beverages,PBC,Pepsi,Corporate
2362,B00U5HDTME,"Pepsi, 7.5 Fl Oz Mini Cans, 24 Pack",Beverages,PBC,Pepsi,Corporate
2363,B00U5HDXDO,"Mountain Dew, 7.5 Fl Oz Mini Cans, 24 Pack",Beverages,PBC,Mountain Dew,Corporate
2364,B00U5HE0T0,"Diet Mountain Dew, 7.5 Fl Oz Mini Cans, 24 Pack",Beverages,PBC,Diet Mountain Dew,Corporate
2365,B00U5HE3X8,"Diet Pepsi, 7.5 Fl Oz Mini Cans, 24 Pack",Beverages,PBC,Diet Pepsi,Corporate
2366,B00U5HE7SY,"Sierra Mist, 7.5 Fl Oz Mini Cans, 24 Pack",Beverages,PBC,Mist Twist,Corporate
2367,B00U5HEBB2,"Pepsi True Mini Cans, 7.5 Fluid Ounce, 24 Count",Beverages,PBC,Pepsi,Corporate
2368,B00UA9G69U,"Gatorade Prime Energy Chews, Green Apple (Pack of 16)",Beverages,Gatorade,Gatorade,Corporate
2369,B00UMRF7S6,"Gatorade Recover Protein Shake, Chocolate, 12 Count",Beverages,Gatorade,Gatorade,Corporate
2370,B00V1O4YAQ,"Near East Roasted Garlic & Olive Oil Vermicelli Pasta Mix, 7oz Box",Quaker,Quaker,Near East,Corporate
2371,B00V1O5X3I,"Near East Whole Grain Blends, Roasted Pecan & Garlic, with Brown Rice and Bulgur, 5.4oz Box",Quaker,Quaker,Near East,Corporate
2372,B00V1O6HQK,"Near East Roasted Garlic Creative Grains Mix, 5.1 Ounce",Quaker,Quaker,Near East,Corporate
2373,B00V1O702A,"Near East Whole Grain Blend Wheat Couscous, Roasted Garlic and Olive Oil, 5.8 Ounce",Quaker,Quaker,Near East,Corporate
2374,B00V1O7OAI,"Near East Whole Grain Blend Wheat Couscous, Original, 7.6 Ounce",Quaker,Quaker,Near East,Corporate
2375,B00V1O8C54,"Near East Curry Rice Pilaf Mix, 6.25 Ounce",Quaker,Quaker,Near East,Corporate
2376,B00V1O8V5K,"Near East Whole Grain Blends, Brown Rice Pilaf, 6.17oz Box",Quaker,Quaker,Near East,Corporate
2377,B00V1O9F5U,"Near East Quinoa and Brown Rice Blend, Rosemary and Olive Oil, 4.9oz Box",Quaker,Quaker,Near East,Corporate
2378,B00V1O9X1G,"Near East Long Grain & Wild Rice Mix, Garlic & Herb, 5.9oz Box",Quaker,Quaker,Near East,Corporate
2379,B00V1OAGRQ,"Near East  Pearled Couscous, Roasted Garlic & Olive Oil, 4.7oz Box",Quaker,Quaker,Near East,Corporate
2380,B00V1OAX4M,"Near East Wild Mushrooms and Herbs Rice Pilaf Mix, 6.3 Ounce",Quaker,Quaker,Near East,Corporate
2381,B00V1OBG9I,"Near East Rice Pilaf Mix, Roasted Chicken & Garlic, 6.3oz Box",Quaker,Quaker,Near East,Corporate
2382,B00V1OBX8W,"Near East Rice Pilaf Mix, Garlic & Herb, 6.3oz Box",Quaker,Quaker,Near East,Corporate
2383,B00V1OCH0A,"Near East Couscous Mix, Broccoli & Cheese, 5.4oz Box",Quaker,Quaker,Near East,Corporate
2384,B00V1OCYSK,"Near East Coucous Mix, Tomato Lentil, 6.1oz Box",Quaker,Quaker,Near East,Corporate
2385,B00V1ODDT4,"Near East Couscous Mix, Mediterranean Curry, 5.7oz Box",Quaker,Quaker,Near East,Corporate
2386,B00V1ODV6E,"Near East Couscous Mix, Herbed Chicken, 5.7oz Box",Quaker,Quaker,Near East,Corporate
2387,B00V1OEC6M,"Near East Long Grain & Wild Rice Mix, Roasted Vegetable & Chicken, 6.3oz Box",Quaker,Quaker,Near East,Corporate
2388,B00V1OETE2,"Near East Rice Pilaf Mix, Toasted Almond, 6.6oz Box",Quaker,Quaker,Near East,Corporate
2389,B00V1OFAN6,"Near East Wild Mushrooms and Herbs Couscous Mix, 5.4 Ounce",Quaker,Quaker,Near East,Corporate
2390,B00V1OFSP6,"Near East Rice Pilaf Mix, Chicken, 6.25oz Box",Quaker,Quaker,Near East,Corporate
2391,B00V1OG9BS,"Near East Tabouleh Wheat Salad Mix, 5.25oz Box",Quaker,Quaker,Near East,Corporate
2392,B00V1OGSA0,"Quaker Oatmeal To Go, Apples & Cinnamon Squares, Breakfast Bars, 6 Bars",Quaker,Quaker,Oatmeal Squares,Corporate
2393,B00V1OHBII,"Quaker Chewy Soft Baked Cereal Bar, Banana Nut Bread, 7.4 Ounce",Quaker,Quaker,Chewy,Corporate
2394,B00V1OHTNA,"Quaker Chewy Soft Baked Bar, Cinnamon Pecan Bread, 7.4 Ounce",Quaker,Quaker,Chewy,Corporate
2395,B00V1OIDZI,"Quaker Quinoa Granola Bars, with Yogurt Fruit & Nuts, 5 Bars",Quaker,Quaker,Quaker,Corporate
