ASINMasterId,ASIN,ASIN_Name,BU,SubBU,PepsiBrand,BrandSource
89071,782560486769,A legacy of great taste and quality Tropicana has ,Beverages,Tropicana,Tropicana,Corporate
89072,028400094511,"<p>Stacy's Pita Chips, Cinnamon Sugar are all natu",FLNA,FLNA,Stacy's,Corporate
89073,048500758243,Tropicana Apple Juice is a Smart Choice because it,Beverages,Tropicana,Tropicana,Corporate
89074,028400055093,Lay's Stax Original Potato Crisps 5.5 oz,FLNA,FLNA,Lay's,Corporate
89075,B000Q5K1RG,"Dole Fruit Bowls, Mandarin Oranges in Juice, 4 Cup",Beverages,Tropicana,Dole,Corporate
89076,030000002919,<p><strong>Init Nut &amp; Fruit Bar - Dark Chocola,Quaker,Quaker,Init Bars,Corporate
89077,B013DI34N0,"Lipton Iced Tea K-Cups, Iced Tea Lemonade 10 ct",Beverages,PBC,Lipton,JV
89078,028400235280,Stacy's® Brand Honey Dijon Flavored Pretzel Thins.,FLNA,FLNA,Stacy's,Corporate
89080,072251020199,This quick and easy to use dish combines a blend o,Quaker,Quaker,Near East,Corporate
89082,741587313250,Tostitos Medium Salsa to Go Cup (3.8 Oz; 90 Pack),FLNA,FLNA,Tostitos,Corporate
89083,885400528633,"Frito Lay Variety Pack, 54 ct",FLNA,FLNA,FL VP/MP,Corporate
89084,B00KZ225VA,"Clean & Clear Morning Burst Facial Scrub, 5 fl. oz",FLNA,FLNA,Lay's,Corporate
89087,030000311851,Quaker Peanut Butter Chewy Granola Bars 90 Calorie,Quaker,Quaker,Chewy,Corporate
89092,B01GP8EUWE,"Hansen's Natural Cane Soda, Key Lime Twist, 12 Oun",Beverages,PBC,SoBe,Corporate
89094,012000162800,This Starbucks Doubleshot Espresso starts with ric,Beverages,PBC,Starbucks,JV
89095,B00I8GPZ6W,"Lipton Black Tea Bags, America's Favorite Tea 100 ",Beverages,PBC,Lipton,JV
89096,641438109509,Tropicana Apple Juice is a Smart Choice because it,Beverages,Tropicana,Tropicana,Corporate
89098,012000170027,LIFEWTR is a premium bottled water that fuses crea,Beverages,PBC,LIFEWTR,Corporate
89099,028400008488,"Stacy's Pita Chips Simply Naked Pita Crisps, 6.75 ",FLNA,FLNA,Stacy's,Corporate
89100,030000451304,"Quaker Chewy Granola Bars, Variety, Value Pack, 15",Quaker,Quaker,Chewy,Corporate
89101,836093011087,<p><b>IZZE Fortified Sparkling Juice - Pomegranate,Beverages,NEB,Izze,Corporate
89102,B01GP8EG5A,"Hansen's Natural Cane Soda, Vanilla Cola, 12 Ounce",Beverages,PBC,SoBe,Corporate
89105,B01KJNPGEW,"Ocean Spray Cran Raspberry Sauce, 14 Ounce",Beverages,PBC,Ocean Spray,JV
89109,710552037781,Rare Fare Foods has crafted a rich and decadent tr,FLNA,FLNA,Cheetos,Corporate
89111,739510004054,"SoBe Lifewater
Vitamin enhanced water beverage
Zer",Beverages,PBC,SoBe,Corporate
89114,030000070604,"<b>Quaker Hot Oat Bran Hot Cereal, 16 Ounce Box</b",Quaker,Quaker,Quaker,Corporate
89116,030000041703,"Quaker Grits Quick Tube, 24 oz",Quaker,Quaker,Grits,Corporate
89117,028400092531,"Stacys Pita Chips Toasted Garlic Bagel Chips, 8 Ou",FLNA,FLNA,Stacy's,Corporate
89119,640206686860,"Grandmas Mini Vanilla Creme Sandwich Cookies, 3.71",FLNA,FLNA,Grandmas,Corporate
89120,B011B6OSRW,"Lipton Recipe Secrets Soup and Dip Mix, Onion 2 oz",Beverages,PBC,Lipton,JV
89121,885283297213,Near East Long Grain Wild Rice 6 Oz (Pack of 12),Quaker,Quaker,Near East,Corporate
89122,836093002078,You'll Love What's InsideIZZE esque is a low calor,Beverages,NEB,Izze,Corporate
89123,030000435328,Quaker Quick 1 Minute Oats Original Instant Oatmea,Quaker,Quaker,IQO,Corporate
89126,836093011070,<p><b>IZZE Fortified Sparkling Juice - Clementine ,Beverages,NEB,Izze,Corporate
89127,030000432853,"Quaker Quick Oats Large, 42oz. Made with 100% natu",Quaker,Quaker,Quaker,Corporate
89131,773821300924,Gatorade Endurance Gatorlytes is an electrolyte po,Beverages,Gatorade,Gatorade,Corporate
89132,773821122946,Gatorade,Beverages,Gatorade,Gatorade,Corporate
89136,052000131680,Each case contains enough G2 powder to fill 64 bot,Beverages,Gatorade,Gatorade,Corporate
89137,B0111K05XO,"Haribo Original Gold-Bears Gummi Candy, 5-Pound Ba",FLNA,FLNA,Rold Gold,Corporate
89138,028400001359,"Grandmas Homestyle Big Peanut Butter Cookie, 2.5 O",FLNA,FLNA,Grandmas,Corporate
89140,739510900400,SOBE SMOOTH 12/20oz PINA COLADA,Beverages,PBC,SoBe,Corporate
89141,028400443630,"Ruffles Regular Potato Chips, 1.5 Ounce -- 64 per ",FLNA,FLNA,Ruffles,Corporate
89142,028400070560,"Doritos Nacho Cheese Tortilla Chips, 1.75 Ounce --",FLNA,FLNA,Doritos,Corporate
89143,072251530544,The delicately sweet flavor of roasted garlic and ,Quaker,Quaker,Near East,Corporate
89145,052000512489,Recharge with Propel Zero Water. This ultimate spo,Beverages,Gatorade,Propel,Corporate
89147,030000315521,Taste the difference real fruit and nuts make. Eac,Quaker,Quaker,Quaker,Corporate
89148,028400001502,"Grandmas Homestyle Big Oatmeal Raisin Cookie, 2.5 ",FLNA,FLNA,Grandmas,Corporate
89149,786173834863,Quaker Instant Oatmeal Apple Cinnamon 10 pk,Quaker,Quaker,IQO,Corporate
89150,028400094481,"<p>Stacy's Pita Chips, Simply Naked are all natura",FLNA,FLNA,Stacy's,Corporate
89155,766789989065,<p><b>IZZE Fortified Sparkling Juice - Pomegranate,Beverages,NEB,Izze,Corporate
89156,052000003390,"Pepsico Propel Zero - Kiwi Strawberry, 710 Millili",Beverages,PBC,Diet Pepsi,Corporate
89159,028400243186,"Lays Stax Jalepeno Pepper Jack Potato Crisps, 5.5 ",FLNA,FLNA,Lay's,Corporate
89161,767563262626,"Rice A Roni Cheddar Broccoli Entree Cup, 2.1 Ounce",Quaker,Quaker,Rice a Roni,Corporate
89163,028400496346,"Stacys Pita Chips Simply Naked Bagel Chips, 8 Ounc",FLNA,FLNA,Stacy's,Corporate
89164,885260452963,Quaker Oatmeal Raisin Chewy Granola Bars 90 Calori,Quaker,Quaker,Chewy,Corporate
89165,B000RYBUD0,"Dole Canned Fruit, Mandarin Oranges, Whole Segment",Beverages,Tropicana,Dole,Corporate
89166,767563728283,Tropicana Apple Juice is a Smart Choice because it,Beverages,Tropicana,Tropicana,Corporate
89167,052000133318,<p><b>Gatorade Variety Pack - Frost - 20 oz - 12 p,Beverages,Gatorade,Gatorade,Corporate
89168,028400251136,"Kettle Lays Cooked Potato Chips, Reduced Fat Salt ",FLNA,FLNA,Kettles,Corporate
89169,894991001906,"O.N.E. Coconut Water with a Splash of Mango, 16.9 ",Beverages,PBC,ONE,Corporate
89170,028400444002,"Ruffles Baked Cheddar and Sour Cream Potato Crisp,",FLNA,FLNA,Ruffles,Corporate
89172,739510100701,SOBE SMOOTH 12/20oz STRWBRY DAIQUIRI,Beverages,PBC,SoBe,Corporate
89173,700987886795,"Gatorade Prime Fruit Punch Energy Chews, 1 Ounce -",Beverages,Gatorade,Gatorade,Corporate
89174,B00T7PE5YQ,"Mrs. Meyer's Clean Day Dish Soap, Lavender, 16 Fl ",FLNA,FLNA,Lay's,Corporate
89176,028400450959,"Grandmas Mini Vanilla Creme Sandwich Cookies, 3.71",FLNA,FLNA,Grandmas,Corporate
89177,894991001913,"One Natural Experience Original Coconut Water, 16.",Beverages,PBC,ONE,Corporate
89178,823019655906,"SunChips Variety Mix, 1.5 oz Bags, 30 Bags per Box",FLNA,FLNA,Sunchips,Corporate
89180,B01M2ZURC3,"Dole Bowls, Mixed Fruit in Black Cherry Gel, 4.3 O",Beverages,Tropicana,Dole,Corporate
89181,072251001556,Near East Roasted Garlic & Olive Oil Flavor Cousco,Quaker,Quaker,Near East,Corporate
89183,766789717088,Gatorade,Beverages,Gatorade,Gatorade,Corporate
89184,739510002838,Sobe Lifewater Water Yumberry Pomegranate 20 Fl. O,Beverages,PBC,SoBe,Corporate
89188,732976284350,Frito Lay Classic Mix Variety Pack is the perfect ,FLNA,FLNA,FL VP/MP,Corporate
89189,030000010402,Quaker Old Fashioned Oats - 42 oz,Quaker,Quaker,Quaker,Corporate
89190,798235655743,"Grandmas Mini Vanilla Creme Sandwich Cookies, 3.71",FLNA,FLNA,Grandmas,Corporate
89191,773821035673,"SoBe Citrus Energy, 20-Ounce Bottles (Pack of 12)",Beverages,PBC,SoBe,Corporate
89192,B000OV4FY2,"Dole Fruit Bowls, Diced Peaches in 100% Fruit Juic",Beverages,Tropicana,Dole,Corporate
89193,028400443746,Cool Ranch Doritos are perfect anytime. If you lov,FLNA,FLNA,Doritos,Corporate
89195,028400239110,Lays Stax Mesquite Barbecue Flavored Potato Crisps,FLNA,FLNA,Lay's,Corporate
89196,767563229582,A legacy of great taste and quality Tropicana has ,Beverages,Tropicana,Tropicana,Corporate
89198,028400062411,"FRITO LAY 52347 Classic Variety Mix, Assorted, 30 ",FLNA,FLNA,FL VP/MP,Corporate
89199,028400243155,"Lays Stax Buffalo Wings and Ranch Potato Crisps, 5",FLNA,FLNA,Lay's,Corporate
89201,052000129342,"Gatorade All Stars -- Lemon Lime -- 12 oz., 12 pk.",Beverages,Gatorade,Gatorade,Corporate
90129,B075M8ZCXR,"Gatorade Recover Whey Protein Powder, Chocolate Caramel",Beverages,Gatorade,Gatorade,Corporate
90130,B008CNIL6M,"Cap'n Crunch Cereal, Peanut Butter Crunch, 17.1-Ounce",Quaker,Quaker,Cap'N Crunch,Corporate
90143,B07516MFBV,"El Isleno Original Plantain Chips, 12 Count",FLNA,FLNA,El Isleno,Corporate
90160,B00MNSEOSG,"Johnson's Head-To-Toe Gentle Baby Wash, 28 Fl. Oz.",FLNA,FLNA,Lay's,Corporate
90174,B00MB525QY,"Johnson's Baby Oil Gel To Moisturize Skin, 6.5 Fl.",FLNA,FLNA,Lay's,Corporate
90200,B00I9L3KS6,"Aussie Instant Freeze Sculpting Hair Gel, 7 Fl Oz",FLNA,FLNA,Lay's,Corporate
90213,B000Q5G7KG,"Dole Fruit Bowls, Pineapple Tidbits in Juice, 4 Cu",Beverages,Tropicana,Dole,Corporate
90229,B000OUYN5Y,"Dole Fruit Bowls, Peaches in Strawberry Gel, 4.3 o",Beverages,Tropicana,Dole,Corporate
90232,B01M9DMH82,"Dole Bowls, Cherry Mixed in 100% Fruit Juice, 4 Ou",Beverages,Tropicana,Dole,Corporate
90243,B01DBY8GEI,"Barilla Whole Grain Pasta, Penne, 16 Ounce (Pack o",Quaker,Quaker,Pasta Roni,Corporate
90258,B00DRA8IFO,"Barilla Gluten Free Pasta, Spaghetti, 12 Ounce (Pa",Quaker,Quaker,Pasta Roni,Corporate
90259,B00R0OAW2K,"Barilla Penne Pasta Gluten Free, 12 Ounce (Pack of",Quaker,Quaker,Pasta Roni,Corporate
90414,B075M2NTPY,"Tostitos Medium Chunky Salsa, 4 Count, 15.5 oz Jars",FLNA,FLNA,Tostitos,Corporate
90462,B00158Q2OY,Quaker Chewy Granola Bars Sixty Bar Variety Pack (.84 oz each),Quaker,Quaker,Chewy,Corporate
90622,B006DHH54S,"Pepsico Quaker Hot Cereal, Oat Bran, 16 Ounce -- 12 per case.",Quaker,Quaker,Quaker,Corporate
90834,B00INAZU9U,"IZZE Fortified Sparkling Juice, Clementine, 8.4 oz Can, 24/Carton",Beverages,NEB,Izze,Corporate
90907,B00N3B595Y,"IZZE - Fortified Sparkling Juice, Pomegranate, 8.4 oz Can, 24/Carton 15085 (DMi CT",Beverages,NEB,Izze,Corporate
91001,B00VPABAYO,SIMPLY FRUIT PUNCH JUICE DRINK 2-59 FL OZ BOTTLES,Beverages,PBC,Rockstar,JV
91227,B01B7RUQLW,"HEALTH WARRIOR Superfood Protein Bars, Honey Almond, Plant-Based Protein, 50g bars, 12 count",Hive,Hive Foods,Health Warrior,Corporate
91246,B01BLWYTO8,"A&W Root Beer Drink Mix Singles to Go! 6 Boxes, 6 Packets Each",Beverages,PBC,A&W Root Beer,Allied
91279,B01D52P7Z2,"Bare Natural Apple Chips, Granny Smith, Gluten Free + Baked, 3.4 Ounce (6 Count)",FLNA,FLNA,Bare Snacks,Corporate
91332,B01EZ5SY4Y,NV The Big Kahuna Cabernet Sauvignon Red Wine,Beverages,PBC,Big Red,Allied
91455,B01IRXK42K,A&W Root Beer & Squirt Singles To Go Drink Mix Combo (Pack of 6),Beverages,PBC,A&W Root Beer,Allied
91859,B06XPXKZKN,"Health Warrior Chia Bars, Apple Cinnamon, 15 Count",Hive,Hive Foods,Health Warrior,Corporate
92079,B071ZBXLML,"Bare Performance Nutrition, Whey Protein Powder, Mint Chocolate Chip Ice Cream, 2 Pound",FLNA,FLNA,Baked,Corporate
92129,B072JBGVFD,"Starbucks Holiday Blend Medium Roast Ground Coffee, 18-Ounce Bag",Beverages,PBC,Rockstar,JV
92628,B075JTPWVS,LIFEWTR Limited Edition Holiday Gift Set,Beverages,PBC,LIFEWTR,Corporate
92633,B075LYM11W,"Tostitos Medium Salsa Con Queso, 4 Count, 15.5 oz Jars",FLNA,FLNA,Tostitos,Corporate
92634,B075M97LTG,"Sabritas Picante Mix Variety Pack, 32 Count",FLNA,FLNA,Sabritas,Corporate
92654,B075M59M4B,"Smartfood Sweet & Salty Kettle Corn Flavored Popcorn, 0.5 Ounce (Pack of 40)",FLNA,FLNA,Smartfood,Corporate
92655,B075M2NTPW,"Tostitos Queso Variety Pack, 4 Count",FLNA,FLNA,Dips,Corporate
92656,B075LZZ5MR,"Smartfood Popcorn Variety Pack, 40 Count",FLNA,FLNA,Smartfood,Corporate
92662,B076639JWW,"Naked Juice Mighty Mango, 46 oz",Beverages,NEB,Naked Juice,Corporate
92663,B076639KKN,"Naked Juice Green Machine, 46 oz",Beverages,NEB,Naked Juice,Corporate
92664,B07662XS82,"Naked Juice Blue Machine, 46 oz",Beverages,NEB,Naked Juice,Corporate
92665,B076658LX6,"Naked Juice Protein Zone, 46 oz",Beverages,NEB,Naked Juice,Corporate
92666,B07665DKQ7,"Naked Juice Strawberry Banana, 46 oz",Beverages,NEB,Naked Juice,Corporate
92667,B075LYM12P,"Sweet Tooth Snack Care Package, Variety of Chewy Bars, Pita Chips, Cookies & Cracker Jack, 30 Count Mix",FLNA,FLNA,FL VP/MP,Corporate
92668,B075M97LTH,"Tostitos Salsa Flavors Variety Pack, 4 Count",FLNA,FLNA,Dips,Corporate
92669,B075MJ4HX7,"Rare Fare Foods Gourmet Mixed Nuts Holiday Gift Basket, Deluxe Party Tray",FLNA,FLNA,Rare Fare,Corporate
92670,B00YOQYF0C,"e.l.f. Baked Eyeshadow Palette, California",FLNA,FLNA,Baked,Corporate
92698,B01EMZ9L2Q,"Johnson's Baby Tear Free Shampoo, 20 Fl. Oz.",FLNA,FLNA,Lay's,Corporate
92751,B075S8MG14,"Pure Leaf Prepared Tea, Unsweetened Black Tea, 64 fl oz Plastic Bottle",Beverages,PBC,Pure Leaf,JV
92752,B075S8MG12,"Pure Leaf Iced Tea, Sweet Tea, 64 fl oz Plastic Bottle",Beverages,PBC,Pure Leaf,JV
92753,B00HV07UF0,"Gatorade Recover Protein Shake, Peanut Butter Chocolate, 11.1 oz",Beverages,Gatorade,Gatorade,Corporate
92754,B075S8RF3J,"Pure Leaf Prepared Tea, Lemon, 64 fl oz Plastic Bottle",Beverages,PBC,Pure Leaf,JV
92755,B075S9HD2V,"Pure Leaf Prepared Tea, Unsweetened Green Tea, 64 fl oz Plastic Bottle",Beverages,PBC,Pure Leaf,JV
92756,B075M2NY9J,"Rold Gold Flavored Thin Crisps Pretzel Variety Pack, 40 Count",FLNA,FLNA,Rold Gold,Corporate
92757,B00C2L8WSW,"Gatorade Recover Protein Shake, Vanilla, 11.1 oz",Beverages,Gatorade,Gatorade,Corporate
92758,B00HV07U3C,"Gatorade Recover Protein Shake, Cookies and Cream, 11.1 oz",Beverages,Gatorade,Gatorade,Corporate
92759,B075LT1QW4,"Off The Eaten Path Sweet Potato Crisps, 1.25 Ounce (Pack of 16)",FLNA,FLNA,OTEP,Corporate
92760,B075MHDKLK,"Rold Gold Sourdough Pretzel Barrel, 28 Ounce",FLNA,FLNA,Rold Gold,Corporate
92765,B075LZZ5MS,"Rold Gold Flavored Tiny Twists Pretzel Variety Pack, 40 Count",FLNA,FLNA,Rold Gold,Corporate
92766,B01E7DXH6Y,"Gatorade Perform Frost Riptide Rush, 28 oz",Beverages,Gatorade,Gatorade,Corporate
93032,B00QWDAPRW,Walkers Shortbread Scottish Explorer Van Keepsake,Beverages,PBC,Rockstar,JV
93199,B01LTI9DF4,"Quaker Popped Rice Crisp Snacks, Gluten Free, Butt",Quaker,Quaker,POPPED,Corporate
93319,B06XD8XVFD,Coffee Time Gift Set With Starbucks Mug And 12oz.,Beverages,PBC,Mug,Corporate
93335,B06Y2DHPW7,Cheetos Puffs Reduced Fat Flamin' Cheese Flavored,FLNA,FLNA,Cheetos,Corporate
93376,B06Y2DJM1V,"Cheetos Puffs Reduced Fat Cheese Flavored Snacks,",FLNA,FLNA,Cheetos,Corporate
93382,B071FCSND7,"Bare Performance Nutrition, Whey Protein Powder, C",FLNA,FLNA,Baked,Corporate
93526,B0751MZBGL,"Bare Chips Variety Pack, Apple/Banana/Coconut",FLNA,FLNA,Bare Snacks,Corporate
93543,B075SD7WB7,"Pure Leaf Prepared Tea, Raspberry 64 fl oz Plastic Bottle",Beverages,PBC,Pure Leaf,JV
93545,B075Z2HPR7,"Starbucks Cold Brew Coffee, Cocoa & Honey with Cream, 11 oz Glass Bottles, 6 Count",Beverages,PBC,Starbucks,JV
93546,B076BN154H,"Pepsi Diet Wild Cherry Cans, 12 Count, 12 fl oz Cans",Beverages,PBC,Diet Pepsi,Corporate
93547,B076BSQB1B,"Mist TWST Diet Cans, Lemon Lime, 12 Count, 12 fl oz Cans",Beverages,PBC,Diet Mist Twst,Corporate
93548,B076CJV9H4,"Diet Mountain Dew, 20oz Bottle",Beverages,PBC,Diet Mountain Dew,Corporate
93549,B076DJ7ZZV,"Lay's Kettle Cooked Potato Chips Variety Pack, 40 Count",FLNA,FLNA,Lay's Kettle Cooked,Corporate
93552,B075R94Q8M,"Starbucks Frappuccino, Coffee, 9.5 Ounce Glass Bottles, 15 Count",Beverages,PBC,Starbucks,JV
93553,B075S8WXNF,"Pure Leaf Prepared Tea, Unsweetened Black Tea with Lemon, 64 fl oz Plastic Bottle",Beverages,PBC,Pure Leaf,JV
93557,B075YZ197L,"Starbucks Cold Brew Coffee, Black Unsweetened, 11 oz Glass Bottles, 6 Count",Beverages,PBC,Starbucks,JV
93558,B076BV2T3W,"Pepsi Cherry Vanilla Cans, 12 Count, 12 fl oz Cans",Beverages,PBC,Pepsi,Corporate
93559,B076CHMH8Q,"Aquafina Water, 20oz Bottle",Beverages,PBC,Aquafina,Corporate
93562,B075T9XSH8,"Quaker Gluten Free Rice Cakes, Plain Variety Pack, 6 Count",Quaker,Quaker,Large Rice Cakes,Corporate
93565,B0765D4DKF,Quaker Organic Old Fashioned Oats Breakfast Cereal,Quaker,Quaker,SQO,Corporate
93566,B076BVC4YT,"Pepsi Caffeine Free Diet Cans, 12 Count, 12 fl oz Cans",Beverages,PBC,Diet Pepsi,Corporate
93567,B076CHMH8R,"Mist TWST, Lemon Lime Soda, 20oz Bottle",Beverages,PBC,Mist Twist,Corporate
93568,B076CV955F,"Gatorade Multipack 12oz bottles, 6 Lemon Lime, 6 Fruit Punch, 6 Orange",Beverages,Gatorade,Gatorade,Corporate
93615,B06Y2D66TT,"Baked Tostitos Oven Baked Scoops Tortilla Chips, 7",FLNA,FLNA,Baked,Corporate
93634,B071DZNB3P,"Walkers Shortbread Scottie Dog 3D Carton, 5.3 Ounc",Beverages,PBC,Rockstar,JV
93706,B075ZZ1G3D,"Naked Juice 100% Organic Pure Coconut Water, USDA Organic Certified, Non-GMO Project Verified, 1 Liter",Beverages,NEB,Naked Juice,Corporate
93707,B076BT34K8,"Pepsi Caffeine Free Cans, 12 Count, 12 fl oz Cans",Beverages,PBC,Diet Pepsi,Corporate
93711,B076TMDD8V,"Gatorade Thirst Quencher, Cool Blue, 24 Count, 12 oz Bottles",Beverages,Gatorade,Gatorade,Corporate
93712,B076CNMTP1,"Quaker Instant Oatmeal Variety Pack, Lower Sugar, 10 Count",Quaker,Quaker,IQO,Corporate
93713,B076T5K3JJ,"Gatorade Frost Thirst Quencher, Variety Pack, 24 Count, 12 oz Bottles",Beverages,Gatorade,Gatorade,Corporate
93714,B076CNMTP3,"Gatorade Energy Drink, Fruit Punch, 64 oz",Beverages,Gatorade,Gatorade,Corporate
93715,B076DG1CRF,"Frito-Lay Ultimate NFL Dallas Cowboys Chips, Dips, & Football Dip Helmet Party Box",FLNA,FLNA,FL VP/MP,Corporate
93716,B077L1J11Z,"Quaker Instant Oatmeal, Strawberries & Cream, 48 Count, 1.23 oz Packets",Quaker,Quaker,IQO,Corporate
93717,B0004MTMYY,"Mug Cream Soda Regular, 67.59 Fluid Ounce",Beverages,PBC,Mug,Corporate
93718,B076TMF2CC,"Gatorade Fruit Punch, 8 Count",Beverages,Gatorade,Gatorade,Corporate
93719,B076F4G12Y,"Aunt Jemima Syrup, Butter Lite, 12 oz Bottle",Quaker,Quaker,Aunt Jemima,Corporate
93720,B076TD4HKB,"Gatorade Frost Thirst Quencher, Variety Pack, 20 Fl Oz, 12 Count",Beverages,Gatorade,Gatorade,Corporate
93721,B0761WJ69D,"Tostitos Salsa Verde Flavored Tortilla Chips, 2.375 Ounce (16 Count)",FLNA,FLNA,Tostitos,Corporate
93722,B0761XFMJ7,"Hello Snacks Holiday Survival Kit with Chips, Chewy Bars, Oatmeal, Pasta Cups, & More, 30 Snacks",FLNA,FLNA,Hello Snacks,Corporate
93723,B076F12B52,"Quaker Cap'n Crunch Sprinkled Donut, 12.4 oz Box",Quaker,Quaker,Cap'N Crunch,Corporate
93724,B0778LKR7T,"Pepsi, 1.25 Liter Bottle",Beverages,PBC,Pepsi,Corporate
93725,B003UY9H5M,"Gatorade Sport Drink, Lemon Lime, 24-Ounce Bottles (Pack of 24)",Beverages,Gatorade,Gatorade,Corporate
93726,B076DZJTYB,"Quaker Quick 5 Minute Grits, 5 lb Bag",Quaker,Quaker,Grits,Corporate
93727,B003UYBCIW,"Gatorade Thirst Quencher Lemon Lime Powder, 18.3 oz (Pack of 12)",Beverages,Gatorade,Gatorade,Corporate
93728,B076T5K3JQ,"Gatorade Classic Thirst Quencher, Variety Pack, 24 Count, 12 oz Bottles",Beverages,Gatorade,Gatorade,Corporate
93729,B077L3BT7R,"Quaker Instant Oatmeal, Original, 48 Count, 0.98 oz Packets",Quaker,Quaker,IQO,Corporate
93730,B076F3H7PL,"Aunt Jemima Butter Lite Syrup, 24 oz Bottle",Quaker,Quaker,Aunt Jemima,Corporate
93731,B075ZXJSVV,"Quaker Instant Oatmeal Variety Pack, 18 Packets, Net.Wt. 27.3 Ounce",Quaker,Quaker,IQO,Corporate
93732,B077NLX2XT,"Starbucks Frappuccino, Vanilla, 15 Count, 9.5 oz Glass Bottles",Beverages,PBC,Starbucks,JV
93733,B076F5VHLX,"Aunt Jemima Pancake Mix, Complete, 32 oz Box",Quaker,Quaker,Aunt Jemima,Corporate
93734,B0778Q5HHX,"Mountain Dew Regular, 6 Count, 16.9 fl oz Bottles",Beverages,PBC,Mountain Dew,Corporate
93735,B077PRGFPZ,"Gatorade G2 Thirst Quencher, Glacier Freeze, 12 Count, 20 oz Bottles",Beverages,Gatorade,Gatorade,Corporate
93736,B076TCZ838,"Propel Unflavored Electrolyte Water, 12 Count, 1 Liter Bottles",Beverages,Gatorade,Propel,Corporate
93737,B0778KVSKP,"Diet Pepsi, 1.25 Liter Bottle",Beverages,PBC,Diet Pepsi,Corporate
93738,B0761WJ9JM,"College Dorm Care Package of Chips, Chewy Bars, Oatmeal, Pasta Cups, & More, 30 Count",FLNA,FLNA,FL VP/MP,Corporate
93739,B076DBRPBH,"Frito-Lay Ultimate NFL Pittsburgh Steelers Chips, Dips, & Football Dip Helmet Party Box",FLNA,FLNA,FL VP/MP,Corporate
93740,B076CWVHR3,"Quaker Old Fashioned Oatmeal, Breakfast Cereal, 42 oz Canister",Quaker,Quaker,IQO,Corporate
93741,B076F3H7QP,"Quaker Cap'n Crunch Oops All Berries, 11.5 oz Box",Quaker,Quaker,Cap'N Crunch,Corporate
93742,B077KY2XT2,"Quaker Chewy Granola Bars, School Variety Pack, 58 Count",Quaker,Quaker,Chewy,Corporate
93743,B076F4G142,"Quaker Yellow Corn Meal, 24 Ounce",Quaker,Quaker,Quaker,Corporate
93744,B076TMF2C9,"Gatorade G2 Low Calorie Thirst Quencher, Mixed Berry, 24 Count, 12 oz Bottles",Beverages,Gatorade,Gatorade,Corporate
93745,B076F4QVMM,"Quaker Chewy Granola Bar Reduced Sugar Variety Pack, 8-count Box",Quaker,Quaker,Chewy,Corporate
93746,B0029JRMX8,"Gatorade Thirst Quencher, Orange, 12 Count, 20 oz Bottles",Beverages,Gatorade,Gatorade,Corporate
93747,B075ZZ8CMF,"Quaker Aunt Jemima Original Syrup, 12 Count",Quaker,Quaker,IQO,Corporate
93748,B076T1YJ1V,"Gatorade Glacier Freeze, 24 Count",Beverages,Gatorade,Gatorade,Corporate
93749,B076DBRPBJ,"Quaker Baked Cheddar Snack Mix, 40 Count, 1.75 oz Bags",FLNA,FLNA,Baked,Corporate
93750,B0778MCRDW,"Pepsi, 2 Liter Bottle",Beverages,PBC,Pepsi,Corporate
93751,B076FBQND8,"Aunt Jemima Self-Rising Flour, 5 lb Bag",Quaker,Quaker,Aunt Jemima,Corporate
93752,B078BMY7MH,"Gatorade Frost, Riptide Rush, 12 Count, 20 oz Bottles",Beverages,Gatorade,Gatorade,Corporate
93753,B0778MSL9J,"Wild Cherry Pepsi, 2 Liter Bottle",Beverages,PBC,Pepsi,Corporate
93754,B0761YSFL9,"Miss Vickie's Kettle Cooked Potato Chip Variety Pack, 28 Pack",FLNA,FLNA,Miss Vickies,Corporate
93755,B076T6ZJ3Z,"Gatorade Green Apple, 24 Count",Beverages,Gatorade,Gatorade,Corporate
93756,B0778S8GMR,"Diet Pepsi Caffeine Free, 2 Liter Bottle",Beverages,PBC,Diet Pepsi,Corporate
93757,B076CJVCV7,"Gatorade Drink Variety Pack Bottles, 480 Fluid Ounce",Beverages,Gatorade,Gatorade,Corporate
93758,B003UYGW8W,"Gatorade Sports Drink, Orange, 11.6-Ounce Cans (Pack of 24)",Beverages,Gatorade,Gatorade,Corporate
93759,B072C7WJRQ,"Gatorade Endurance Energy Gel, Blackberry,  1 Count, 1.3 oz Pouch",Beverages,Gatorade,Gatorade,Corporate
93760,B077KX7GX9,"Quaker Breakfast Flats Variety Pack, 4 Count",Quaker,Quaker,Breakfast Flats,Corporate
93761,B0778YGSXX,"Diet Wild Cherry Pepsi, 2 Liter Bottle",Beverages,PBC,Diet Pepsi,Corporate
93762,B077PZ6JND,"Gatorade Fierce, Green Apple, 12 Count, 20 oz Bottles",Beverages,Gatorade,Gatorade,Corporate
93763,B076CY7WRM,"Quaker Instant Oatmeal Cinnamon & Spice, 15.1 oz",Quaker,Quaker,IQO,Corporate
93764,B076CJV9H1,"Gatorade Drinks, Fierce Grape, 32 Ounce",Beverages,Gatorade,Gatorade,Corporate
93765,B076F37D5K,"Quaker Life Cereal, Vanilla, 13 oz Box",Quaker,Quaker,Life,Corporate
93766,B003UYGWBE,"Gatorade Sports Drink, Lemon Lime, 11.6-Ounce Bottles (Pack of 24)",Beverages,Gatorade,Gatorade,Corporate
93767,B076FCCH4L,"Quaker Rice Cake, Apple Cinnamon, 6.53 oz Bag",Quaker,Quaker,Large Rice Cakes,Corporate
93768,B076T1YJ2D,"Gatorade Glacier Freeze, 8 Count",Beverages,Gatorade,Gatorade,Corporate
93769,B0761WFC5J,"Hello Snacks Gluten Free Care Package of Popcorn, Chips, Cheese Snacks, & More, 40 Snacks",FLNA,FLNA,Hello Snacks,Corporate
93770,B076TCZM3R,"Gatorade Glacier Cherry, 24 Ounce, 24 Count",Beverages,Gatorade,Gatorade,Corporate
93771,B0774XFLBC,"Propel Raspberry Lemonade Powder, 10 Packets (Pack of 12)",Beverages,Gatorade,Propel,Corporate
93772,B076T73WZD,"Gatorade Frost Thirst Quencher, Arctic Blitz, 24 Count, 12 oz Bottles",Beverages,Gatorade,Gatorade,Corporate
93773,B0778N4WQ1,"Mountain Dew Regular, 2 Liter Bottle",Beverages,PBC,Mountain Dew,Corporate
93774,B003UYGWHS,"Gatorade Sports Drink, Fruit Punch, 11.6-Ounce Cans (Pack of 24)",Beverages,Gatorade,Gatorade,Corporate
93775,B077KYKYKN,"Quaker Chewy Granola Bars, 25% Less Sugar, Chocolate Chip, 58 Count",Quaker,Quaker,Chewy,Corporate
93776,B076DPJVGF,"Frito-Lay Ultimate NFL New England Patriots Chips, Dips, & Football Dip Helmet Party Box",FLNA,FLNA,FL VP/MP,Corporate
93777,B003UYBBR4,"Gatorade G2 Thirst Quencher, Orange, Low Calorie, 12 Ounce Bottles (Pack of 24)",Beverages,Gatorade,Gatorade,Corporate
93778,B076F4CY4K,"Aunt Jemima Syrup, Original, 1 Gallon Bottle",Quaker,Quaker,Aunt Jemima,Corporate
93779,B0778MKJZ3,"Mist TWST Lemon Lime Soda, 2 Liter Bottle",Beverages,PBC,Mist Twist,Corporate
93780,B077PZ6SG7,"Gatorade Recover Whey Protein with Almond Butter Bar, Variety Pack (18 Count)",Beverages,Gatorade,Gatorade,Corporate
93781,B077CTFNTN,"Spitz Sunflower Seeds Variety Pack, 12 Count, 6 oz Bags",FLNA,FLNA,Spitz,Corporate
93782,B076T5JT16,"Gatorade Gift Set with Squeeze Bottle, Sport Towel, and Thirst Quencher Powder",Beverages,Gatorade,Gatorade,Corporate
93783,B076FFHJR1,"Quaker Popped Rice Crisps, Kettle Corn, 3.52 Oz",Quaker,Quaker,POPPED,Corporate
93784,B0778SD6QP,"Diet Mountain Dew, 2 Liter Bottle",Beverages,PBC,Diet Mountain Dew,Corporate
93785,B076T6Z71D,"Gatorade Fierce Thirst Quencher, Blue Cherry, 12 Ounce Bottles (Pack of 24)",Beverages,Gatorade,Gatorade,Corporate
93786,B003UY9FYA,"Gatorade G2 Sports Drink, Fruit Punch, Low Calorie, 12-Ounce Bottles (Pack of 24)",Beverages,Gatorade,Gatorade,Corporate
93787,B077KYT31Z,"Quaker Chewy Granola Bars, Peanut Butter Chocolate Chip, 58 Count",Quaker,Quaker,Chewy,Corporate
93788,B075ZZPD4K,"Quaker Life Cereal, Vanilla, 27.3 Pound",Quaker,Quaker,Life,Corporate
93789,B0004MV35K,"Mug Diet Root Beer Soda, 67.59 Fluid Ounce",Beverages,PBC,Mug,Corporate
93790,B00NALRQHQ,"Gatorade Recover Protein Shake, Vanilla, 4 Count, 11.16 oz Bottles",Beverages,Gatorade,Gatorade,Corporate
93791,B071J6WYZL,"Gatorade Endurance Energy Gel, Apple Pear, 1 Count, 1.3 oz Pouch",Beverages,Gatorade,Gatorade,Corporate
93792,B076FC5NWQ,"Aunt Jemima Original Syrup, 12 oz Bottle",Quaker,Quaker,Aunt Jemima,Corporate
93793,B076HBJLFS,"Munchies Honey Roasted Peanuts, 36 Count, 1.375 oz Bags",FLNA,FLNA,Munchies,Corporate
