ASINMasterId,ASIN,ASIN_Name,BU,SubBU,PepsiBrand,BrandSource
56199,B01KLKSC9E,"Ruffles Queso Flavored Potato Chips, 1.125 Ounce",FLNA,FLNA,Ruffles,Corporate
56200,B00CNZTS0S,"Ruffles Ridged Potato Chips, Queso, 6.5 oz",FLNA,FLNA,Ruffles,Corporate
56201,B00FFJ44OO,"Sabritones Wheat Snacks, 4.25 oz",FLNA,FLNA,Sabritones,Corporate
56202,B00CNZTI5I,"Sabritones Rancherito Flavored Wheat Snacks, 7.625 Ounce",FLNA,FLNA,Sabritones,Corporate
56203,B00FFJ4DG8,"Santitas Tortilla Chips, Lightly Salted, 14.5 oz",FLNA,FLNA,Santitas,Corporate
56204,B00CNZTWTU,"Tostitos Cantina Traditional  Tortilla Chips, Party Size! (20 Ounce)",FLNA,FLNA,Tostitos,Corporate
56205,B00CNZTB0K,"Tostitos Cantina Thin & Crispy Tortilla Chips, 9 Ounce",FLNA,FLNA,Tostitos,Corporate
56206,B01JOHS3DA,"Tostitos Chunky Salsa - Medium, 24 Ounce",FLNA,FLNA,Dips,Corporate
56207,B003H42Z7M,"Tostitos Chunky Salsa - Mild, 24 Ounce",FLNA,FLNA,Dips,Corporate
56208,B004K0WKR2,"Tostitos Restaurant Style Salsa Dip, 15.5 Ounce",FLNA,FLNA,Dips,Corporate
56209,B00BQG6Y2A,"Tostitos Cantina Chipotle Restaurant Style Salsa, 15.5 Ounce",FLNA,FLNA,Dips,Corporate
56210,B01DIZTRPW,"Tostitos Creamy Spinach Dip, 15 Ounce",FLNA,FLNA,Dips,Corporate
56211,B00BTJM2RU,"Tostitos Toasted Garlic Thick & Chunky Salsa, 15.5 Ounce",FLNA,FLNA,Dips,Corporate
56212,B00KAOTZ4S,"Tostitos Scoops! Fajita Flavored Tortilla Chips, 9 Ounce",FLNA,FLNA,Tostitos,Corporate
56213,B004J80DQK,"Tostitos Tortilla Chips, Party Size Bite Size Rounds, 18 oz",FLNA,FLNA,Tostitos,Corporate
56214,B00CNZTAVU,"Tostitos Cantina Traditional Tortilla Chips, Cantina Traditional, 12 Ounce",FLNA,FLNA,Tostitos,Corporate
56215,B00OFX73TO,"Lay's Chile LimÃ³n Flavored Potato Chips, 7.75 Ounce",FLNA,FLNA,Lay's,Corporate
56216,B017ALCZZY,"Ruffles Queso Flavored Potato Chips, 2.625 Ounce",FLNA,FLNA,Ruffles,Corporate
56217,B01JOHS3L2,"Tostitos Salsa Con Queso - Medium, 23 Ounce",FLNA,FLNA,Dips,Corporate
56218,B01KM6MTUK,"Chester's, Flamin' Hot Fries, 5.5 oz",FLNA,FLNA,Chesters,Corporate
56219,B01LHQ91YQ,"Pure Leaf Iced Tea, Sweet Lemon, 64 oz",Beverages,PBC,Pure Leaf,JV
56220,B01LNSVYX4,"Cap'N Crunch's Breakfast Cereal, Halloween Crunch, 18.6 Ounce (Pack of 10)",Quaker,Quaker,Cap'N Crunch,Corporate
56221,B000VDT8CC,"Propel Zero Nutrient Enhanced Water Kiwi Strawberry, 6 pk, 16.9 oz",Beverages,Gatorade,Propel,Corporate
56222,B01LNSW3DE,"Quaker Instant Oatmeal, Pumpkin Spice, 8 Count,12.1 Ounce (Pack of 12)",Quaker,Quaker,IQO,Corporate
56223,B01LNSW4SS,"Life Quaker Breakfast Cereal, Pumpkin Spice, 18 Ounce (Pack of 14)",Quaker,Quaker,Life,Corporate
56247,B01FUH51B0,"BARE NATURAL APPLE CHIPS, FUJI & REDS, GLUTEN FREE + BAKED, 14 OUNCE (2 COU",FLNA,FLNA,Bare Snacks,Corporate
56258,B01L99GH20,"Botonics Sparkling Organic Apple Cider Vinegar Tonic, Strawberry Rose, 12 Ounce (Pack of 12)",Beverages,PBC,Botonics,Allied
56259,B01LWINX7T,"Gatorade Thirst Quencher, Strawberry Lemonade, 20 Ounce (8 Count)",Beverages,Gatorade,Gatorade,Corporate
56260,B01LWIOBQT,"Gatorade Thirst Quencher Powder, G2 Low Calorie, Fruit Punch, 19.4 Ounce",Beverages,Gatorade,Gatorade,Corporate
56261,B01LWUDFV6,"Gatorade Thirst Quencher Frost, Riptide Rush, 20 Ounce (8 Count)",Beverages,Gatorade,Gatorade,Corporate
56262,B01LXHUOHV,"Gatorade Thirst Quencher, Strawberry Watermelon, 20 Ounce (8 Count)",Beverages,Gatorade,Gatorade,Corporate
56263,B01LXTKCHQ,"Gatorade Thirst Quencher Frost, Glacier Cherry, 20 Ounce (8 Count)",Beverages,Gatorade,Gatorade,Corporate
56264,B01LZG3MYI,"Gatorade Thirst Quencher Frost, Tropical Mango, 20 Ounce (8 Count)",Beverages,Gatorade,Gatorade,Corporate
56265,B01LZG3RYJ,"Gatorade Thirst Quencher, Citrus Cooler, 20 Ounce (8 Count)",Beverages,Gatorade,Gatorade,Corporate
56266,B01LZK70ZN,"Quaker Simply Granola, Oats, Honey, Almond and Raisin, 12 Ounce Bag",Quaker,Quaker,QK Natural Granola,Corporate
56267,B01LZRXSSW,"Gatorade Thirst Quencher Fierce, Blue Cherry, 20 Ounce (8 Count)",Beverages,Gatorade,Gatorade,Corporate
56268,B01M12QR5G,"Gatorade Thirst Quencher G2 Low Calorie, Raspberry Lemonade, 20 Fl Oz (8 Count)",Beverages,Gatorade,Gatorade,Corporate
56269,B01M12QRX7,"Gatorade Thirst Quencher Fierce, Fruit Punch and Berry, 20 Ounce (8 Count)",Beverages,Gatorade,Gatorade,Corporate
56292,B01B57EBHE,"Biscotti Brothers Bakery Pizzelle Cookie, Anise, 6 Ounce",Beverages,NEB,Izze,Corporate
56315,B01LXFWHGO,"INIT NUT & FRUIT BARS, VARIETY PACK, 12 COUNT",Quaker,Quaker,Init Bars,Corporate
56316,B01LZ5ATFX,"Init Nut and Fruit Bar, Roasted Nuts and Honey Chipotle, 4 Count",Quaker,Quaker,Init Bars,Corporate
56319,B01LZZJTEJ,"Quaker Instant Oatmeal, Limited Edition Pumpkin Spice, Breakfast Cereal, 8 Packets",Quaker,Quaker,IQO,Corporate
56322,B01LYI2SD7,"INIT NUT AND FRUIT BAR, DARK CHOCOLATE CHERRY AND CASHEWS, 4 COUNT",Quaker,Quaker,Init Bars,Corporate
56342,B01LX1RF9C,"Pop Works & Company Birthday Cake Flavored Popcorn, 8 Ounce (Pack of 4)",FLNA,FLNA,Pop Works,Corporate
56344,B01LZSFH0Q,"INIT NUT & FRUIT BARS, DARK CHOCOLATE ALMOND & SUMMER BERRIES, 12 COUNT",Quaker,Quaker,Init Bars,Corporate
56349,B01LWJ678Z,"Init Nut & Fruit Bars, Dark Chocolate Cherry & Cashews, 1.41 Oz 12 Count",Quaker,Quaker,Init Bars,Corporate
56363,B01LZ0E78O,"Life Quaker Breakfast Cereal, Limited Edition Pumpkin Spice, 18 Ounce Box",Quaker,Quaker,Life,Corporate
56367,B01LZSFKAO,"Init Nut & Fruit Bars, Mixed Nuts & Sweet Berries, 12 Count",Quaker,Quaker,Init Bars,Corporate
56369,B01M07NFPA,"Cap'N Crunch's Oops All Berries Breakfast Cereal, 15.4 Ounce",Quaker,Quaker,Cap'N Crunch,Corporate
56371,B01LZGYKUL,"INIT NUT AND FRUIT BAR, DARK CHOCOLATE ALMOND AND SUMMER BERRIES, 4 COUNT",Quaker,Quaker,Init Bars,Corporate
56375,B00HWVSMSM,"Muscle Milk Muscle Milk Pro Series Protein Shakes, Chocolate, 14 oz",Beverages,PBC,Muscle Milk,Allied
56377,B01LYTQ2O6,"Init Nut and Fruit Bar, Mixed Nuts and Sweet Berries, 4 Count",Quaker,Quaker,Init Bars,Corporate
56387,B01LWQENA3,"Cap'n Crunch Breakfast Cereal, Limited Edition Halloween Crunch, 18.6 Ounce Box",Quaker,Quaker,Cap'N Crunch,Corporate
56399,B00ADZAS1I,"O.N.E. Coconut Water, Pineapple",Beverages,PBC,ONE,Corporate
56400,B017ALAXYY,"Pure Leaf Lipton, Sweet Iced Tea",Beverages,PBC,Pure Leaf,JV
56401,B01FJWLO62,"Quaker Chocolate Chip Big Chewy Bars, 5 ct",Quaker,Quaker,Chewy,Corporate
56402,B01JH14INW,"Muscle Milk Protein Shakes, Banana Creme",Beverages,PBC,Muscle Milk,Allied
56403,B01LX4F9KW,"Gatorade Whey Protein Recover Bars, Vanilla Almond, 2.8 ounce bars (12 Count)",Beverages,Gatorade,Gatorade,Corporate
56404,B01LXICKOX,"Init Nut & Fruit Bars, Roasted Nuts & Honey Chipotle, 12 Count",Quaker,Quaker,Init Bars,Corporate
56405,B01LXSB86V,"Aquafina Water Bottle, 1 L",Beverages,PBC,Aquafina,Corporate
56406,B01LYR34WA,"Tropicana 100% Juice 3-Flavor Fruit Blend Variety Pack, 10 Fl Oz, Bottles, (Pack of 24)",Beverages,Tropicana,Tropicana,Corporate
56407,B01LZ8D2YC,"Quaker Chewy Granola Bars, Snackwich, Apples and Caramel, 5 Count",Quaker,Quaker,Chewy,Corporate
56408,B01LZKSBOM,Cheetos Chester On The Dresser Halloween Book with Chester Cheetah Stuffed Animal,FLNA,FLNA,Cheetos,Corporate
56409,B01LZO6LPR,"Propel Electrolyte Water, 33.8 oz",Beverages,Gatorade,Propel,Corporate
56410,B01LZPTXO1,"Gatorade Thirst Quencher, Endurance Formula, Lemon Lime, 24 Ounce Bottles, 12 Count",Beverages,Gatorade,Gatorade,Corporate
56411,B01M0209GY,"Gatorade Prime Fuel Bar, Peanut Butter Chocolate, 12 Count",Beverages,Gatorade,Gatorade,Corporate
56412,B01M0JBKMD,"Quaker Chewy Granola Bars, Snackwich, Peanut Butter Chocolate Chip, 5 Count",Quaker,Quaker,Chewy,Corporate
56413,B01M0PBB8T,"Gatorade Whey Protein Powder, Cookies & CrÃ¨me, 20.0 Ounce (20 servings per canister, 20 grams of protein per serving)",Beverages,Gatorade,Gatorade,Corporate
56414,B01M1DWC06,"Gatorade Thirst Quencher Powder, G2 Low Calorie, Grape, 19.4 Ounce",Beverages,Gatorade,Gatorade,Corporate
56415,B01M1OIF2K,"Gatorade Whey Protein Powder, Chocolate Caramel, 21 Ounce (20 servings per canister, 20 grams of protein per serving)",Beverages,Gatorade,Gatorade,Corporate
56416,B01M26MLTN,"Gatorade Thirst Quencher Powder, Variety Pack, 51 Ounce - 3 Count",Beverages,Gatorade,Gatorade,Corporate
56417,B01M2YBK2C,"Matador Jerky, Variety Pack, 4 Count",FLNA,FLNA,Matador,Corporate
56418,B01M3RZBFH,"Quaker Instant Oatmeal Express Cups, Variety Pack, Breakfast Cereal (12 Count)",Quaker,Quaker,IQO,Corporate
56419,B01M4I7NOP,"Gatorade Flow Thirst Quencher Variety Pack, 20 Ounce Bottles, 12 Count",Beverages,Gatorade,Gatorade,Corporate
56420,B01M4KLQ3I,"Quaker Breakfast On-The-Go Snack Box, Variety of Instant Oatmeal, Chewy Bars, Cap'n Crunch, and Life Breakfast Cereal (30 Count)",Quaker,Quaker,IQO,Corporate
56421,B01M5CEYP2,"Matador Teriyaki Jerky, 3 Ounce (Pack of 4)",FLNA,FLNA,Matador,Corporate
56422,B01M655ROO,"Matador Original Jerky, 3 Ounce (Pack of 4)",FLNA,FLNA,Matador,Corporate
56423,B01M7S9G14,"Gatorade Thirst Quencher Drink, Frost Arctic Blitz, 20 Fluid Ounce (Pack of",Beverages,Gatorade,Gatorade,Corporate
56424,B01M8JMUXJ,"Quaker Sweet & Salty All-Day Snack Box, Variety of Chewy Granola Bars, Cap'n Crunch Breakfast Cereal, and Popped Rice Crisps (50 Count)",Quaker,Quaker,Chewy,Corporate
56425,B01MAZ949Q,Diet Pepsi Classic Sweetener Blend (2 Liter Plastic Bottle),Beverages,PBC,Diet Pepsi,Corporate
56426,B01MCUR6JD,"Matador Peppered Jerky, 3 Ounce (Pack of 4)",FLNA,FLNA,Matador,Corporate
56427,B01MCW8HDD,"Gatorade Thirst Quencher Drink, Frost Icy Charge, 20 Fluid Ounce (Pack of 8)",Beverages,Gatorade,Gatorade,Corporate
56428,B000SRJSOO,"Gamesa Chocolate Sugar Wafers, 6.77 oz",Quaker,Quaker,Gamesa,Corporate
56429,B000VDRKO0,"Propel Zero Nutrient Enhanced Water Berry, 12 pk, 16.9 oz",Beverages,Gatorade,Propel,Corporate
56430,B003ZZ69I4,"Quaker Corn Meal, Yellow, 24 Oz",Quaker,Quaker,Quaker,Corporate
56431,B00CJ8IVPC,"Aunt Jemima Pancake Syrup Original, 12 oz",Quaker,Quaker,Aunt Jemima,Corporate
56432,B00BCMTSHG,"QUAKER Captain Crunch Cereal, Crunchberries, Individual Cup, 1.30 oz.",Quaker,Quaker,Cap'N Crunch,Corporate
56433,B01JS6NRJM,"Quaker Grits, Old Fashioned, 24 oz",Quaker,Quaker,Grits,Corporate
56434,B01MG5NXO7,"Starbucks Frappuccino, Mocha Light and Vanilla Light Flavors Variety Pack, 9.5 Ounce Glass Bottles, 15 Count",Beverages,PBC,Starbucks,JV
56435,B01MPWHJZT,"Propel Infused Water, Berry Mint, 12 Count",Beverages,Gatorade,Propel,Corporate
56436,B01MPWHQCE,"Propel Infused Water, Blackberry, 12 Count",Beverages,Gatorade,Propel,Corporate
56437,B01MQ0JKLI,"Propel Infused Water, Chilled Melon, 12 Count",Beverages,Gatorade,Propel,Corporate
56438,B01MQ3ZO6B,"LIFEWTR, Premium Purified Water, pH Balanced with Electrolytes For Taste, 700 mL flip cap bottles (Pack of 12) (Packaging May Vary)",Beverages,PBC,LIFEWTR,Corporate
56439,B01G7S0724,"Gatorade Thirst Quencher, Frost Icy Charge, 20 Ounce",Beverages,Gatorade,Gatorade,Corporate
56469,B01CLJ09E4,"HEALTH WARRIOR CHIA BARS, DARK CHOCOLATE, 13.2 OUNCE, (PACK OF 15)",Hive,Hive Foods,Health Warrior,Corporate
56483,B01FUI2MXY,"BARE NATURAL CHOCOLATE COCONUT CHIPS, GLUTEN FREE + BAKED, 2.8 OUNCE (6 COU",FLNA,FLNA,Bare Snacks,Corporate
56505,B01MQENMDG,"Quaker Breakfast Squares, Soft Baked Bars, Apple Cinnamon, 5 Bars (Pack of 8)",Quaker,Quaker,QK Breakfast Squares,Corporate
56506,B01MTKDON8,"Quaker Life Cereal, Cinnamon, 18 Ounce",Quaker,Quaker,Life,Corporate
56507,B01MXCU55A,"Quaker Breakfast Squares, Soft Baked Bars, Strawberry, 5 Bars (Pack of 8)",Quaker,Quaker,QK Breakfast Squares,Corporate
56508,B01N019I03,"Quaker Breakfast Squares, Soft Baked Bars, Peanut Butter, 5 Bars (Pack of 8)",Quaker,Quaker,QK Breakfast Squares,Corporate
56509,B01N02BKRT,"Quaker Real Medleys Super Grains Granola, Blueberry Pecan, 11 Ounces",Quaker,Quaker,Quaker Medleys,Corporate
56539,B00005LBAI,"Pepsi, Wild Cherry, 20oz Bottle",Beverages,PBC,Pepsi,Corporate
56540,B0005YMWDY,"Starbucks Frappuccino, Mocha, 9.5 Ounce Glass Bottle",Beverages,PBC,Starbucks,JV
56541,B0005YW9BO,"Starbucks Frappuccino, Vanilla 9.5 Ounce Glass Bottle",Beverages,PBC,Starbucks,JV
56542,B003EGXPFE,"Lipton Diet Ice Tea, Diet Green Tea with Citrus, 20oz Bottle",Beverages,PBC,Diet Lipton,JV
56543,B0040HHD3Q,"Pepsi, Cherry Vanilla, 20oz Bottle",Beverages,PBC,Pepsi,Corporate
56544,B00FFJ53TY,"Lipton Ice Tea, Lemon, 20oz Bottle",Beverages,PBC,Lipton,JV
56545,B019YATJEE,"Starbucks Frappuccino, Mocha Light, 9.5 Ounce Glass Bottle",Beverages,PBC,Starbucks,JV
56546,B01MQL2RSK,"Lipton Ice Tea, Half & Half Iced Tea with Lemonade, 20oz Bottle",Beverages,PBC,Lipton,JV
56547,B01MRM032F,"Pure Leaf Iced Tea, Green Tea, Unsweetened, 18.5oz Bottle",Beverages,PBC,Pure Leaf,JV
56548,B01MRMENKT,"Pepsi Zero Sugar, 20oz Bottle",Beverages,PBC,Diet Pepsi,Corporate
56549,B01MSO2BSZ,"Mist TWST, Lemon Lime Soda, 20oz Bottle",Beverages,PBC,Mist Twist,Corporate
56550,B01MYODWSF,"Mountain Dew Black Label, Dark Berry, 16oz Can",Beverages,PBC,Mountain Dew,Corporate
56551,B01MYODXBL,"Mountain Dew Kickstart, Energizing Midnight Grape, 16oz Can",Beverages,PBC,Mountain Dew Kickstart,Corporate
56552,B01N0F3DJI,"Quaker Instant Oatmeal, Bring Your Best Bowl, 9 Count (Pack of 12)",Quaker,Quaker,IQO,Corporate
56553,B01N1HB7GQ,"Lipton Ice Tea, Peach, 20oz Bottle",Beverages,PBC,Lipton,JV
56554,B01N42WABC,"Mug Root Beer, 20oz Bottle",Beverages,PBC,Mug,Corporate
56555,B01N53VT9G,"Aquafina Water, 20oz Bottle",Beverages,PBC,Aquafina,Corporate
56556,B01N53ZD32,"Pure Leaf Iced Tea, Unsweetened Black Tea with Lemon, 18.5oz Bottle",Beverages,PBC,Pure Leaf,JV
56557,B01N54DRQA,"Starbucks Frappuccino, Caramel, 9.5 Ounce Glass Bottle",Beverages,PBC,Starbucks,JV
56558,B01N65E75G,"Starbucks Iced Coffee, Black Unsweetened, 11oz Bottle",Beverages,PBC,Starbucks,JV
56559,B01N65EOQW,"Starbucks Iced Coffee, Black Sweetened, 11oz Bottle",Beverages,PBC,Starbucks,JV
56560,B01N65SPOD,"Mountain Dew, 20oz Bottle",Beverages,PBC,Mountain Dew,Corporate
56561,B01N65STSA,"Lipton Ice Tea, Green Tea with Citrus, 20oz Bottle",Beverages,PBC,Lipton,JV
56646,B01MTTTJDX,"Funyuns Onion Flavored Rings, 12 Count, 9 Ounce",FLNA,FLNA,Funyuns,Corporate
56647,B01N2N7TXM,"Quaker Popped Rice Crips Snacks, Gluten Free, Sour Cream & Onion, 3.03 Ounce (Pack of 12)",Quaker,Quaker,POPPED,Corporate
56648,B00E5QL28O,"Diet Pepsi, 20oz Bottle",Beverages,PBC,Diet Pepsi,Corporate
56649,B01H05PWBE,"Quaker Popped Rice Crips, Gluten Free, Ranch, Small Bag, 3.03 Ounce (Pack of 12)",Quaker,Quaker,POPPED,Corporate
56650,B00OE1UUYW,"Lay's Potato Chips, Classic, 12 Count, 12 Ounce",FLNA,FLNA,Lay's,Corporate
56651,B01N47AA9L,"Quaker Popped Rice Crips Snacks, Gluten Free, Savory Snack Mix, 0.67 Ounce (8 Bags)",Quaker,Quaker,POPPED,Corporate
56652,B01MSSGPWW,"Quaker Popped Rice Crips Snacks, Gluten Free, Cheddar Cheese, 3.03 Ounce (Pack of 12)",Quaker,Quaker,POPPED,Corporate
56653,B01MYT2O7U,"Quaker Popped Rice Crisps Snacks, Gluten Free, Sweet Chili, 3 Ounce (Pack of 12)",Quaker,Quaker,POPPED,Corporate
56654,B01H05PWDC,"Quaker Popped Rice Crips, Gluten Free, Chocolate, Small Bag, 3.52 Ounce (Pack of 12)",Quaker,Quaker,POPPED,Corporate
56655,B01N1LOCZQ,"Quaker Popped Rice Crips Snacks, Gluten Free, Sea Salt & Cracked Pepper Flavor, 3 Ounce (Pack of 12)",Quaker,Quaker,POPPED,Corporate
56656,B01N0K6Y6V,"Quaker Popped Rice Crips Snacks, Gluten Free, Barbecue, 3.03 Ounce (Pack of 12)",Quaker,Quaker,POPPED,Corporate
56657,B01MRMF8CA,"Stacy's Pita Chips, Gingerbread, 7.33 oz (Pack of 12)",FLNA,FLNA,Stacy's,Corporate
56658,B01N7BKM3L,"Quaker Popped Rice Crips Snacks, Gluten Free, Sweet Snack Mix, 0.91 Ounce (8 Bags)",Quaker,Quaker,POPPED,Corporate
56659,B01N58KJRS,"Santitas Tortilla Chips, Yellow Corn, 11 Ounce (Pack of 10)",FLNA,FLNA,Santitas,Corporate
56660,B01N7CYVTI,"Stacy's Pita Chips, Gingerbread, 7.33 Ounce",FLNA,FLNA,Stacy's,Corporate
56661,B01MTW73ZG,"Cheetos Oven Baked Crunchy Cheese Flavored Snacks, 0.875 Ounce (Pack of 104)",FLNA,FLNA,Baked,Corporate
56662,B01N0K6XY9,"Quaker Popped Rice Crips Snacks, Gluten Free, Apple Cinnamon, 3.52 Ounce (Pack of 12)",Quaker,Quaker,POPPED,Corporate
56663,B01MQWC1FA,"Frito-Lay Party Pack, Chips and Dips Variety Box, 5 Count",FLNA,FLNA,FL VP/MP,Corporate
56664,B00ZGTBBD0,"Doritos Nacho Cheese Flavored Tortilla Chips, 9.75 Ounce",FLNA,FLNA,Doritos,Corporate
56665,B00535V920,"Mountain Dew Pitch Black, 12 ct",Beverages,PBC,Mountain Dew,Corporate
56666,B01F6FEKMW,"Gatorade Frost Icy Charge, 32oz",Beverages,Gatorade,Gatorade,Corporate
56667,B01MSZE1NQ,"Quaker Breakfast Squares, Soft Baked Bars, Variety Pack (4 Count)",Quaker,Quaker,QK Breakfast Squares,Corporate
56668,B01NA7685M,"Diet Mist TWST, Lemon Lime Soda, 20oz Bottle",Beverages,PBC,Diet Mist Twst,Corporate
56669,B01F6FCDPS,"Gatorade Frost Arctic Blitz, 32oz",Beverages,Gatorade,Gatorade,Corporate
56670,B01N4GA7R0,"Cap'n Crunch Snack Pouches, Sprinkled Donut Crunch .99 oz,8 count",Quaker,Quaker,Cap'N Crunch,Corporate
56671,B01MXZW10A,"Matador Meat Snacks, Teriyaki, 3 Ounce",FLNA,FLNA,Matador,Corporate
56672,B01MS0MNP1,"Dr. Pepper Soda Drink Bottle, 20 oz",Beverages,PBC,SoBe,Corporate
56673,B01NAK1UH9,"Lay's Barbecue Flavored Family Size Potato Chips, 9.5 Ounce",FLNA,FLNA,Lay's,Corporate
56674,B01N7K4H2C,"Doritos Jacked Ranch Dipped Hot Wings, 9.25 Ounce",FLNA,FLNA,Doritos,Corporate
56675,B01N0SS86Y,"Doritos Cool Ranch Flavored  Tortilla Chips, Party Size! (15 Ounce)",FLNA,FLNA,Doritos,Corporate
56676,B01MZ1P4US,"Lay's Wavy Original Family Size Potato Chips, 10 Ounce",FLNA,FLNA,Lay's,Corporate
56677,B01N9JTY6D,"Mountain Dew Voltage, 2 l",Beverages,PBC,Mountain Dew,Corporate
56678,B01N0SS3EH,"Doritos Cool Ranch Flavored Tortilla Chips, 9.75 Ounce",FLNA,FLNA,Doritos,Corporate
56679,B01MZ1P203,"Doritos Mix, Cheese Explosion, 9.25 Ounce",FLNA,FLNA,Doritos,Corporate
56680,B01MY05STQ,"Doritos Spicy Nacho Flavored Tortilla Chips, 9.75 Ounce",FLNA,FLNA,Doritos,Corporate
56681,B01MSZZ244,"Gatorade Recover Protein Shakes, Variety Pack, 11.16 Ounce, 12 Count",Beverages,Gatorade,Gatorade,Corporate
56682,B01NBM66KL,"Cap'N Crunch Breakfast Cereal, Variety Pack, 14 oz (4 Count)",Quaker,Quaker,Cap'N Crunch,Corporate
56683,B01K9AFGKO,"Lay's Classic Family Size Potato Chips, 10 Ounce",FLNA,FLNA,Lay's,Corporate
56684,B01M3VZX0K,"Lay's Sour Cream & Onion Flavored Family Size Potato Chips, 9.5 Ounce",FLNA,FLNA,Lay's,Corporate
56685,B01MY05SIB,"Smartfood Spicy JalapeÃ±o Ranch Flavored Popcorn, 7 Ounce",FLNA,FLNA,Smartfood,Corporate
56686,B003IDYD8G,"Dr. Pepper Diet Soda Drink Bottle, 20 oz",Beverages,PBC,SoBe,Corporate
56687,B01MT104SI,"Smartfood Delight White Cheddar Flavored Popcorn, 6 Ounce",FLNA,FLNA,Smartfood,Corporate
56688,B01N5HBX8K,"Smartfood Sweet & Salty Kettle Corn Flavored Popcorn, 10 Ounce",FLNA,FLNA,Smartfood,Corporate
56689,B01N0SS46Z,"Lay's Classic  Potato Chips, Party Size! (15.25 Ounce)",FLNA,FLNA,Lay's,Corporate
56690,B01NAL40FZ,"Smartfood Delights Sea Salted Popcorn, Party Size! (6 Ounce)",FLNA,FLNA,Smartfood,Corporate
56691,B01MT1040F,"Smartfood Delights Sea Salted Caramel Flavored Popcorn, 5 Ounce",FLNA,FLNA,Smartfood,Corporate
56692,B01N0SS68I,"Lay's Sour Cream & Onion  Potato Chips, Party Size! (14.75 Ounce)",FLNA,FLNA,Lay's,Corporate
56693,B01M8PAM3L,"Smartfood White Cheddar Flavored Popcorn, 8.5 Ounce",FLNA,FLNA,Smartfood,Corporate
56694,B01N7K4JC8,"Lay's Wavy Original  Potato Chips, Party Size! (15.25 Ounce)",FLNA,FLNA,Lay's,Corporate
56695,B01MZ1P39M,"Doritos Tortilla Chips, Taco, 9.5 Ounce",FLNA,FLNA,Doritos,Corporate
56696,B01MRZZ3KC,"Quaker Chewy Granola Bars, Chocolate Chip, 0.84 Ounce Bars, 58 Count",Quaker,Quaker,Chewy,Corporate
56697,B01N1U94KP,"Smartfood Delights Sea Salted Popcorn, 5 Ounce",FLNA,FLNA,Smartfood,Corporate
56698,B01MZ1P39R,"Doritos Mix, Taco Explosion, 9.25 Ounce",FLNA,FLNA,Doritos,Corporate
56699,B01MRZBLVV,"Lay's Lightly Salted Potato Chips, 9.5 Ounce",FLNA,FLNA,Lay's,Corporate
56700,B01MY05VMH,"Doritos Spicy Sweet Chili Flavored Tortilla Chips, 9.75 Ounce",FLNA,FLNA,Doritos,Corporate
56701,B01MY05VGS,"Doritos Nacho Cheese Flavored  Tortilla Chips, Party Size! (15 Ounce)",FLNA,FLNA,Doritos,Corporate
56776,B003H5783W,"GRANDMA WILD'S ALL BUTTER SHORTBREAD MELTS COOKIES BOX, 150G",Quaker,Quaker,Quaker,Corporate
56861,B01B57EBFG,"BISCOTTI BROTHERS BAKERY PIZZELLE COOKIE, VANILLA, 6 OUNCE",Beverages,NEB,Izze,Corporate
57005,B01FUI2N2Y,"BARE NATURAL COCONUT CHIPS, SWEET & HEAT, GLUTEN FREE + BAKED, 3.3 OUNCE (6",FLNA,FLNA,Bare Snacks,Corporate
57109,B01N7PAEIU,"G Organic, Variety Pack, Gatorade Sports Drink, Organic Hydration, USDA Certified Organic, 16.9 Fl Oz. Bottle, 12 Count",Beverages,Gatorade,Gatorade,Corporate
57110,B01MZ8T17P,Frito-Lay Chips and Dip Party Mix Variety Pack,FLNA,FLNA,FL VP/MP,Corporate
57111,B0040PXCS8,"Aquafina Water, 12 ct",Beverages,PBC,Aquafina,Corporate
57112,B01N4LAZ1L,"Tostitos Cantina Chipotle Thins Tortilla Chips, 9 Ounce",FLNA,FLNA,Tostitos,Corporate
57113,B01N4LB3BB,"IZZE Sparkling Juice, Peach, 8.4 oz Cans, 24 Count",Beverages,NEB,Izze,Corporate
57114,B01NALEPG6,"LIFEWTR, Premium Purified Water, pH Balanced with Electrolytes For Taste, 700 mL flip cap bottle (Packaging May Vary)",Beverages,PBC,LIFEWTR,Corporate
57115,B01N4OXQ3R,"Lay's Classic  Potato Chips, Party Size! (15.25 Ounce)",FLNA,FLNA,Lay's,Corporate
57116,B01MZ20P60,"Starbucks Frappuccino Coffee Drink, Caramel, 4 ct",Beverages,PBC,Starbucks,JV
57117,B01N11TDUF,"Doritos Nacho Cheese Flavored  Tortilla Chips, Party Size! (15 Ounce)",FLNA,FLNA,Doritos,Corporate
57118,B01N5Q8Y6H,"Doritos Cool Ranch Flavored  Tortilla Chips, Party Size! (15 Ounce)",FLNA,FLNA,Doritos,Corporate
57119,B01N7PE88I,"Santitas Yellow Corn Tortilla Chips, 11 Ounce",FLNA,FLNA,Santitas,Corporate
57120,B01N23A83E,"Doritos Spicy Nacho Flavored Tortilla Chips, 9.75 Ounce",FLNA,FLNA,Doritos,Corporate
57121,B01N4OXFBG,"Doritos Nacho Cheese Flavored Tortilla Chips, 9.75 Ounce",FLNA,FLNA,Doritos,Corporate
57122,B01N7LXG89,"Matador Teriyaki Jerky, 4 Count",FLNA,FLNA,Matador,Corporate
57123,B01N23AAHU,"Smartfood Delights Sea Salted Caramel Flavored Popcorn, 5 Ounce",FLNA,FLNA,Smartfood,Corporate
57124,B01MS8BESX,"Smartfood Delight White Cheddar Flavored Popcorn, 6 Ounce",FLNA,FLNA,Smartfood,Corporate
57125,B01N4HQ2N6,"Matador Original Jerky, 4 Count",FLNA,FLNA,Matador,Corporate
57126,B01MT9YKOM,"Lay's Wavy Original Family Size Potato Chips, 10 Ounce",FLNA,FLNA,Lay's,Corporate
57127,B01NBVMFEQ,"Lay's Sour Cream & Onion Flavored Family Size Potato Chips, 9.5 Ounce",FLNA,FLNA,Lay's,Corporate
57128,B01NBODKLT,"Matador Jerky Variety Pack, 4 Count",FLNA,FLNA,Matador,Corporate
57129,B01MZANFMW,"Doritos Mix Cheese Explosion Flavored Tortilla Snacks, 9.25 Ounce",FLNA,FLNA,Doritos,Corporate
57130,B01MY9522Z,"Smartfood White Cheddar Flavored Popcorn, 8.5 Ounce",FLNA,FLNA,Smartfood,Corporate
57131,B01MS8B2RX,"Doritos Cool Ranch Flavored Tortilla Chips, 9.75 Ounce",FLNA,FLNA,Doritos,Corporate
57132,B01MR6VO31,"Lay's Lightly Salted Potato Chips, 9.5 Ounce",FLNA,FLNA,Lay's,Corporate
57133,B01NBVMEX2,"Smartfood Delights Sea Salted Popcorn, 5 Ounce",FLNA,FLNA,Smartfood,Corporate
57134,B01N7T2S72,"Lay's Barbecue Flavored  Potato Chips, Party Size! (14.75 Ounce)",FLNA,FLNA,Lay's,Corporate
57135,B01MY5IR5X,"Lay's Classic Potato Chips, 12 Singles",FLNA,FLNA,Lay's,Corporate
57136,B01N6RTYCD,"Doritos Mix Taco Explosion Flavored Tortilla Snacks, 9.25 Ounce",FLNA,FLNA,Doritos,Corporate
57137,B01MT9YL34,"Doritos Jacked Ranch Dipped Hot Wings Flavored Tortilla Chips, 9.25 Ounce",FLNA,FLNA,Doritos,Corporate
57138,B01MS8BDSV,"Lay's Sour Cream & Onion  Potato Chips, Party Size! (14.75 Ounce)",FLNA,FLNA,Lay's,Corporate
57139,B01MUBLOK1,"Lay's Barbecue Flavored Family Size Potato Chips, 9.5 Ounce",FLNA,FLNA,Lay's,Corporate
57140,B01MSBSBOB,"Nut Harvest Dark Chocolate Almond Toffee Bites, 16 Count",FLNA,FLNA,Nut Harvest,Corporate
57141,B01N4OXFBM,"Smartfood Sweet & Salted Kettle Corn Flavored Popcorn, 10 Ounce",FLNA,FLNA,Smartfood,Corporate
57142,B01MT2SJRP,"Matador Peppered Jerky, 4 Count",FLNA,FLNA,Matador,Corporate
57143,B01NBVMHD9,"Doritos Spicy Sweet Chili Flavored Tortilla Chips, 9.75 Ounce",FLNA,FLNA,Doritos,Corporate
57144,B01MT9YJCC,"Smartfood Delights Sea Salted Popcorn, Party Size! (6 Ounce)",FLNA,FLNA,Smartfood,Corporate
57145,B01N7T2N7F,"Smartfood Spicy JalapeÃ±o Ranch Flavored Popcorn, 7 Ounce",FLNA,FLNA,Smartfood,Corporate
57146,B01MY94XG5,"Lay's Wavy Original  Potato Chips, Party Size! (15.25 Ounce)",FLNA,FLNA,Lay's,Corporate
57147,B01N5Q8XUZ,"Doritos Taco Flavored Tortilla Chips, 9.75 Ounce",FLNA,FLNA,Doritos,Corporate
57148,B01N6O0288,"Smartfood White Cheddar Flavored Popcorn, 12 Singles",FLNA,FLNA,Smartfood,Corporate
57149,B01MZANU7D,"Lay's Classic Family Size Potato Chips, 10 Ounce",FLNA,FLNA,Lay's,Corporate
57253,B01N9OJ2AP,"LIFEWTR, Premium Purified Water, pH Balanced with Electrolytes For Taste, 1 liter bottles (Pack of 6) (Packaging May Vary)",Beverages,PBC,LIFEWTR,Corporate
57256,B01N25ZW7I,"Pure Leaf Iced Tea, Pomegranate, Real Brewed Tea, 18.5 Ounce (Pack of 12)",Beverages,PBC,Pure Leaf,JV
57257,B01NCZGL78,"Pepsi Cola 1893, 4 Flavor Variety Pack - Original, Ginger, Citrus & Black Currant Cola Flavors - Certified Fair Trade Sugar, Real Kola Nut Extract (12 Ounce Cans, 12 Count)",Beverages,PBC,Pepsi,Corporate
57258,B01N5SZ2DV,Gatorade 15 Piece Original Thirst Quencher Variety Pack,Beverages,Gatorade,Gatorade,Corporate
57259,B01JS6NRQ0,"Quaker Instant Oatmeal Weight Control, Flavor Variety Pack, 12.6 oz",Quaker,Quaker,IQO,Corporate
57260,B01N7VQATH,"Mountain Dew Kickstart Hydrating Boost, Raspberry Citrus & Pineapple Orange Mango Variety Pack, 12 Ounce (Pack of 12)",Beverages,PBC,Mountain Dew Kickstart,Corporate
57261,B01N5TYETX,"Doritos Flavored Tortilla Chips, Variety Pack, 10 Ounce, 4 Count",FLNA,FLNA,Doritos,Corporate
57262,B01NCZOBC3,"Pure Leaf Iced Tea, Mint, Real Brewed Tea, 18.5 Ounce (Pack of 12)",Beverages,PBC,Pure Leaf,JV
57263,B01NAWPLLM,"Mountain Dew Kickstart Recharge, Blueberry Pomegranate & Blood Orange Variety Pack, 12 Ounce (Pack of 12)",Beverages,PBC,Mountain Dew Kickstart,Corporate
